Sheet: Emoji List with Description
A1: № | B1: Emoji | C1: Brow. | D1: Description | E1: Aliases | F1: Tags | G1: Sentiment Rank
A2: 1 | B2: U+1F600 | C2: 😀 | D2: GRINNING FACE | F2: face, grin, person
A3: =1+R[-1]C -> 2 | B3: U+1F601 | C3: 😁 | D3: GRINNING FACE WITH SMILING EYES | F3: eye, face, grin, person, smile
A4: =1+R[-1]C -> 3 | B4: U+1F602 | C4: 😂 | D4: FACE WITH TEARS OF JOY | F4: face, joy, laugh, person, tear
A5: =1+R[-1]C -> 4 | B5: U+1F603 | C5: 😃 | D5: SMILING FACE WITH OPEN MOUTH | F5: face, mouth, open, person, smile
A6: =1+R[-1]C -> 5 | B6: U+1F604 | C6: 😄 | D6: SMILING FACE WITH OPEN MOUTH AND SMILING EYES | F6: eye, face, mouth, open, person, smile
A7: =1+R[-1]C -> 6 | B7: U+1F605 | C7: 😅 | D7: SMILING FACE WITH OPEN MOUTH AND COLD SWEAT | F7: cold, face, open, person, smile, sweat
A8: =1+R[-1]C -> 7 | B8: U+1F606 | C8: 😆 | D8: SMILING FACE WITH OPEN MOUTH AND TIGHTLY-CLOSED EYES | F8: face, laugh, mouth, open, person,satisfied, smile
A9: =1+R[-1]C -> 8 | B9: U+1F609 | C9: 😉 | D9: WINKING FACE | F9: face, person, wink
A10: =1+R[-1]C -> 9 | B10: U+1F60A | C10: 😊 | D10: SMILING FACE WITH SMILING EYES | F10: blush, eye, face, person, smile
A11: =1+R[-1]C -> 10 | B11: U+1F60B | C11: 😋 | D11: FACE SAVOURING DELICIOUS FOOD | F11: delicious, face, food, person, savouring,smile, um, yum
A12: =1+R[-1]C -> 11 | B12: U+1F60E | C12: 😎 | D12: SMILING FACE WITH SUNGLASSES | F12: bright, cool, eye, eyewear, face, glasses,person, smile, sun, sunglasses, weather
A13: =1+R[-1]C -> 12 | B13: U+1F60D | C13: 😍 | D13: SMILING FACE WITH HEART-SHAPED EYES | F13: eye, face, heart, love, person, smile
A14: =1+R[-1]C -> 13 | B14: U+1F618 | C14: 😘 | D14: FACE THROWING A KISS | F14: face, heart, kiss, person
A15: =1+R[-1]C -> 14 | B15: U+1F617 | C15: 😗 | D15: KISSING FACE | F15: face, kiss, person
A16: =1+R[-1]C -> 15 | B16: U+1F619 | C16: 😙 | D16: KISSING FACE WITH SMILING EYES | F16: eye, face, kiss, person, smile
A17: =1+R[-1]C -> 16 | B17: U+1F61A | C17: 😚 | D17: KISSING FACE WITH CLOSED EYES | F17: closed, eye, face, kiss, person
A18: =1+R[-1]C -> 17 | B18: U+263A | C18: ☺️ | D18: WHITE SMILING FACE | F18: face, outlined, person, relaxed, smile
A19: =1+R[-1]C -> 18 | B19: U+1F642 | C19: 🙂 | D19: SLIGHTLY SMILING FACE | F19: face, person, smile
A20: =1+R[-1]C -> 19 | B20: U+1F917 | C20: 🤗 | D20: HUGGING FACE | F20: face, hug, hugging, person
A21: =1+R[-1]C -> 20 | B21: U+1F607 | C21: 😇 | D21: SMILING FACE WITH HALO | F21: angel, face, fairy tale, fantasy, halo,innocent, person, smile
A22: =1+R[-1]C -> 21 | B22: U+1F914 | C22: 🤔 | D22: THINKING FACE | F22: face, person, thinking
A23: =1+R[-1]C -> 22 | B23: U+1F610 | C23: 😐 | D23: NEUTRAL FACE | F23: deadpan, face, neutral, person
A24: =1+R[-1]C -> 23 | B24: U+1F611 | C24: 😑 | D24: EXPRESSIONLESS FACE | F24: expressionless, face, inexpressive,person, unexpressive
A25: =1+R[-1]C -> 24 | B25: U+1F636 | C25: 😶 | D25: FACE WITHOUT MOUTH | F25: face, mouth, person, quiet, silent
A26: =1+R[-1]C -> 25 | B26: U+1F644 | C26: 🙄 | D26: FACE WITH ROLLING EYES | F26: eyes, face, person, rolling
A27: =1+R[-1]C -> 26 | B27: U+1F60F | C27: 😏 | D27: SMIRKING FACE | F27: face, person, smirk
A28: =1+R[-1]C -> 27 | B28: U+1F623 | C28: 😣 | D28: PERSEVERING FACE | F28: face, persevere, person
A29: =1+R[-1]C -> 28 | B29: U+1F625 | C29: 😥 | D29: DISAPPOINTED BUT RELIEVED FACE | F29: disappointed, face, person, relieved,whew
A30: =1+R[-1]C -> 29 | B30: U+1F62E | C30: 😮 | D30: FACE WITH OPEN MOUTH | F30: face, mouth, open, person, sympathy
A31: =1+R[-1]C -> 30 | B31: U+1F910 | C31: 🤐 | D31: ZIPPER-MOUTH FACE | F31: face, mouth, person, zipper
A32: =1+R[-1]C -> 31 | B32: U+1F62F | C32: 😯 | D32: HUSHED FACE | F32: face, hushed, person, stunned, surprised
A33: =1+R[-1]C -> 32 | B33: U+1F62A | C33: 😪 | D33: SLEEPY FACE | F33: face, person, sleep
A34: =1+R[-1]C -> 33 | B34: U+1F62B | C34: 😫 | D34: TIRED FACE | F34: face, person, tired
A35: =1+R[-1]C -> 34 | B35: U+1F634 | C35: 😴 | D35: SLEEPING FACE | F35: face, person, sleep, zzz
A36: =1+R[-1]C -> 35 | B36: U+1F60C | C36: 😌 | D36: RELIEVED FACE | F36: face, person, relieved
A37: =1+R[-1]C -> 36 | B37: U+1F913 | C37: 🤓 | D37: NERD FACE | F37: face, geek, nerd, person
A38: =1+R[-1]C -> 37 | B38: U+1F61B | C38: 😛 | D38: FACE WITH STUCK-OUT TONGUE | F38: face, person, tongue
A39: =1+R[-1]C -> 38 | B39: U+1F61C | C39: 😜 | D39: FACE WITH STUCK-OUT TONGUE AND WINKING EYE | F39: eye, face, joke, person, tongue, wink
A40: =1+R[-1]C -> 39 | B40: U+1F61D | C40: 😝 | D40: FACE WITH STUCK-OUT TONGUE AND TIGHTLY-CLOSED EYES | F40: eye, face, horrible, person, taste, tongue
A41: =1+R[-1]C -> 40 | B41: U+2639 | C41: ☹ | D41: WHITE FROWNING FACE | F41: face, frown, person
A42: =1+R[-1]C -> 41 | B42: U+1F641 | C42: 🙁 | D42: SLIGHTLY FROWNING FACE | F42: face, frown, person
A43: =1+R[-1]C -> 42 | B43: U+1F612 | C43: 😒 | D43: UNAMUSED FACE | F43: face, person, unamused, unhappy
A44: =1+R[-1]C -> 43 | B44: U+1F613 | C44: 😓 | D44: FACE WITH COLD SWEAT | F44: cold, face, person, sweat
A45: =1+R[-1]C -> 44 | B45: U+1F614 | C45: 😔 | D45: PENSIVE FACE | F45: dejected, face, pensive, person
A46: =1+R[-1]C -> 45 | B46: U+1F615 | C46: 😕 | D46: CONFUSED FACE | F46: confused, face, person
A47: =1+R[-1]C -> 46 | B47: U+1F616 | C47: 😖 | D47: CONFOUNDED FACE | F47: confounded, face, person
A48: =1+R[-1]C -> 47 | B48: U+1F643 | C48: 🙃 | D48: UPSIDE-DOWN FACE | F48: face, person, upside-down
A49: =1+R[-1]C -> 48 | B49: U+1F637 | C49: 😷 | D49: FACE WITH MEDICAL MASK | F49: cold, doctor, face, mask, medicine,person, sick
A50: =1+R[-1]C -> 49 | B50: U+1F912 | C50: 🤒 | D50: FACE WITH THERMOMETER | F50: face, ill, person, sick, thermometer
A51: =1+R[-1]C -> 50 | B51: U+1F915 | C51: 🤕 | D51: FACE WITH HEAD-BANDAGE | F51: bandage, face, hurt, injury, person
A52: =1+R[-1]C -> 51 | B52: U+1F911 | C52: 🤑 | D52: MONEY-MOUTH FACE | F52: face, money, mouth, person
A53: =1+R[-1]C -> 52 | B53: U+1F632 | C53: 😲 | D53: ASTONISHED FACE | F53: astonished, face, person, shocked, totally
A54: =1+R[-1]C -> 53 | B54: U+1F61E | C54: 😞 | D54: DISAPPOINTED FACE | F54: disappointed, face, person
A55: =1+R[-1]C -> 54 | B55: U+1F61F | C55: 😟 | D55: WORRIED FACE | F55: face, person, worried
A56: =1+R[-1]C -> 55 | B56: U+1F624 | C56: 😤 | D56: FACE WITH LOOK OF TRIUMPH | F56: face, person, triumph, won
A57: =1+R[-1]C -> 56 | B57: U+1F622 | C57: 😢 | D57: CRYING FACE | F57: cry, face, person, sad, tear
A58: =1+R[-1]C -> 57 | B58: U+1F62D | C58: 😭 | D58: LOUDLY CRYING FACE | F58: cry, face, person, sad, sob, tear
A59: =1+R[-1]C -> 58 | B59: U+1F626 | C59: 😦 | D59: FROWNING FACE WITH OPEN MOUTH | F59: face, frown, mouth, open, person
A60: =1+R[-1]C -> 59 | B60: U+1F627 | C60: 😧 | D60: ANGUISHED FACE | F60: anguished, face, person
A61: =1+R[-1]C -> 60 | B61: U+1F628 | C61: 😨 | D61: FEARFUL FACE | F61: face, fear, fearful, person, scared
A62: =1+R[-1]C -> 61 | B62: U+1F629 | C62: 😩 | D62: WEARY FACE | F62: face, person, tired, weary
A63: =1+R[-1]C -> 62 | B63: U+1F62C | C63: 😬 | D63: GRIMACING FACE | F63: face, grimace, person
A64: =1+R[-1]C -> 63 | B64: U+1F630 | C64: 😰 | D64: FACE WITH OPEN MOUTH AND COLD SWEAT | F64: blue, cold, face, mouth, open, person,rushed, sweat
A65: =1+R[-1]C -> 64 | B65: U+1F631 | C65: 😱 | D65: FACE SCREAMING IN FEAR | F65: face, fear, fearful, munch, person, scared,scream
A66: =1+R[-1]C -> 65 | B66: U+1F633 | C66: 😳 | D66: FLUSHED FACE | F66: dazed, face, flushed, person
A67: =1+R[-1]C -> 66 | B67: U+1F635 | C67: 😵 | D67: DIZZY FACE | F67: dizzy, face, person
A68: =1+R[-1]C -> 67 | B68: U+1F621 | C68: 😡 | D68: POUTING FACE | F68: angry, face, mad, person, pouting, rage,red
A69: =1+R[-1]C -> 68 | B69: U+1F620 | C69: 😠 | D69: ANGRY FACE | F69: angry, face, mad, person
A70: =1+R[-1]C -> 69 | B70: U+1F608 | C70: 😈 | D70: SMILING FACE WITH HORNS | F70: face, fairy tale, fantasy, horns, person,smile
A71: =1+R[-1]C -> 70 | B71: U+1F47F | C71: 👿 | D71: IMP | F71: demon, devil, face, fairy tale, fantasy,imp, person
A72: =1+R[-1]C -> 71 | B72: U+1F479 | C72: 👹 | D72: JAPANESE OGRE | F72: creature, face, fairy tale, fantasy,japanese, monster, ogre, person
A73: =1+R[-1]C -> 72 | B73: U+1F47A | C73: 👺 | D73: JAPANESE GOBLIN | F73: creature, face, fairy tale, fantasy, goblin,japanese, monster, person
A74: =1+R[-1]C -> 73 | B74: U+1F480 | C74: 💀 | D74: SKULL | F74: body, death, face, fairy tale, monster,person, skull
A75: =1+R[-1]C -> 74 | B75: U+2620 | C75: ☠ | D75: SKULL AND CROSSBONES | F75: body, crossbones, death, face, monster,person, skull
A76: =1+R[-1]C -> 75 | B76: U+1F47B | C76: 👻 | D76: GHOST | F76: creature, face, fairy tale, fantasy, ghost,monster, person
A77: =1+R[-1]C -> 76 | B77: U+1F47D | C77: 👽 | D77: EXTRATERRESTRIAL ALIEN alien | F77: alien, creature, extraterrestrial, face, fairy tale, fantasy, monster, nature, person,space, ufo
A78: =1+R[-1]C -> 77 | B78: U+1F47E | C78: 👾 | D78: ALIEN MONSTER | F78: alien, creature, extraterrestrial, face, fairy tale, fantasy, monster, nature, person,space, ufo
A79: =1+R[-1]C -> 78 | B79: U+1F916 | C79: 🤖 | D79: ROBOT FACE | F79: face, monster, person, robot
A80: =1+R[-1]C -> 79 | B80: U+1F4A9 | C80: 💩 | D80: PILE OF POO | F80: comic, dung, face, monster, nature,object, poo, poop
A81: =1+R[-1]C -> 80 | B81: U+1F63A | C81: 😺 | D81: SMILING CAT FACE WITH OPEN MOUTH | F81: animal, cat, face, mouth, nature, open,smile
A82: =1+R[-1]C -> 81 | B82: U+1F638 | C82: 😸 | D82: GRINNING CAT FACE WITH SMILING EYES | F82: animal, cat, eye, face, grin, nature, smile
A83: =1+R[-1]C -> 82 | B83: U+1F639 | C83: 😹 | D83: CAT FACE WITH TEARS OF JOY | F83: animal, cat, face, joy, nature, tear
A84: =1+R[-1]C -> 83 | B84: U+1F63B | C84: 😻 | D84: SMILING CAT FACE WITH HEART-SHAPED EYES | F84: animal, cat, eye, face, heart, love, nature,smile
A85: =1+R[-1]C -> 84 | B85: U+1F63C | C85: 😼 | D85: CAT FACE WITH WRY SMILE | F85: animal, cat, face, ironic, nature, smile,wry
A86: =1+R[-1]C -> 85 | B86: U+1F63D | C86: 😽 | D86: KISSING CAT FACE WITH CLOSED EYES | F86: animal, cat, eye, face, kiss, nature
A87: =1+R[-1]C -> 86 | B87: U+1F640 | C87: 🙀 | D87: WEARY CAT FACE | F87: animal, cat, face, nature, oh, surprised,weary
A88: =1+R[-1]C -> 87 | B88: U+1F63F | C88: 😿 | D88: CRYING CAT FACE | F88: animal, cat, cry, face, nature, sad, tear
A89: =1+R[-1]C -> 88 | B89: U+1F63E | C89: 😾 | D89: POUTING CAT FACE | F89: animal, cat, face, nature, pouting
A90: =1+R[-1]C -> 89 | B90: U+1F648 | C90: 🙈 | D90: SEE NO EVIL MONKEY | F90: animal, evil, face, forbidden, gesture,monkey, nature, no, not, prohibited, see
A91: =1+R[-1]C -> 90 | B91: U+1F649 | C91: 🙉 | D91: HEAR NO EVIL MONKEY | F91: animal, evil, face, forbidden, gesture,hear, monkey, nature, no, not, prohibited
A92: =1+R[-1]C -> 91 | B92: U+1F64A | C92: 🙊 | D92: SPEAK NO EVIL MONKEY | F92: animal, evil, face, forbidden, gesture,monkey, nature, no, not, prohibited,speak
A93: =1+R[-1]C -> 92 | B93: U+1F3FB | C93: 🏻 | D93: White Toned Skin skin type-1-2 | F93: emoji modifier, fitzpatrick, skin, symbol,tone
A94: =1+R[-1]C -> 93 | B94: U+1F3FC | C94: 🏼 | D94: Light Brown Toned Skin skin type-3 | F94: emoji modifier, fitzpatrick, skin, symbol,tone
A95: =1+R[-1]C -> 94 | B95: U+1F3FD | C95: 🏽 | D95: Olive Toned Skin skin type-4 | F95: emoji modifier, fitzpatrick, skin, symbol,tone
A96: =1+R[-1]C -> 95 | B96: U+1F3FE | C96: 🏾 | D96: Deeper Brown Toned Skin skin type-5 | F96: emoji modifier, fitzpatrick, skin, symbol,tone
A97: =1+R[-1]C -> 96 | B97: U+1F3FF | C97: 🏿 | D97: Black Toned Skin skin type-6 | F97: emoji modifier, fitzpatrick, skin, symbol,tone
A98: =1+R[-1]C -> 97 | B98: U+1F466 | C98: 👦 | D98: BOY | F98: boy, person
A99: =1+R[-1]C -> 98 | B99: U+1F467 | C99: 👧 | D99: GIRL | F99: girl, maiden, person, virgin, virgo, zodiac
A100: =1+R[-1]C -> 99 | B100: U+1F468 | C100: 👨 | D100: MAN | F100: man, person
A101: =1+R[-1]C -> 100 | B101: U+1F469 | C101: 👩 | D101: WOMAN | F101: person, woman
A102: =1+R[-1]C -> 101 | B102: U+1F474 | C102: 👴 | D102: OLDER MAN | F102: man, old, person
A103: =1+R[-1]C -> 102 | B103: U+1F475 | C103: 👵 | D103: OLDER WOMAN | F103: old, person, woman
A104: =1+R[-1]C -> 103 | B104: U+1F476 | C104: 👶 | D104: BABY | F104: baby, person
A105: =1+R[-1]C -> 104 | B105: U+1F471 | C105: 👱 | D105: PERSON WITH BLOND HAIR | F105: blond, person
A106: =1+R[-1]C -> 105 | B106: U+1F46E | C106: 👮 | D106: POLICE OFFICER | F106: cop, officer, person, police
A107: =1+R[-1]C -> 106 | B107: U+1F472 | C107: 👲 | D107: MAN WITH GUA PI MAO or man with chinese cap | F107: gua pi mao, hat, man, person
A108: =1+R[-1]C -> 107 | B108: U+1F473 | C108: 👳 | D108: MAN WITH TURBAN | F108: man, person, turban
A109: =1+R[-1]C -> 108 | B109: U+1F477 | C109: 👷 | D109: CONSTRUCTION WORKER | F109: construction, hat, person, worker
A110: =1+R[-1]C -> 109 | B110: U+26D1 | C110: ⛑ | D110: HELMET WITH WHITE CROSS | F110: aid, cross, face, hat, helmet, person
A111: =1+R[-1]C -> 110 | B111: U+1F478 | C111: 👸 | D111: PRINCESS | F111: fairy tale, fantasy, person, princess
A112: =1+R[-1]C -> 111 | B112: U+1F482 | C112: 💂 | D112: GUARDSMAN | F112: guard, guardsman, person
A113: =1+R[-1]C -> 112 | B113: U+1F575 | C113: 🕵 | D113: SLEUTH OR SPY or detective | F113: detective, person, sleuth, spy
A114: =1+R[-1]C -> 113 | B114: U+1F385 | C114: 🎅 | D114: FATHER CHRISTMAS or santa claus | F114: activity, celebration, christmas, fairy tale,fantasy, father, person, santa, santa claus
A115: =1+R[-1]C -> 114 | B115: U+1F47C | C115: 👼 | D115: BABY ANGEL | F115: angel, baby, face, fairy tale, fantasy,person
A116: =1+R[-1]C -> 115 | B116: U+1F486 | C116: 💆 | D116: FACE MASSAGE | F116: massage, person, salon
A117: =1+R[-1]C -> 116 | B117: U+1F487 | C117: 💇 | D117: HAIRCUT | F117: barber, beauty, haircut, parlor, person
A118: =1+R[-1]C -> 117 | B118: U+1F470 | C118: 👰 | D118: BRIDE WITH VEIL | F118: bride, person, veil, wedding
A119: =1+R[-1]C -> 118 | B119: U+1F64D | C119: 🙍 | D119: PERSON FROWNING | F119: frown, gesture, person
A120: =1+R[-1]C -> 119 | B120: U+1F64E | C120: 🙎 | D120: PERSON WITH POUTING FACE | F120: gesture, person, pouting
A121: =1+R[-1]C -> 120 | B121: U+1F645 | C121: 🙅 | D121: FACE WITH NO GOOD GESTURE | F121: forbidden, gesture, hand, no, not, person,prohibited
A122: =1+R[-1]C -> 121 | B122: U+1F646 | C122: 🙆 | D122: FACE WITH OK GESTURE | F122: gesture, hand, ok, person
A123: =1+R[-1]C -> 122 | B123: U+1F481 | C123: 💁 | D123: INFORMATION DESK PERSON | F123: hand, help, information, person, sassy
A124: =1+R[-1]C -> 123 | B124: U+1F64B | C124: 🙋 | D124: HAPPY PERSON RAISING ONE HAND | F124: gesture, hand, happy, person, raised
A125: =1+R[-1]C -> 124 | B125: U+1F647 | C125: 🙇 | D125: PERSON BOWING DEEPLY | F125: apology, bow, gesture, person, sorry
A126: =1+R[-1]C -> 125 | B126: U+1F64C | C126: 🙌 | D126: PERSON RAISING BOTH HANDS IN CELEBRATION | F126: body, celebration, gesture, hand, hooray,person, raised
A127: =1+R[-1]C -> 126 | B127: U+1F64F | C127: 🙏 | D127: PERSON WITH FOLDED HANDS | F127: ask, body, bow, folded, gesture, hand,person, please, pray, thanks
A128: =1+R[-1]C -> 127 | B128: U+1F5E3 | C128: 🗣 | D128: SPEAKING HEAD IN SILHOUETTE | F128: face, head, person, silhouette, speak,speaking
A129: =1+R[-1]C -> 128 | B129: U+1F464 | C129: 👤 | D129: BUST IN SILHOUETTE | F129: bust, person, silhouette
A130: =1+R[-1]C -> 129 | B130: U+1F465 | C130: 👥 | D130: BUSTS IN SILHOUETTE | F130: bust, person, silhouette
A131: =1+R[-1]C -> 130 | B131: U+1F6B6 | C131: 🚶 | D131: PEDESTRIAN | F131: hike, pedestrian, person, walk, walking
A132: =1+R[-1]C -> 131 | B132: U+1F3C3 | C132: 🏃 | D132: RUNNER | F132: marathon, person, runner, running
A133: =1+R[-1]C -> 132 | B133: U+1F46F | C133: 👯 | D133: WOMAN WITH BUNNY EARS or woman partying | F133: bunny, dancer, ear, girl, person, woman
A134: =1+R[-1]C -> 133 | B134: U+1F483 | C134: 💃 | D134: DANCER | F134: dancer, person
A135: =1+R[-1]C -> 134 | B135: U+1F574 | C135: 🕴 | D135: MAN IN BUSINESS SUIT LEVITATING | F135: business, man, person, suit
A136: =1+R[-1]C -> 135 | B136: U+1F48F | C136: 💏 | D136: KISS | F136: couple, kiss, person, romance
A137: =1+R[-1]C -> 136 | B137: U+1F469 U+200D U+2764 U+FE0F U+200D U+1F48B U+200D U+1F468 | C137: 👩‍❤️‍💋‍👨 | D137: Kiss: WOMAN, MAN | F137: kiss, man, woman
A138: =1+R[-1]C -> 137 | B138: U+1F468 U+200D U+2764 U+FE0F U+200D U+1F48B U+200D U+1F468 | C138: 👨‍❤️‍💋‍👨 | D138: Kiss: MAN, MAN | F138: kiss, man
A139: =1+R[-1]C -> 138 | B139: U+1F469 U+200D U+2764 U+FE0F U+200D U+1F48B U+200D U+1F469 | C139: 👩‍❤️‍💋‍👩 | D139: Kiss: WOMAN, WOMAN | F139: kiss, woman
A140: =1+R[-1]C -> 139 | B140: U+1F491 | C140: 💑 | D140: COUPLE WITH HEART | F140: couple, heart, love, person, romance
A141: =1+R[-1]C -> 140 | B141: U+1F469 U+200D U+2764 U+FE0F U+200D U+1F468 | C141: 👩‍❤️‍👨 | D141: Couple with heart: WOMAN, MAN | F141: couple, man, woman
A142: =1+R[-1]C -> 141 | B142: U+1F468 U+200D U+2764 U+FE0F U+200D U+1F468 | C142: 👨‍❤️‍👨 | D142: Couple with heart: MAN, MAN | F142: couple, man
A143: =1+R[-1]C -> 142 | B143: U+1F469 U+200D U+2764 U+FE0F U+200D U+1F469 | C143: 👩‍❤️‍👩 | D143: Couple with heart: WOMAN, WOMAN | F143: couple, woman
A144: =1+R[-1]C -> 143 | B144: U+1F46A | C144: 👪 | D144: FAMILY | F144: child, family, father, mother, person
A145: =1+R[-1]C -> 144 | B145: U+1F468 U+200D U+1F469 U+200D U+1F466 | C145: 👨‍👩‍👦 | D145: Family: MAN, WOMAN, BOY | F145: boy, family, man, woman
A146: =1+R[-1]C -> 145 | B146: U+1F468 U+200D U+1F469 U+200D U+1F467 | C146: 👨‍👩‍👧 | D146: Family: MAN, WOMAN, GIRL | F146: family, girl, man, woman
A147: =1+R[-1]C -> 146 | B147: U+1F468 U+200D U+1F469 U+200D U+1F467 U+200D U+1F466 | C147: 👨‍👩‍👧‍👦 | D147: Family: MAN, WOMAN, GIRL, BOY | F147: boy, family, girl, man, woman
A148: =1+R[-1]C -> 147 | B148: U+1F468 U+200D U+1F469 U+200D U+1F466 U+200D U+1F466 | C148: 👨‍👩‍👦‍👦 | D148: Family: MAN, WOMAN, BOY, BOY | F148: boy, family, man, woman
A149: =1+R[-1]C -> 148 | B149: U+1F468 U+200D U+1F469 U+200D U+1F467 U+200D U+1F467 | C149: 👨‍👩‍👧‍👧 | D149: Family: MAN, WOMAN, GIRL, GIRL | F149: family, girl, man, woman
A150: =1+R[-1]C -> 149 | B150: U+1F468 U+200D U+1F468 U+200D U+1F466 | C150: 👨‍👨‍👦 | D150: Family: MAN, MAN, BOY | F150: boy, family, man
A151: =1+R[-1]C -> 150 | B151: U+1F468 U+200D U+1F468 U+200D U+1F467 | C151: 👨‍👨‍👧 | D151: Family: MAN, MAN, GIRL | F151: family, girl, man
A152: =1+R[-1]C -> 151 | B152: U+1F468 U+200D U+1F468 U+200D U+1F467 U+200D U+1F466 | C152: 👨‍👨‍👧‍👦 | D152: Family: MAN, MAN, GIRL, BOY | F152: boy, family, girl, man
A153: =1+R[-1]C -> 152 | B153: U+1F468 U+200D U+1F468 U+200D U+1F466 U+200D U+1F466 | C153: 👨‍👨‍👦‍👦 | D153: Family: MAN, MAN, BOY, BOY | F153: boy, family, man
A154: =1+R[-1]C -> 153 | B154: U+1F468 U+200D U+1F468 U+200D U+1F467 U+200D U+1F467 | C154: 👨‍👨‍👧‍👧 | D154: Family: MAN, MAN, GIRL, GIRL | F154: family, girl, man
A155: =1+R[-1]C -> 154 | B155: U+1F469 U+200D U+1F469 U+200D U+1F466 | C155: 👩‍👩‍👦 | D155: Family: WOMAN, WOMAN, BOY | F155: boy, family, woman
A156: =1+R[-1]C -> 155 | B156: U+1F469 U+200D U+1F469 U+200D U+1F467 | C156: 👩‍👩‍👧 | D156: Family: WOMAN, WOMAN, GIRL | F156: family, girl, woman
A157: =1+R[-1]C -> 156 | B157: U+1F469 U+200D U+1F469 U+200D U+1F467 U+200D U+1F466 | C157: 👩‍👩‍👧‍👦 | D157: Family: WOMAN, WOMAN, GIRL, BOY | F157: boy, family, girl, woman
A158: =1+R[-1]C -> 157 | B158: U+1F469 U+200D U+1F469 U+200D U+1F466 U+200D U+1F466 | C158: 👩‍👩‍👦‍👦 | D158: Family: WOMAN, WOMAN, BOY, BOY | F158: boy, family, woman
A159: =1+R[-1]C -> 158 | B159: U+1F469 U+200D U+1F469 U+200D U+1F467 U+200D U+1F467 | C159: 👩‍👩‍👧‍👧 | D159: Family: WOMAN, WOMAN, GIRL, GIRL | F159: family, girl, woman
A160: =1+R[-1]C -> 159 | B160: U+1F46B | C160: 👫 | D160: MAN AND WOMAN HOLDING HANDS | F160: couple, hand, hold, man, person, woman
A161: =1+R[-1]C -> 160 | B161: U+1F46C | C161: 👬 | D161: TWO MEN HOLDING HANDS | F161: couple, gemini, hand, hold, man, person,twins, zodiac
A162: =1+R[-1]C -> 161 | B162: U+1F46D | C162: 👭 | D162: TWO WOMEN HOLDING HANDS | F162: couple, hand, hold, person, woman
A163: =1+R[-1]C -> 162 | B163: U+1F4AA | C163: 💪 | D163: FLEXED BICEPS | F163: biceps, body, comic, flex, muscle, person
A164: =1+R[-1]C -> 163 | B164: U+1F448 | C164: 👈 | D164: WHITE LEFT POINTING BACKHAND INDEX or backhand index finger pointing left | F164: backhand, body, finger, hand, index,person, point
A165: =1+R[-1]C -> 164 | B165: U+1F449 | C165: 👉 | D165: WHITE RIGHT POINTING BACKHAND or backhand index finger pointing right | F165: backhand, body, finger, hand, index,person, point
A166: =1+R[-1]C -> 165 | B166: U+261D | C166: ☝️ | D166: WHITE UP POINTING INDEX or index finger pointing up | F166: body, finger, hand, index, person, point,up
A167: =1+R[-1]C -> 166 | B167: U+1F446 | C167: 👆 | D167: WHITE UP POINTING BACKHAND INDEX or backhand index finger pointing up | F167: backhand, body, finger, hand, index,person, point, up
A168: =1+R[-1]C -> 167 | B168: U+1F595 | C168: 🖕 | D168: REVERSED HAND WITH MIDDLE FINGER EXTENDED or middle finger | F168: body, finger, hand, middle finger, person
A169: =1+R[-1]C -> 168 | B169: U+1F447 | C169: 👇 | D169: WHITE DOWN POINTING BACKHAND INDEX or backhand index finger pointing down | F169: backhand, body, down, finger, hand,index, person, point
A170: =1+R[-1]C -> 169 | B170: U+270C | C170: ✌️ | D170: VICTORY HAND | F170: body, hand, person, v, victory
A171: =1+R[-1]C -> 170 | B171: U+1F596 | C171: 🖖 | D171: RAISED HAND WITH PART BETWEEN MIDDLE AND RING FINGERS or vulcan salute | F171: body, finger, hand, person, spock, vulcan
A172: =1+R[-1]C -> 171 | B172: U+1F918 | C172: 🤘 | D172: SIGN OF THE HORNS | F172: body, finger, hand, horns, person, rock-on
A173: =1+R[-1]C -> 172 | B173: U+1F590 | C173: 🖐 | D173: RAISED HAND WITH FINGERS SPLAYED | F173: body, finger, hand, person, splayed
A174: =1+R[-1]C -> 173 | B174: U+270B | C174: ✋ | D174: RAISED HAND | F174: body, hand, person
A175: =1+R[-1]C -> 174 | B175: U+1F44C | C175: 👌 | D175: OK HAND SIGN | F175: body, hand, ok, person
A176: =1+R[-1]C -> 175 | B176: U+1F44D | C176: 👍 | D176: THUMBS UP SIGN | F176: +1, body, hand, person, thumb, thumbs up, up
A177: =1+R[-1]C -> 176 | B177: U+1F44E | C177: 👎 | D177: THUMBS DOWN SIGN | F177: -1, body, down, hand, person, thumb,thumbs down
A178: =1+R[-1]C -> 177 | B178: U+270A | C178: ✊ | D178: RAISED FIST | F178: body, clenched, fist, hand, person, punch
A179: =1+R[-1]C -> 178 | B179: U+1F44A | C179: 👊 | D179: FISTED HAND SIGN | F179: body, clenched, fist, hand, person, punch
A180: =1+R[-1]C -> 179 | B180: U+1F44B | C180: 👋 | D180: WAVING HAND SIGN | F180: body, hand, person, wave, waving
A181: =1+R[-1]C -> 180 | B181: U+1F44F | C181: 👏 | D181: CLAPPING HANDS SIGN | F181: body, clap, hand, person
A182: =1+R[-1]C -> 181 | B182: U+1F450 | C182: 👐 | D182: OPEN HANDS SIGN | F182: body, hand, open, person
A183: =1+R[-1]C -> 182 | B183: U+270D | C183: ✍ | D183: WRITING HAND | F183: body, education, hand, person, write
A184: =1+R[-1]C -> 183 | B184: U+1F485 | C184: 💅 | D184: NAIL POLISH | F184: body, care, cosmetics, manicure, nail,person, polish
A185: =1+R[-1]C -> 184 | B185: U+1F442 | C185: 👂 | D185: EAR | F185: body, ear, person
A186: =1+R[-1]C -> 185 | B186: U+1F443 | C186: 👃 | D186: NOSE | F186: body, nose, person
A187: =1+R[-1]C -> 186 | B187: U+1F463 | C187: 👣 | D187: FOOTPRINTS | F187: body, clothing, footprint, person, print
A188: =1+R[-1]C -> 187 | B188: U+1F440 | C188: 👀 | D188: EYES | F188: body, eye, face, person
A189: =1+R[-1]C -> 188 | B189: U+1F441 | C189: 👁 | D189: EYE | F189: body, eye, person
A190: =1+R[-1]C -> 189 | B190: U+1F441 U+200D U+1F5E8 | C190: 👁‍🗨 | D190: EYE, LEFT SPEECH BUBBLE | F190: bubble, eye, speech, witness
A191: =1+R[-1]C -> 190 | B191: U+1F445 | C191: 👅 | D191: TONGUE | F191: body, person, tongue
A192: =1+R[-1]C -> 191 | B192: U+1F444 | C192: 👄 | D192: MOUTH | F192: body, lips, mouth, person
A193: =1+R[-1]C -> 192 | B193: U+1F48B | C193: 💋 | D193: KISS MARK | F193: emotion, heart, kiss, lips, mark, person,romance
A194: =1+R[-1]C -> 193 | B194: U+1F498 | C194: 💘 | D194: HEART WITH ARROW | F194: arrow, cupid, emotion, heart, person,romance
A195: =1+R[-1]C -> 194 | B195: U+2764 | C195: ❤️ | D195: HEAVY BLACK HEART | F195: emotion, heart, person
A196: =1+R[-1]C -> 195 | B196: U+1F493 | C196: 💓 | D196: BEATING HEART | F196: beating, emotion, heart, heartbeat,person, pulsating
A197: =1+R[-1]C -> 196 | B197: U+1F494 | C197: 💔 | D197: BROKEN HEART | F197: break, broken, emotion, heart, person
A198: =1+R[-1]C -> 197 | B198: U+1F495 | C198: 💕 | D198: TWO HEARTS | F198: emotion, heart, love, person
A199: =1+R[-1]C -> 198 | B199: U+1F496 | C199: 💖 | D199: SPARKLING HEART | F199: emotion, excited, heart, person, sparkle
A200: =1+R[-1]C -> 199 | B200: U+1F497 | C200: 💗 | D200: GROWING HEART | F200: emotion, excited, growing, heart,heartpulse, nervous, person
A201: =1+R[-1]C -> 200 | B201: U+1F499 | C201: 💙 | D201: BLUE HEART | F201: blue, emotion, heart, person
A202: =1+R[-1]C -> 201 | B202: U+1F49A | C202: 💚 | D202: GREEN HEART | F202: emotion, green, heart, person
A203: =1+R[-1]C -> 202 | B203: U+1F49B | C203: 💛 | D203: YELLOW HEART | F203: emotion, heart, person, yellow
A204: =1+R[-1]C -> 203 | B204: U+1F49C | C204: 💜 | D204: PURPLE HEART | F204: emotion, heart, person, purple
A205: =1+R[-1]C -> 204 | B205: U+1F49D | C205: 💝 | D205: HEART WITH RIBBON | F205: emotion, heart, object, person, ribbon,valentine
A206: =1+R[-1]C -> 205 | B206: U+1F49E | C206: 💞 | D206: REVOLVING HEARTS | F206: emotion, heart, person, revolving
A207: =1+R[-1]C -> 206 | B207: U+1F49F | C207: 💟 | D207: HEART DECORATION | F207: emotion, heart, person, symbol
A208: =1+R[-1]C -> 207 | B208: U+2763 | C208: ❣ | D208: HEAVY HEART EXCLAMATION MARK ORNAMENT | F208: emotion, exclamation, heart, mark,punctuation, symbol
A209: =1+R[-1]C -> 208 | B209: U+1F48C | C209: 💌 | D209: LOVE LETTER | F209: emotion, heart, letter, love, mail, person,romance
A210: =1+R[-1]C -> 209 | B210: U+1F4A4 | C210: 💤 | D210: SLEEPING SYMBOL | F210: comic, emotion, person, sleep, symbol,word, zzz
A211: =1+R[-1]C -> 210 | B211: U+1F4A2 | C211: 💢 | D211: ANGER SYMBOL | F211: angry, comic, emotion, mad, person,symbol
A212: =1+R[-1]C -> 211 | B212: U+1F4A3 | C212: 💣 | D212: BOMB | F212: bomb, comic, object
A213: =1+R[-1]C -> 212 | B213: U+1F4A5 | C213: 💥 | D213: COLLISION SYMBOL | F213: boom, collision, comic, emotion, person
A214: =1+R[-1]C -> 213 | B214: U+1F4A6 | C214: 💦 | D214: SPLASHING SWEAT SYMBOL | F214: comic, emotion, object, person,splashing, sweat
A215: =1+R[-1]C -> 214 | B215: U+1F4A8 | C215: 💨 | D215: DASH SYMBOL | F215: comic, dash, emotion, object, person,running
A216: =1+R[-1]C -> 215 | B216: U+1F4AB | C216: 💫 | D216: DIZZY SYMBOL | F216: comic, dizzy, emotion, person, star
A217: =1+R[-1]C -> 216 | B217: U+1F4AC | C217: 💬 | D217: SPEECH BALLOON | F217: balloon, bubble, comic, dialog, emotion,object, person, speech
A218: =1+R[-1]C -> 217 | B218: U+1F5E8 | C218: 🗨 | D218: LEFT SPEECH BUBBLE | F218: dialog, other, speech
A219: =1+R[-1]C -> 218 | B219: U+1F5EF | C219: 🗯 | D219: RIGHT ANGER BUBBLE | F219: angry, balloon, bubble, emotion, mad,symbol
A220: =1+R[-1]C -> 219 | B220: U+1F4AD | C220: 💭 | D220: THOUGHT BALLOON | F220: balloon, bubble, comic, emotion, object,person, thought
A221: =1+R[-1]C -> 220 | B221: U+1F573 | C221: 🕳 | D221: HOLE | F221: hole, symbol
A222: =1+R[-1]C -> 221 | B222: U+1F453 | C222: 👓 | D222: EYEGLASSES | F222: clothing, eye, eyeglasses, eyewear,glasses, object, person
A223: =1+R[-1]C -> 222 | B223: U+1F576 | C223: 🕶 | D223: DARK SUNGLASSES | F223: dark, eye, eyewear, glasses, object,sunglasses
A224: =1+R[-1]C -> 223 | B224: U+1F454 | C224: 👔 | D224: NECKTIE | F224: clothing, necktie, object, person
A225: =1+R[-1]C -> 224 | B225: U+1F455 | C225: 👕 | D225: T-SHIRT | F225: clothing, object, person, shirt, tshirt
A226: =1+R[-1]C -> 225 | B226: U+1F456 | C226: 👖 | D226: JEANS | F226: clothing, jeans, object, pants, person,trousers
A227: =1+R[-1]C -> 226 | B227: U+1F457 | C227: 👗 | D227: DRESS | F227: clothing, dress, object, person
A228: =1+R[-1]C -> 227 | B228: U+1F458 | C228: 👘 | D228: KIMONO | F228: clothing, kimono, object, person
A229: =1+R[-1]C -> 228 | B229: U+1F459 | C229: 👙 | D229: BIKINI | F229: bikini, clothing, object, person, swim
A230: =1+R[-1]C -> 229 | B230: U+1F45A | C230: 👚 | D230: WOMANS CLOTHES | F230: clothing, object, person, woman
A231: =1+R[-1]C -> 230 | B231: U+1F45B | C231: 👛 | D231: PURSE | F231: clothing, coin, object, person, purse
A232: =1+R[-1]C -> 231 | B232: U+1F45C | C232: 👜 | D232: HANDBAG | F232: bag, clothing, handbag, object, person
A233: =1+R[-1]C -> 232 | B233: U+1F45D | C233: 👝 | D233: POUCH | F233: bag, clothing, object, person, pouch
A234: =1+R[-1]C -> 233 | B234: U+1F6CD | C234: 🛍 | D234: SHOPPING BAGS | F234: bag, hotel, object, shopping
A235: =1+R[-1]C -> 234 | B235: U+1F392 | C235: 🎒 | D235: SCHOOL SATCHEL or school backpack | F235: activity, bag, education, object, satchel,school
A236: =1+R[-1]C -> 235 | B236: U+1F45E | C236: 👞 | D236: MANS SHOE | F236: clothing, man, object, person, shoe
A237: =1+R[-1]C -> 236 | B237: U+1F45F | C237: 👟 | D237: ATHLETIC SHOE or running shoe | F237: athletic, clothing, object, person, shoe,sneaker
A238: =1+R[-1]C -> 237 | B238: U+1F460 | C238: 👠 | D238: HIGH-HEELED SHOE | F238: clothing, heel, object, person, shoe,woman
A239: =1+R[-1]C -> 238 | B239: U+1F461 | C239: 👡 | D239: WOMANS SANDAL | F239: clothing, object, person, sandal, shoe,woman
A240: =1+R[-1]C -> 239 | B240: U+1F462 | C240: 👢 | D240: WOMANS BOOTS | F240: boot, clothing, object, person, shoe,woman
A241: =1+R[-1]C -> 240 | B241: U+1F451 | C241: 👑 | D241: CROWN | F241: clothing, crown, king, object, person,queen
A242: =1+R[-1]C -> 241 | B242: U+1F452 | C242: 👒 | D242: WOMANS HAT | F242: clothing, hat, object, person, woman
A243: =1+R[-1]C -> 242 | B243: U+1F3A9 | C243: 🎩 | D243: TOP HAT | F243: activity, clothing, entertainment, hat,object, person, top, tophat
A244: =1+R[-1]C -> 243 | B244: U+1F393 | C244: 🎓 | D244: GRADUATION CAP | F244: activity, cap, celebration, clothing,education, graduation, hat, object
A245: =1+R[-1]C -> 244 | B245: U+1F4FF | C245: 📿 | D245: PRAYER BEADS | F245: beads, clothing, necklace, object, person,prayer, religion
A246: =1+R[-1]C -> 245 | B246: U+1F484 | C246: 💄 | D246: LIPSTICK | F246: cosmetics, lipstick, makeup, object,person
A247: =1+R[-1]C -> 246 | B247: U+1F48D | C247: 💍 | D247: RING | F247: diamond, emotion, object, person, ring,romance
A248: =1+R[-1]C -> 247 | B248: U+1F48E | C248: 💎 | D248: GEM STONE | F248: diamond, emotion, gem, jewel, object,person, romance
A249: =1+R[-1]C -> 248 | B249: U+1F435 | C249: 🐵 | D249: MONKEY FACE | F249: animal, face, monkey, nature
A250: =1+R[-1]C -> 249 | B250: U+1F412 | C250: 🐒 | D250: MONKEY | F250: animal, monkey, nature
A251: =1+R[-1]C -> 250 | B251: U+1F436 | C251: 🐶 | D251: DOG FACE | F251: animal, dog, face, nature, pet
A252: =1+R[-1]C -> 251 | B252: U+1F415 | C252: 🐕 | D252: DOG | F252: animal, dog, nature, pet
A253: =1+R[-1]C -> 252 | B253: U+1F429 | C253: 🐩 | D253: POODLE | F253: animal, dog, nature, poodle
A254: =1+R[-1]C -> 253 | B254: U+1F43A | C254: 🐺 | D254: WOLF FACE | F254: animal, face, nature, wolf
A255: =1+R[-1]C -> 254 | B255: U+1F431 | C255: 🐱 | D255: CAT FACE | F255: animal, cat, face, nature, pet
A256: =1+R[-1]C -> 255 | B256: U+1F408 | C256: 🐈 | D256: CAT | F256: animal, cat, nature, pet
A257: =1+R[-1]C -> 256 | B257: U+1F981 | C257: 🦁 | D257: LION FACE | F257: animal, face, leo, lion, nature, zodiac
A258: =1+R[-1]C -> 257 | B258: U+1F42F | C258: 🐯 | D258: TIGER FACE | F258: animal, face, nature, tiger
A259: =1+R[-1]C -> 258 | B259: U+1F405 | C259: 🐅 | D259: TIGER | F259: animal, nature, tiger
A260: =1+R[-1]C -> 259 | B260: U+1F406 | C260: 🐆 | D260: LEOPARD | F260: animal, leopard, nature
A261: =1+R[-1]C -> 260 | B261: U+1F434 | C261: 🐴 | D261: HORSE FACE | F261: animal, face, horse, nature
A262: =1+R[-1]C -> 261 | B262: U+1F40E | C262: 🐎 | D262: HORSE | F262: animal, horse, nature, place, racehorse,racing
A263: =1+R[-1]C -> 262 | B263: U+1F984 | C263: 🦄 | D263: UNICORN FACE | F263: animal, face, nature, unicorn
A264: =1+R[-1]C -> 263 | B264: U+1F42E | C264: 🐮 | D264: COW FACE | F264: animal, cow, face, nature
A265: =1+R[-1]C -> 264 | B265: U+1F402 | C265: 🐂 | D265: OX | F265: animal, bull, nature, ox, taurus, zodiac
A266: =1+R[-1]C -> 265 | B266: U+1F403 | C266: 🐃 | D266: WATER BUFFALO | F266: animal, buffalo, nature, water
A267: =1+R[-1]C -> 266 | B267: U+1F404 | C267: 🐄 | D267: COW | F267: animal, cow, nature
A268: =1+R[-1]C -> 267 | B268: U+1F437 | C268: 🐷 | D268: PIG FACE | F268: animal, face, nature, pig
A269: =1+R[-1]C -> 268 | B269: U+1F416 | C269: 🐖 | D269: PIG | F269: animal, nature, pig, sow
A270: =1+R[-1]C -> 269 | B270: U+1F417 | C270: 🐗 | D270: BOAR | F270: animal, boar, nature, pig
A271: =1+R[-1]C -> 270 | B271: U+1F43D | C271: 🐽 | D271: PIG NOSE | F271: animal, face, nature, nose, pig
A272: =1+R[-1]C -> 271 | B272: U+1F40F | C272: 🐏 | D272: RAM | F272: animal, aries, nature, ram, sheep, zodiac
A273: =1+R[-1]C -> 272 | B273: U+1F411 | C273: 🐑 | D273: SHEEP | F273: animal, ewe, nature, sheep
A274: =1+R[-1]C -> 273 | B274: U+1F410 | C274: 🐐 | D274: GOAT | F274: animal, capricorn, goat, nature, zodiac
A275: =1+R[-1]C -> 274 | B275: U+1F42A | C275: 🐪 | D275: DROMEDARY CAMEL | F275: animal, camel, dromedary, hump, nature
A276: =1+R[-1]C -> 275 | B276: U+1F42B | C276: 🐫 | D276: BACTRIAN CAMEL | F276: animal, bactrian, camel, hump, nature
A277: =1+R[-1]C -> 276 | B277: U+1F418 | C277: 🐘 | D277: ELEPHANT | F277: animal, elephant, nature
A278: =1+R[-1]C -> 277 | B278: U+1F42D | C278: 🐭 | D278: MOUSE FACE | F278: animal, face, mouse, nature
A279: =1+R[-1]C -> 278 | B279: U+1F401 | C279: 🐁 | D279: MOUSE | F279: animal, mouse, nature
A280: =1+R[-1]C -> 279 | B280: U+1F400 | C280: 🐀 | D280: RAT | F280: animal, nature, rat
A281: =1+R[-1]C -> 280 | B281: U+1F439 | C281: 🐹 | D281: HAMSTER FACE | F281: animal, face, hamster, nature, pet
A282: =1+R[-1]C -> 281 | B282: U+1F430 | C282: 🐰 | D282: RABBIT FACE | F282: animal, bunny, face, nature, pet, rabbit
A283: =1+R[-1]C -> 282 | B283: U+1F407 | C283: 🐇 | D283: RABBIT | F283: animal, bunny, nature, pet, rabbit
A284: =1+R[-1]C -> 283 | B284: U+1F43F | C284: 🐿 | D284: CHIPMUNK | F284: animal, chipmunk, nature
A285: =1+R[-1]C -> 284 | B285: U+1F43B | C285: 🐻 | D285: BEAR FACE | F285: animal, bear, face, nature
A286: =1+R[-1]C -> 285 | B286: U+1F428 | C286: 🐨 | D286: KOALA | F286: animal, bear, koala, nature
A287: =1+R[-1]C -> 286 | B287: U+1F43C | C287: 🐼 | D287: PANDA FACE | F287: animal, face, nature, panda
A288: =1+R[-1]C -> 287 | B288: U+1F43E | C288: 🐾 | D288: PAW PRINTS | F288: animal, feet, nature, paw, print
A289: =1+R[-1]C -> 288 | B289: U+1F983 | C289: 🦃 | D289: TURKEY | F289: animal, nature, turkey
A290: =1+R[-1]C -> 289 | B290: U+1F414 | C290: 🐔 | D290: CHICKEN | F290: animal, chicken, nature
A291: =1+R[-1]C -> 290 | B291: U+1F413 | C291: 🐓 | D291: ROOSTER | F291: animal, nature, rooster
A292: =1+R[-1]C -> 291 | B292: U+1F423 | C292: 🐣 | D292: HATCHING CHICK | F292: animal, baby, chick, hatching, nature
A293: =1+R[-1]C -> 292 | B293: U+1F424 | C293: 🐤 | D293: BABY CHICK | F293: animal, baby, chick, nature
A294: =1+R[-1]C -> 293 | B294: U+1F425 | C294: 🐥 | D294: FRONT-FACING BABY CHICK | F294: animal, baby, chick, nature
A295: =1+R[-1]C -> 294 | B295: U+1F426 | C295: 🐦 | D295: BIRD | F295: animal, bird, nature
A296: =1+R[-1]C -> 295 | B296: U+1F427 | C296: 🐧 | D296: PENGUIN | F296: animal, nature, penguin
A297: =1+R[-1]C -> 296 | B297: U+1F54A | C297: 🕊 | D297: DOVE OF PEACE | F297: animal, bird, dove, fly, nature, peace
A298: =1+R[-1]C -> 297 | B298: U+1F438 | C298: 🐸 | D298: FROG FACE | F298: animal, face, frog, nature
A299: =1+R[-1]C -> 298 | B299: U+1F40A | C299: 🐊 | D299: CROCODILE | F299: animal, crocodile, nature
A300: =1+R[-1]C -> 299 | B300: U+1F422 | C300: 🐢 | D300: TURTLE | F300: animal, nature, turtle
A301: =1+R[-1]C -> 300 | B301: U+1F40D | C301: 🐍 | D301: SNAKE | F301: animal, bearer, nature, ophiuchus,serpent, snake, zodiac
A302: =1+R[-1]C -> 301 | B302: U+1F432 | C302: 🐲 | D302: DRAGON FACE | F302: animal, dragon, face, fairy tale, nature
A303: =1+R[-1]C -> 302 | B303: U+1F409 | C303: 🐉 | D303: DRAGON | F303: animal, dragon, fairy tale, nature
A304: =1+R[-1]C -> 303 | B304: U+1F433 | C304: 🐳 | D304: SPOUTING WHALE | F304: animal, face, nature, spouting, whale
A305: =1+R[-1]C -> 304 | B305: U+1F40B | C305: 🐋 | D305: WHALE | F305: animal, nature, whale
A306: =1+R[-1]C -> 305 | B306: U+1F42C | C306: 🐬 | D306: DOLPHIN | F306: animal, dolphin, flipper, nature
A307: =1+R[-1]C -> 306 | B307: U+1F41F | C307: 🐟 | D307: FISH | F307: animal, fish, nature, pisces, zodiac
A308: =1+R[-1]C -> 307 | B308: U+1F420 | C308: 🐠 | D308: TROPICAL FISH | F308: animal, fish, nature, tropical
A309: =1+R[-1]C -> 308 | B309: U+1F421 | C309: 🐡 | D309: BLOWFISH | F309: animal, blowfish, fish, nature
A310: =1+R[-1]C -> 309 | B310: U+1F419 | C310: 🐙 | D310: OCTOPUS | F310: animal, nature, octopus
A311: =1+R[-1]C -> 310 | B311: U+1F41A | C311: 🐚 | D311: SPIRAL SHELL | F311: animal, nature, shell, spiral
A312: =1+R[-1]C -> 311 | B312: U+1F980 | C312: 🦀 | D312: CRAB | F312: animal, cancer, crab, nature, zodiac
A313: =1+R[-1]C -> 312 | B313: U+1F40C | C313: 🐌 | D313: SNAIL | F313: animal, nature, snail
A314: =1+R[-1]C -> 313 | B314: U+1F41B | C314: 🐛 | D314: BUG | F314: animal, bug, insect, nature
A315: =1+R[-1]C -> 314 | B315: U+1F41C | C315: 🐜 | D315: ANT | F315: animal, ant, insect, nature
A316: =1+R[-1]C -> 315 | B316: U+1F41D | C316: 🐝 | D316: HONEYBEE | F316: animal, bee, honeybee, insect, nature
A317: =1+R[-1]C -> 316 | B317: U+1F41E | C317: 🐞 | D317: LADY BEETLE | F317: animal, beetle, insect, lady beetle,ladybird, ladybug, nature
A318: =1+R[-1]C -> 317 | B318: U+1F577 | C318: 🕷 | D318: SPIDER | F318: animal, insect, object, spider
A319: =1+R[-1]C -> 318 | B319: U+1F578 | C319: 🕸 | D319: SPIDER WEB | F319: animal, object, spider, web
A320: =1+R[-1]C -> 319 | B320: U+1F982 | C320: 🦂 | D320: SCORPION | F320: animal, nature, scorpio, scorpion,scorpius, zodiac
A321: =1+R[-1]C -> 320 | B321: U+1F490 | C321: 💐 | D321: BOUQUET | F321: bouquet, flower, nature, object, place,plant, romance
A322: =1+R[-1]C -> 321 | B322: U+1F338 | C322: 🌸 | D322: CHERRY BLOSSOM | F322: blossom, cherry, flower, nature, plant
A323: =1+R[-1]C -> 322 | B323: U+1F4AE | C323: 💮 | D323: WHITE FLOWER | F323: flower, object, symbol
A324: =1+R[-1]C -> 323 | B324: U+1F3F5 | C324: 🏵 | D324: ROSETTE | F324: nature, plant, rosette
A325: =1+R[-1]C -> 324 | B325: U+1F339 | C325: 🌹 | D325: ROSE | F325: flower, nature, plant, rose
A326: =1+R[-1]C -> 325 | B326: U+1F33A | C326: 🌺 | D326: HIBISCUS | F326: flower, hibiscus, nature, plant
A327: =1+R[-1]C -> 326 | B327: U+1F33B | C327: 🌻 | D327: SUNFLOWER | F327: flower, nature, plant, sun, sunflower
A328: =1+R[-1]C -> 327 | B328: U+1F33C | C328: 🌼 | D328: BLOSSOM | F328: blossom, flower, nature, plant
A329: =1+R[-1]C -> 328 | B329: U+1F337 | C329: 🌷 | D329: TULIP | F329: flower, nature, plant, tulip
A330: =1+R[-1]C -> 329 | B330: U+1F331 | C330: 🌱 | D330: SEEDLING | F330: nature, plant, seedling, young
A331: =1+R[-1]C -> 330 | B331: U+1F332 | C331: 🌲 | D331: EVERGREEN TREE | F331: evergreen, nature, plant, tree
A332: =1+R[-1]C -> 331 | B332: U+1F333 | C332: 🌳 | D332: DECIDUOUS TREE | F332: deciduous, nature, plant, shedding, tree
A333: =1+R[-1]C -> 332 | B333: U+1F334 | C333: 🌴 | D333: PALM TREE | F333: nature, palm, plant, tree
A334: =1+R[-1]C -> 333 | B334: U+1F335 | C334: 🌵 | D334: CACTUS | F334: cactus, nature, plant
A335: =1+R[-1]C -> 334 | B335: U+1F33E | C335: 🌾 | D335: EAR OF RICE | F335: ear, nature, plant, rice
A336: =1+R[-1]C -> 335 | B336: U+1F33F | C336: 🌿 | D336: HERB | F336: herb, leaf, nature, plant
A337: =1+R[-1]C -> 336 | B337: U+2618 | C337: ☘ | D337: SHAMROCK | F337: nature, plant, shamrock
A338: =1+R[-1]C -> 337 | B338: U+1F340 | C338: 🍀 | D338: FOUR LEAF CLOVER | F338: 4, clover, four, leaf, nature, plant
A339: =1+R[-1]C -> 338 | B339: U+1F341 | C339: 🍁 | D339: MAPLE LEAF | F339: falling, leaf, maple, nature, plant
A340: =1+R[-1]C -> 339 | B340: U+1F342 | C340: 🍂 | D340: FALLEN LEAF | F340: falling, leaf, nature, plant
A341: =1+R[-1]C -> 340 | B341: U+1F343 | C341: 🍃 | D341: LEAF FLUTTERING IN WIND | F341: blow, flutter, leaf, nature, plant, wind
A342: =1+R[-1]C -> 341 | B342: U+1F347 | C342: 🍇 | D342: GRAPES | F342: food, fruit, grape, nature, object, plant
A343: =1+R[-1]C -> 342 | B343: U+1F348 | C343: 🍈 | D343: MELON | F343: food, fruit, melon, nature, object, plant
A344: =1+R[-1]C -> 343 | B344: U+1F349 | C344: 🍉 | D344: WATERMELON | F344: food, fruit, nature, object, plant,watermelon
A345: =1+R[-1]C -> 344 | B345: U+1F34A | C345: 🍊 | D345: TANGERINE | F345: food, fruit, nature, object, orange, plant,tangerine
A346: =1+R[-1]C -> 345 | B346: U+1F34B | C346: 🍋 | D346: LEMON | F346: citrus, food, fruit, lemon, nature, object,plant
A347: =1+R[-1]C -> 346 | B347: U+1F34C | C347: 🍌 | D347: BANANA | F347: banana, food, fruit, nature, object, plant
A348: =1+R[-1]C -> 347 | B348: U+1F34D | C348: 🍍 | D348: PINEAPPLE | F348: food, fruit, nature, object, pineapple,plant
A349: =1+R[-1]C -> 348 | B349: U+1F34E | C349: 🍎 | D349: RED APPLE | F349: apple, food, fruit, nature, object, plant,red
A350: =1+R[-1]C -> 349 | B350: U+1F34F | C350: 🍏 | D350: GREEN APPLE | F350: apple, food, fruit, green, nature, object,plant
A351: =1+R[-1]C -> 350 | B351: U+1F350 | C351: 🍐 | D351: PEAR | F351: food, fruit, nature, object, pear, plant
A352: =1+R[-1]C -> 351 | B352: U+1F351 | C352: 🍑 | D352: PEACH | F352: food, fruit, nature, object, peach, plant
A353: =1+R[-1]C -> 352 | B353: U+1F352 | C353: 🍒 | D353: CHERRIES | F353: cherry, food, fruit, nature, object, plant
A354: =1+R[-1]C -> 353 | B354: U+1F353 | C354: 🍓 | D354: STRAWBERRY | F354: berry, food, fruit, nature, object, plant,strawberry
A355: =1+R[-1]C -> 354 | B355: U+1F345 | C355: 🍅 | D355: TOMATO | F355: food, nature, object, plant, tomato,vegetable
A356: =1+R[-1]C -> 355 | B356: U+1F346 | C356: 🍆 | D356: AUBERGINE or eggplant | F356: aubergine, eggplant, food, nature, object,plant, vegetable
A357: =1+R[-1]C -> 356 | B357: U+1F33D | C357: 🌽 | D357: EAR OF MAIZE | F357: corn, ear, maize, maze, nature, object,plant
A358: =1+R[-1]C -> 357 | B358: U+1F336 | C358: 🌶 | D358: HOT PEPPER | F358: food, hot, nature, pepper, plant
A359: =1+R[-1]C -> 358 | B359: U+1F344 | C359: 🍄 | D359: MUSHROOM | F359: mushroom, nature, plant
A360: =1+R[-1]C -> 359 | B360: U+1F330 | C360: 🌰 | D360: CHESTNUT | F360: chestnut, nature, plant
A361: =1+R[-1]C -> 360 | B361: U+1F35E | C361: 🍞 | D361: BREAD | F361: bread, food, loaf, nature, object
A362: =1+R[-1]C -> 361 | B362: U+1F9C0 | C362: 🧀 | D362: CHEESE WEDGE | F362: cheese, food, nature
A363: =1+R[-1]C -> 362 | B363: U+1F356 | C363: 🍖 | D363: MEAT ON BONE | F363: bone, food, meat, nature, object
A364: =1+R[-1]C -> 363 | B364: U+1F357 | C364: 🍗 | D364: POULTRY LEG | F364: bone, chicken, food, leg, nature, object,poultry
A365: =1+R[-1]C -> 364 | B365: U+1F354 | C365: 🍔 | D365: HAMBURGER | F365: burger, food, hamburger, nature, object
A366: =1+R[-1]C -> 365 | B366: U+1F35F | C366: 🍟 | D366: FRENCH FRIES | F366: food, french, fries, nature, object
A367: =1+R[-1]C -> 366 | B367: U+1F355 | C367: 🍕 | D367: SLICE OF PIZZA | F367: cheese, food, nature, object, pizza, slice
A368: =1+R[-1]C -> 367 | B368: U+1F32D | C368: 🌭 | D368: HOT DOG | F368: food, frankfurter, hot dog, hotdog,nature, sausage
A369: =1+R[-1]C -> 368 | B369: U+1F32E | C369: 🌮 | D369: TACO | F369: food, mexican, nature, taco
A370: =1+R[-1]C -> 369 | B370: U+1F32F | C370: 🌯 | D370: BURRITO | F370: burrito, food, mexican, nature
A371: =1+R[-1]C -> 370 | B371: U+1F37F | C371: 🍿 | D371: POPCORN | F371: food, nature, popcorn
A372: =1+R[-1]C -> 371 | B372: U+1F372 | C372: 🍲 | D372: POT OF FOOD | F372: food, nature, object, pot, stew
A373: =1+R[-1]C -> 372 | B373: U+1F371 | C373: 🍱 | D373: BENTO BOX | F373: bento, box, food, nature, object
A374: =1+R[-1]C -> 373 | B374: U+1F358 | C374: 🍘 | D374: RICE CRACKER | F374: cracker, food, nature, object, rice
A375: =1+R[-1]C -> 374 | B375: U+1F359 | C375: 🍙 | D375: RICE BALL | F375: ball, food, japanese, nature, object, rice
A376: =1+R[-1]C -> 375 | B376: U+1F35A | C376: 🍚 | D376: COOKED RICE | F376: cooked, food, nature, object, rice
A377: =1+R[-1]C -> 376 | B377: U+1F35B | C377: 🍛 | D377: CURRY RICE | F377: curry, food, nature, object, rice
A378: =1+R[-1]C -> 377 | B378: U+1F35C | C378: 🍜 | D378: STEAMING BOWL | F378: bowl, food, nature, noodle, object,ramen, steaming
A379: =1+R[-1]C -> 378 | B379: U+1F35D | C379: 🍝 | D379: SPAGHETTI | F379: food, nature, object, pasta, spaghetti
A380: =1+R[-1]C -> 379 | B380: U+1F360 | C380: 🍠 | D380: ROASTED SWEET POTATO | F380: food, nature, object, potato, roasted,sweet
A381: =1+R[-1]C -> 380 | B381: U+1F362 | C381: 🍢 | D381: ODEN | F381: food, kebab, nature, object, oden,seafood, skewer, stick
A382: =1+R[-1]C -> 381 | B382: U+1F363 | C382: 🍣 | D382: SUSHI | F382: food, nature, object, sushi
A383: =1+R[-1]C -> 382 | B383: U+1F364 | C383: 🍤 | D383: FRIED SHRIMP | F383: food, fried, nature, object, prawn, shrimp,tempura
A384: =1+R[-1]C -> 383 | B384: U+1F365 | C384: 🍥 | D384: FISH CAKE WITH SWIRL DESIGN | F384: cake, fish, food, nature, object, pastry,swirl
A385: =1+R[-1]C -> 384 | B385: U+1F361 | C385: 🍡 | D385: DANGO | F385: dango, dessert, food, japanese, nature,object, skewer, stick, sweet
A386: =1+R[-1]C -> 385 | B386: U+1F366 | C386: 🍦 | D386: SOFT ICE CREAM | F386: cream, dessert, food, ice, icecream,nature, object, soft, sweet
A387: =1+R[-1]C -> 386 | B387: U+1F367 | C387: 🍧 | D387: SHAVED ICE | F387: dessert, food, ice, nature, object, shaved,sweet
A388: =1+R[-1]C -> 387 | B388: U+1F368 | C388: 🍨 | D388: ICE CREAM | F388: cream, dessert, food, ice, nature, object,sweet
A389: =1+R[-1]C -> 388 | B389: U+1F369 | C389: 🍩 | D389: DOUGHNUT | F389: dessert, donut, doughnut, food, nature,object, sweet
A390: =1+R[-1]C -> 389 | B390: U+1F36A | C390: 🍪 | D390: COOKIE | F390: cookie, dessert, food, nature, object,sweet
A391: =1+R[-1]C -> 390 | B391: U+1F382 | C391: 🎂 | D391: BIRTHDAY CAKE | F391: birthday, cake, celebration, dessert, food,object, pastry, sweet
A392: =1+R[-1]C -> 391 | B392: U+1F370 | C392: 🍰 | D392: SHORTCAKE | F392: cake, dessert, food, nature, object, pastry,shortcake, slice, sweet
A393: =1+R[-1]C -> 392 | B393: U+1F36B | C393: 🍫 | D393: CHOCOLATE BAR | F393: bar, chocolate, dessert, food, nature,object, sweet
A394: =1+R[-1]C -> 393 | B394: U+1F36C | C394: 🍬 | D394: CANDY | F394: candy, dessert, food, nature, object,sweet
A395: =1+R[-1]C -> 394 | B395: U+1F36D | C395: 🍭 | D395: LOLLIPOP | F395: candy, dessert, food, lollipop, nature,object, sweet
A396: =1+R[-1]C -> 395 | B396: U+1F36E | C396: 🍮 | D396: CUSTARD | F396: custard, dessert, food, nature, object,pudding, sweet
A397: =1+R[-1]C -> 396 | B397: U+1F36F | C397: 🍯 | D397: HONEY POT | F397: food, honey, honeypot, nature, object,pot, sweet
A398: =1+R[-1]C -> 397 | B398: U+1F37C | C398: 🍼 | D398: BABY BOTTLE | F398: baby, bottle, drink, milk, nature, object
A399: =1+R[-1]C -> 398 | B399: U+2615 | C399: ☕️ | D399: HOT BEVERAGE | F399: beverage, coffee, drink, hot, nature,object, steaming, tea
A400: =1+R[-1]C -> 399 | B400: U+1F375 | C400: 🍵 | D400: TEACUP WITHOUT HANDLE | F400: beverage, cup, drink, nature, object, tea,teacup
A401: =1+R[-1]C -> 400 | B401: U+1F376 | C401: 🍶 | D401: SAKE BOTTLE AND CUP | F401: bar, beverage, bottle, cup, drink, nature,object, sake
A402: =1+R[-1]C -> 401 | B402: U+1F37E | C402: 🍾 | D402: BOTTLE WITH POPPING CORK | F402: bar, bottle, cork, drink, nature, popping
A403: =1+R[-1]C -> 402 | B403: U+1F377 | C403: 🍷 | D403: WINE GLASS | F403: bar, beverage, drink, glass, nature, object,wine
A404: =1+R[-1]C -> 403 | B404: U+1F378 | C404: 🍸 | D404: COCKTAIL GLASS | F404: bar, cocktail, drink, glass, nature, object
A405: =1+R[-1]C -> 404 | B405: U+1F379 | C405: 🍹 | D405: TROPICAL DRINK | F405: bar, drink, nature, object, tropical
A406: =1+R[-1]C -> 405 | B406: U+1F37A | C406: 🍺 | D406: BEER MUG | F406: bar, beer, drink, mug, nature, object
A407: =1+R[-1]C -> 406 | B407: U+1F37B | C407: 🍻 | D407: CLINKING BEER MUGS | F407: bar, beer, clink, drink, mug, nature,object
A408: =1+R[-1]C -> 407 | B408: U+1F37D | C408: 🍽 | D408: FORK AND KNIFE WITH PLATE | F408: cooking, food, fork, knife, object, place,plate
A409: =1+R[-1]C -> 408 | B409: U+1F374 | C409: 🍴 | D409: FORK AND KNIFE | F409: cooking, food, fork, knife, nature, object
A410: =1+R[-1]C -> 409 | B410: U+1F373 | C410: 🍳 | D410: COOKING | F410: cooking, egg, food, frying, nature, object,pan
A411: =1+R[-1]C -> 410 | B411: U+1F3FA | C411: 🏺 | D411: AMPHORA | F411: amphora, aquarius, cooking, drink, jug,nature, tool, weapon, zodiac
A412: =1+R[-1]C -> 411 | B412: U+1F30D | C412: 🌍 | D412: EARTH GLOBE SHOWING EUROPE-AFRICA | F412: africa, earth, europe, globe, nature, place,world
A413: =1+R[-1]C -> 412 | B413: U+1F30E | C413: 🌎 | D413: EARTH GLOBE SHOWING AMERICAS | F413: americas, earth, globe, nature, place,world
A414: =1+R[-1]C -> 413 | B414: U+1F30F | C414: 🌏 | D414: EARTH GLOBE ASIA-AUSTRALIA | F414: asia, australia, earth, globe, nature, place,world
A415: =1+R[-1]C -> 414 | B415: U+1F310 | C415: 🌐 | D415: GLOBE WITH MERIDIANS | F415: earth, globe, meridians, nature, place,world
A416: =1+R[-1]C -> 415 | B416: U+1F5FA | C416: 🗺 | D416: WORLD MAP | F416: map, place, world
A417: =1+R[-1]C -> 416 | B417: U+1F3D4 | C417: 🏔 | D417: SNOW CAPPED MOUNTAIN | F417: cold, mountain, nature, place, snow
A418: =1+R[-1]C -> 417 | B418: U+26F0 | C418: ⛰ | D418: MOUNTAIN | F418: mountain, place
A419: =1+R[-1]C -> 418 | B419: U+1F30B | C419: 🌋 | D419: VOLCANO | F419: eruption, mountain, nature, place,volcano, weather
A420: =1+R[-1]C -> 419 | B420: U+1F5FB | C420: 🗻 | D420: MOUNT FUJI | F420: fuji, mountain, nature, place
A421: =1+R[-1]C -> 420 | B421: U+1F3D5 | C421: 🏕 | D421: CAMPING | F421: camping, nature, place
A422: =1+R[-1]C -> 421 | B422: U+1F3D6 | C422: 🏖 | D422: BEACH WITH UMBRELLA | F422: beach, nature, place, umbrella
A423: =1+R[-1]C -> 422 | B423: U+1F3DC | C423: 🏜 | D423: DESERT | F423: desert, nature, place
A424: =1+R[-1]C -> 423 | B424: U+1F3DD | C424: 🏝 | D424: DESERT ISLAND | F424: desert, island, nature, place
A425: =1+R[-1]C -> 424 | B425: U+1F3DE | C425: 🏞 | D425: NATIONAL PARK | F425: national park, nature, park, place
A426: =1+R[-1]C -> 425 | B426: U+1F3DF | C426: 🏟 | D426: STADIUM | F426: place, stadium
A427: =1+R[-1]C -> 426 | B427: U+1F3DB | C427: 🏛 | D427: CLASSICAL BUILDING | F427: building, classical, place
A428: =1+R[-1]C -> 427 | B428: U+1F3D7 | C428: 🏗 | D428: BUILDING CONSTRUCTION | F428: building, construction, place
A429: =1+R[-1]C -> 428 | B429: U+1F3D8 | C429: 🏘 | D429: HOUSE BUILDINGS | F429: building, house, place
A430: =1+R[-1]C -> 429 | B430: U+1F3D9 | C430: 🏙 | D430: CITYSCAPE | F430: building, city, place
A431: =1+R[-1]C -> 430 | B431: U+1F3DA | C431: 🏚 | D431: DERELICT HOUSE BUILDING | F431: building, derelict, house, place
A432: =1+R[-1]C -> 431 | B432: U+1F3E0 | C432: 🏠 | D432: HOUSE BUILDING | F432: building, home, house, place
A433: =1+R[-1]C -> 432 | B433: U+1F3E1 | C433: 🏡 | D433: HOUSE WITH GARDEN | F433: building, garden, home, house, place
A434: =1+R[-1]C -> 433 | B434: U+26EA | C434: ⛪️ | D434: CHURCH | F434: building, christian, church, cross, place,religion
A435: =1+R[-1]C -> 434 | B435: U+1F54B | C435: 🕋 | D435: KAABA | F435: islam, kaaba, muslim, place, religion
A436: =1+R[-1]C -> 435 | B436: U+1F54C | C436: 🕌 | D436: MOSQUE | F436: islam, mosque, muslim, place, religion
A437: =1+R[-1]C -> 436 | B437: U+1F54D | C437: 🕍 | D437: SYNAGOGUE | F437: jew, jewish, place, religion, synagogue,temple
A438: =1+R[-1]C -> 437 | B438: U+26E9 | C438: ⛩ | D438: SHINTO SHRINE | F438: religion, shinto, shrine, symbol
A439: =1+R[-1]C -> 438 | B439: U+1F3E2 | C439: 🏢 | D439: OFFICE BUILDING | F439: building, office, place
A440: =1+R[-1]C -> 439 | B440: U+1F3E3 | C440: 🏣 | D440: JAPANESE POST OFFICE | F440: building, japanese, office, place, post
A441: =1+R[-1]C -> 440 | B441: U+1F3E4 | C441: 🏤 | D441: EUROPEAN POST OFFICE | F441: building, european, office, place, post
A442: =1+R[-1]C -> 441 | B442: U+1F3E5 | C442: 🏥 | D442: HOSPITAL | F442: building, doctor, hospital, medicine,place
A443: =1+R[-1]C -> 442 | B443: U+1F3E6 | C443: 🏦 | D443: BANK | F443: bank, building, place
A444: =1+R[-1]C -> 443 | B444: U+1F3E8 | C444: 🏨 | D444: HOTEL | F444: building, hotel, place
A445: =1+R[-1]C -> 444 | B445: U+1F3E9 | C445: 🏩 | D445: LOVE HOTEL | F445: building, hotel, love, place
A446: =1+R[-1]C -> 445 | B446: U+1F3EA | C446: 🏪 | D446: CONVENIENCE STORE | F446: building, convenience, place, store
A447: =1+R[-1]C -> 446 | B447: U+1F3EB | C447: 🏫 | D447: SCHOOL | F447: building, education, place, school
A448: =1+R[-1]C -> 447 | B448: U+1F3EC | C448: 🏬 | D448: DEPARTMENT STORE | F448: building, department, place, store
A449: =1+R[-1]C -> 448 | B449: U+1F3ED | C449: 🏭 | D449: FACTORY | F449: building, factory, place
A450: =1+R[-1]C -> 449 | B450: U+1F3EF | C450: 🏯 | D450: JAPANESE CASTLE | F450: building, castle, japanese, place
A451: =1+R[-1]C -> 450 | B451: U+1F3F0 | C451: 🏰 | D451: EUROPEAN CASTLE | F451: building, castle, european, place
A452: =1+R[-1]C -> 451 | B452: U+1F492 | C452: 💒 | D452: WEDDING | F452: activity, chapel, place, romance, wedding
A453: =1+R[-1]C -> 452 | B453: U+1F5FC | C453: 🗼 | D453: TOKYO TOWER | F453: place, tokyo, tower
A454: =1+R[-1]C -> 453 | B454: U+1F5FD | C454: 🗽 | D454: STATUE OF LIBERTY | F454: liberty, place, statue
A455: =1+R[-1]C -> 454 | B455: U+1F5FE | C455: 🗾 | D455: SILHOUETTE OF JAPAN | F455: japan, map, place
A456: =1+R[-1]C -> 455 | B456: U+26F2 | C456: ⛲️ | D456: FOUNTAIN | F456: fountain, object, place
A457: =1+R[-1]C -> 456 | B457: U+26FA | C457: ⛺️ | D457: TENT | F457: camping, object, place, tent
A458: =1+R[-1]C -> 457 | B458: U+1F301 | C458: 🌁 | D458: FOGGY | F458: fog, nature, place, weather
A459: =1+R[-1]C -> 458 | B459: U+1F303 | C459: 🌃 | D459: NIGHT WITH STARS | F459: nature, night, place, star, weather
A460: =1+R[-1]C -> 459 | B460: U+1F304 | C460: 🌄 | D460: SUNRISE OVER MOUNTAINS | F460: morning, mountain, nature, place, sun,sunrise, time, weather
A461: =1+R[-1]C -> 460 | B461: U+1F305 | C461: 🌅 | D461: SUNRISE | F461: morning, nature, place, sun, sunrise,time, weather
A462: =1+R[-1]C -> 461 | B462: U+1F306 | C462: 🌆 | D462: CITYSCAPE AT DUSK | F462: building, city, dusk, evening, landscape,nature, place, sun, sunset, time, weather
A463: =1+R[-1]C -> 462 | B463: U+1F307 | C463: 🌇 | D463: SUNSET OVER BUILDINGS | F463: building, dusk, nature, place, sun, sunset,time, weather
A464: =1+R[-1]C -> 463 | B464: U+1F309 | C464: 🌉 | D464: BRIDGE AT NIGHT | F464: bridge, nature, night, place, weather
A465: =1+R[-1]C -> 464 | B465: U+2668 | C465: ♨️ | D465: HOT SPRINGS | F465: hot, hotsprings, place, springs, steaming
A466: =1+R[-1]C -> 465 | B466: U+1F30C | C466: 🌌 | D466: MILKY WAY | F466: milky way, nature, place, space, weather
A467: =1+R[-1]C -> 466 | B467: U+1F3A0 | C467: 🎠 | D467: CAROUSEL HORSE | F467: activity, carousel, entertainment, horse,place
A468: =1+R[-1]C -> 467 | B468: U+1F3A1 | C468: 🎡 | D468: FERRIS WHEEL | F468: activity, amusement park, entertainment,ferris, place, wheel
A469: =1+R[-1]C -> 468 | B469: U+1F3A2 | C469: 🎢 | D469: ROLLER COASTER | F469: activity, amusement park, coaster,entertainment, place, roller
A470: =1+R[-1]C -> 469 | B470: U+1F488 | C470: 💈 | D470: BARBER POLE | F470: barber, haircut, place, pole
A471: =1+R[-1]C -> 470 | B471: U+1F3AA | C471: 🎪 | D471: CIRCUS TENT | F471: activity, circus, entertainment, place, tent
A472: =1+R[-1]C -> 471 | B472: U+1F3AD | C472: 🎭 | D472: PERFORMING ARTS | F472: activity, art, entertainment, mask, object,performing, place, theater, theatre
A473: =1+R[-1]C -> 472 | B473: U+1F5BC | C473: 🖼 | D473: FRAME WITH PICTURE | F473: art, frame, museum, object, office,painting, picture
A474: =1+R[-1]C -> 473 | B474: U+1F3A8 | C474: 🎨 | D474: ARTIST PALETTE | F474: activity, art, entertainment, museum,object, painting, palette
A475: =1+R[-1]C -> 474 | B475: U+1F3B0 | C475: 🎰 | D475: SLOT MACHINE | F475: activity, game, object, place, slot
A476: =1+R[-1]C -> 475 | B476: U+1F682 | C476: 🚂 | D476: STEAM LOCOMOTIVE | F476: engine, locomotive, place, railway,steam, train, travel, vehicle
A477: =1+R[-1]C -> 476 | B477: U+1F683 | C477: 🚃 | D477: RAILWAY CAR | F477: car, electric, place, railway, train, tram,travel, trolleybus, vehicle
A478: =1+R[-1]C -> 477 | B478: U+1F684 | C478: 🚄 | D478: HIGH-SPEED TRAIN | F478: place, railway, shinkansen, speed, train,travel, vehicle
A479: =1+R[-1]C -> 478 | B479: U+1F685 | C479: 🚅 | D479: HIGH-SPEED TRAIN WITH BULLET NOSE | F479: bullet, place, railway, shinkansen, speed,train, travel, vehicle
A480: =1+R[-1]C -> 479 | B480: U+1F686 | C480: 🚆 | D480: TRAIN | F480: place, railway, train, travel, vehicle
A481: =1+R[-1]C -> 480 | B481: U+1F687 | C481: 🚇 | D481: METRO | F481: metro, place, subway, travel, vehicle
A482: =1+R[-1]C -> 481 | B482: U+1F688 | C482: 🚈 | D482: LIGHT RAIL | F482: place, railway, travel, vehicle
A483: =1+R[-1]C -> 482 | B483: U+1F689 | C483: 🚉 | D483: STATION | F483: place, railway, station, train, travel,vehicle
A484: =1+R[-1]C -> 483 | B484: U+1F68A | C484: 🚊 | D484: TRAM | F484: place, tram, travel, trolleybus, vehicle
A485: =1+R[-1]C -> 484 | B485: U+1F69D | C485: 🚝 | D485: MONORAIL | F485: monorail, place, travel, vehicle
A486: =1+R[-1]C -> 485 | B486: U+1F69E | C486: 🚞 | D486: MOUNTAIN RAILWAY | F486: car, mountain, place, railway, travel,vehicle
A487: =1+R[-1]C -> 486 | B487: U+1F68B | C487: 🚋 | D487: TRAM CAR | F487: car, place, tram, travel, trolleybus,vehicle
A488: =1+R[-1]C -> 487 | B488: U+1F68C | C488: 🚌 | D488: BUS | F488: bus, place, travel, vehicle
A489: =1+R[-1]C -> 488 | B489: U+1F68D | C489: 🚍 | D489: ONCOMING BUS | F489: bus, oncoming, place, travel, vehicle
A490: =1+R[-1]C -> 489 | B490: U+1F68E | C490: 🚎 | D490: TROLLEYBUS | F490: bus, place, tram, travel, trolley,trolleybus, vehicle
A491: =1+R[-1]C -> 490 | B491: U+1F68F | C491: 🚏 | D491: BUS STOP | F491: bus, busstop, place, stop, travel
A492: =1+R[-1]C -> 491 | B492: U+1F690 | C492: 🚐 | D492: MINIBUS | F492: bus, minibus, place, travel, vehicle
A493: =1+R[-1]C -> 492 | B493: U+1F691 | C493: 🚑 | D493: AMBULANCE | F493: ambulance, place, travel, vehicle
A494: =1+R[-1]C -> 493 | B494: U+1F692 | C494: 🚒 | D494: FIRE ENGINE | F494: engine, fire, place, travel, truck, vehicle
A495: =1+R[-1]C -> 494 | B495: U+1F693 | C495: 🚓 | D495: POLICE CAR | F495: car, patrol, place, police, travel, vehicle
A496: =1+R[-1]C -> 495 | B496: U+1F694 | C496: 🚔 | D496: ONCOMING POLICE CAR | F496: car, oncoming, place, police, travel,vehicle
A497: =1+R[-1]C -> 496 | B497: U+1F695 | C497: 🚕 | D497: TAXI | F497: place, taxi, travel, vehicle
A498: =1+R[-1]C -> 497 | B498: U+1F696 | C498: 🚖 | D498: ONCOMING TAXI | F498: oncoming, place, taxi, travel, vehicle
A499: =1+R[-1]C -> 498 | B499: U+1F697 | C499: 🚗 | D499: AUTOMOBILE | F499: automobile, car, place, travel, vehicle
A500: =1+R[-1]C -> 499 | B500: U+1F698 | C500: 🚘 | D500: ONCOMING AUTOMOBILE | F500: automobile, car, oncoming, place, travel,vehicle
A501: =1+R[-1]C -> 500 | B501: U+1F699 | C501: 🚙 | D501: RECREATIONAL VEHICLE | F501: place, recreational, rv, travel, vehicle
A502: =1+R[-1]C -> 501 | B502: U+1F69A | C502: 🚚 | D502: DELIVERY TRUCK | F502: delivery, place, travel, truck, vehicle
A503: =1+R[-1]C -> 502 | B503: U+1F69B | C503: 🚛 | D503: ARTICULATED LORRY | F503: lorry, place, semi, travel, truck, vehicle
A504: =1+R[-1]C -> 503 | B504: U+1F69C | C504: 🚜 | D504: TRACTOR | F504: place, tractor, travel, vehicle
A505: =1+R[-1]C -> 504 | B505: U+1F6B2 | C505: 🚲 | D505: BICYCLE | F505: bicycle, bike, place, sport, travel, vehicle
A506: =1+R[-1]C -> 505 | B506: U+26FD | C506: ⛽️ | D506: FUEL PUMP | F506: fuel, fuelpump, gas, place, pump, station,travel
A507: =1+R[-1]C -> 506 | B507: U+1F6E3 | C507: 🛣 | D507: MOTORWAY | F507: highway, motorway, place, road, travel
A508: =1+R[-1]C -> 507 | B508: U+1F6E4 | C508: 🛤 | D508: RAILWAY TRACK | F508: place, railway, train, travel
A509: =1+R[-1]C -> 508 | B509: U+1F6A8 | C509: 🚨 | D509: POLICE CARS REVOLVING LIGHT | F509: beacon, car, light, place, police,revolving, travel, vehicle
A510: =1+R[-1]C -> 509 | B510: U+1F6A5 | C510: 🚥 | D510: HORIZONTAL TRAFFIC LIGHT | F510: light, place, signal, traffic, travel
A511: =1+R[-1]C -> 510 | B511: U+1F6A6 | C511: 🚦 | D511: VERTICAL TRAFFIC LIGHT | F511: light, place, signal, traffic, travel
A512: =1+R[-1]C -> 511 | B512: U+1F6A7 | C512: 🚧 | D512: CONSTRUCTION SIGN | F512: barrier, construction, place, travel
A513: =1+R[-1]C -> 512 | B513: U+2693 | C513: ⚓️ | D513: ANCHOR | F513: anchor, place, ship, tool, travel
A514: =1+R[-1]C -> 513 | B514: U+26F5 | C514: ⛵️ | D514: SAILBOAT | F514: boat, place, resort, sailboat, sea, travel,vehicle, yacht
A515: =1+R[-1]C -> 514 | B515: U+1F6A3 | C515: 🚣 | D515: ROWBOAT | F515: boat, place, rowboat, travel, vehicle
A516: =1+R[-1]C -> 515 | B516: U+1F6A4 | C516: 🚤 | D516: SPEEDBOAT | F516: boat, place, speedboat, travel, vehicle
A517: =1+R[-1]C -> 516 | B517: U+1F6F3 | C517: 🛳 | D517: PASSENGER SHIP | F517: passenger, place, ship, travel, vehicle
A518: =1+R[-1]C -> 517 | B518: U+26F4 | C518: ⛴ | D518: FERRY | F518: boat, ferry, place, travel
A519: =1+R[-1]C -> 518 | B519: U+1F6E5 | C519: 🛥 | D519: MOTOR BOAT | F519: boat, motorboat, place, travel, vehicle
A520: =1+R[-1]C -> 519 | B520: U+1F6A2 | C520: 🚢 | D520: SHIP | F520: place, ship, travel, vehicle
A521: =1+R[-1]C -> 520 | B521: U+2708 | C521: ✈️ | D521: AIRPLANE | F521: airplane, place, travel, vehicle
A522: =1+R[-1]C -> 521 | B522: U+1F6E9 | C522: 🛩 | D522: SMALL AIRPLANE | F522: airplane, place, travel, vehicle
A523: =1+R[-1]C -> 522 | B523: U+1F6EB | C523: 🛫 | D523: AIRPLANE DEPARTURE | F523: airplane, check-in, departure, departures,place, travel, vehicle
A524: =1+R[-1]C -> 523 | B524: U+1F6EC | C524: 🛬 | D524: AIRPLANE ARRIVING | F524: airplane, arrivals, arriving, landing,place, travel, vehicle
A525: =1+R[-1]C -> 524 | B525: U+1F4BA | C525: 💺 | D525: SEAT | F525: chair, object, office, place, seat, travel
A526: =1+R[-1]C -> 525 | B526: U+1F681 | C526: 🚁 | D526: HELICOPTER | F526: helicopter, place, travel, vehicle
A527: =1+R[-1]C -> 526 | B527: U+1F69F | C527: 🚟 | D527: SUSPENSION RAILWAY | F527: place, railway, suspension, travel, vehicle
A528: =1+R[-1]C -> 527 | B528: U+1F6A0 | C528: 🚠 | D528: MOUNTAIN CABLEWAY | F528: cable, gondola, mountain, place, travel,vehicle
A529: =1+R[-1]C -> 528 | B529: U+1F6A1 | C529: 🚡 | D529: AERIAL TRAMWAY | F529: aerial, cable, car, gondola, place,ropeway, tramway, travel, vehicle
A530: =1+R[-1]C -> 529 | B530: U+1F680 | C530: 🚀 | D530: ROCKET | F530: place, rocket, space, travel, vehicle
A531: =1+R[-1]C -> 530 | B531: U+1F6F0 | C531: 🛰 | D531: SATELLITE | F531: place, satellite, space, vehicle
A532: =1+R[-1]C -> 531 | B532: U+1F6CE | C532: 🛎 | D532: BELLHOP BELL | F532: bell, bellhop, hotel, object
A533: =1+R[-1]C -> 532 | B533: U+1F6AA | C533: 🚪 | D533: DOOR | F533: door, object, travel
A534: =1+R[-1]C -> 533 | B534: U+1F6CC | C534: 🛌 | D534: SLEEPING ACCOMMODATION or a person in bed | F534: hotel, object, sleep
A535: =1+R[-1]C -> 534 | B535: U+1F6CF | C535: 🛏 | D535: BED | F535: bed, hotel, object, sleep
A536: =1+R[-1]C -> 535 | B536: U+1F6CB | C536: 🛋 | D536: COUCH AND LAMP | F536: couch, hotel, lamp, object
A537: =1+R[-1]C -> 536 | B537: U+1F6BD | C537: 🚽 | D537: TOILET | F537: object, place, toilet, travel
A538: =1+R[-1]C -> 537 | B538: U+1F6BF | C538: 🚿 | D538: SHOWER | F538: object, place, shower, travel, water
A539: =1+R[-1]C -> 538 | B539: U+1F6C0 | C539: 🛀 | D539: BATH or a person taking bath | F539: bath, bathtub, object, place, travel
A540: =1+R[-1]C -> 539 | B540: U+1F6C1 | C540: 🛁 | D540: BATHTUB | F540: bath, bathtub, object, place, travel
A541: =1+R[-1]C -> 540 | B541: U+231B | C541: ⌛️ | D541: HOURGLASS | F541: hourglass, object, sand, time, timer
A542: =1+R[-1]C -> 541 | B542: U+23F3 | C542: ⏳ | D542: HOURGLASS WITH FLOWING SAND | F542: hourglass, object, sand, time, timer
A543: =1+R[-1]C -> 542 | B543: U+231A | C543: ⌚️ | D543: WATCH | F543: clock, object, time, watch
A544: =1+R[-1]C -> 543 | B544: U+23F0 | C544: ⏰ | D544: ALARM CLOCK | F544: alarm, clock, object, time
A545: =1+R[-1]C -> 544 | B545: U+23F1 | C545: ⏱ | D545: STOPWATCH | F545: clock, object, stopwatch, time
A546: =1+R[-1]C -> 545 | B546: U+23F2 | C546: ⏲ | D546: TIMER CLOCK | F546: clock, object, time, timer
A547: =1+R[-1]C -> 546 | B547: U+1F570 | C547: 🕰 | D547: MANTELPIECE CLOCK | F547: clock, object
A548: =1+R[-1]C -> 547 | B548: U+1F55B | C548: 🕛 | D548: TWELVE O'CLOCK | F548: 00, 12, 12:00, clock, o’clock, symbol,time, twelve
A549: =1+R[-1]C -> 548 | B549: U+1F567 | C549: 🕧 | D549: TWELVE-THIRTY | F549: 12, 12:30, 30, clock, symbol, thirty, time,twelve
A550: =1+R[-1]C -> 549 | B550: U+1F550 | C550: 🕐 | D550: ONE O'CLOCK | F550: 00, 1, 1:00, clock, o’clock, one, symbol,time
A551: =1+R[-1]C -> 550 | B551: U+1F55C | C551: 🕜 | D551: ONE-THIRTY | F551: 1, 1:30, 30, clock, one, symbol, thirty,time
A552: =1+R[-1]C -> 551 | B552: U+1F551 | C552: 🕑 | D552: TWO O'CLOCK | F552: 00, 2, 2:00, clock, o’clock, symbol, time,two
A553: =1+R[-1]C -> 552 | B553: U+1F55D | C553: 🕝 | D553: TWO-THIRTY | F553: 2, 2:30, 30, clock, symbol, thirty, time,two
A554: =1+R[-1]C -> 553 | B554: U+1F552 | C554: 🕒 | D554: THREE O'CLOCK | F554: 00, 3, 3:00, clock, o’clock, symbol, three,time
A555: =1+R[-1]C -> 554 | B555: U+1F55E | C555: 🕞 | D555: THREE-THIRTY | F555: 3, 3:30, 30, clock, symbol, thirty, three,time
A556: =1+R[-1]C -> 555 | B556: U+1F553 | C556: 🕓 | D556: FOUR O'CLOCK | F556: 00, 4, 4:00, clock, four, o’clock, symbol,time
A557: =1+R[-1]C -> 556 | B557: U+1F55F | C557: 🕟 | D557: FOUR-THIRTY | F557: 30, 4, 4:30, clock, four, symbol, thirty,time
A558: =1+R[-1]C -> 557 | B558: U+1F554 | C558: 🕔 | D558: FIVE O'CLOCK | F558: 00, 5, 5:00, clock, five, o’clock, symbol,time
A559: =1+R[-1]C -> 558 | B559: U+1F560 | C559: 🕠 | D559: FIVE-THIRTY | F559: 30, 5, 5:30, clock, five, symbol, thirty,time
A560: =1+R[-1]C -> 559 | B560: U+1F555 | C560: 🕕 | D560: SIX O'CLOCK | F560: 00, 6, 6:00, clock, o’clock, six, symbol,time
A561: =1+R[-1]C -> 560 | B561: U+1F561 | C561: 🕡 | D561: SIX-THIRTY | F561: 30, 6, 6:30, clock, six, symbol, thirty,time
A562: =1+R[-1]C -> 561 | B562: U+1F556 | C562: 🕖 | D562: SEVEN O'CLOCK | F562: 00, 7, 7:00, clock, o’clock, seven,symbol, time
A563: =1+R[-1]C -> 562 | B563: U+1F562 | C563: 🕢 | D563: SEVEN-THIRTY | F563: 30, 7, 7:30, clock, seven, symbol, thirty,time
A564: =1+R[-1]C -> 563 | B564: U+1F557 | C564: 🕗 | D564: EIGHT O'CLOCK | F564: 00, 8, 8:00, clock, eight, o’clock, symbol,time
A565: =1+R[-1]C -> 564 | B565: U+1F563 | C565: 🕣 | D565: EIGHT-THIRTY | F565: 30, 8, 8:30, clock, eight, symbol, thirty,time
A566: =1+R[-1]C -> 565 | B566: U+1F558 | C566: 🕘 | D566: NINE O'CLOCK | F566: 00, 9, 9:00, clock, nine, o’clock, symbol,time
A567: =1+R[-1]C -> 566 | B567: U+1F564 | C567: 🕤 | D567: NINE-THIRTY | F567: 30, 9, 9:30, clock, nine, symbol, thirty,time
A568: =1+R[-1]C -> 567 | B568: U+1F559 | C568: 🕙 | D568: TEN O'CLOCK | F568: 00, 10, 10:00, clock, o’clock, symbol,ten, time
A569: =1+R[-1]C -> 568 | B569: U+1F565 | C569: 🕥 | D569: TEN-THIRTY | F569: 10, 10:30, 30, clock, symbol, ten, thirty,time
A570: =1+R[-1]C -> 569 | B570: U+1F55A | C570: 🕚 | D570: ELEVEN O'CLOCK | F570: 00, 11, 11:00, clock, eleven, o’clock,symbol, time
A571: =1+R[-1]C -> 570 | B571: U+1F566 | C571: 🕦 | D571: ELEVEN-THIRTY | F571: 11, 11:30, 30, clock, eleven, symbol,thirty, time
A572: =1+R[-1]C -> 571 | B572: U+1F311 | C572: 🌑 | D572: NEW MOON SYMBOL | F572: dark, moon, nature, place, space, time,weather
A573: =1+R[-1]C -> 572 | B573: U+1F312 | C573: 🌒 | D573: WAXING CRESCENT MOON SYMBOL | F573: crescent, moon, nature, place, space,time, waxing, weather
A574: =1+R[-1]C -> 573 | B574: U+1F313 | C574: 🌓 | D574: FIRST QUARTER MOON SYMBOL | F574: moon, nature, place, quarter, space, time,weather
A575: =1+R[-1]C -> 574 | B575: U+1F314 | C575: 🌔 | D575: WAXING GIBBOUS MOON SYMBOL | F575: gibbous, moon, nature, place, space,time, waxing, weather
A576: =1+R[-1]C -> 575 | B576: U+1F315 | C576: 🌕 | D576: FULL MOON SYMBOL | F576: full, moon, nature, place, space, time,weather
A577: =1+R[-1]C -> 576 | B577: U+1F316 | C577: 🌖 | D577: WANING GIBBOUS MOON SYMBOL | F577: gibbous, moon, nature, place, space,time, waning, weather
A578: =1+R[-1]C -> 577 | B578: U+1F317 | C578: 🌗 | D578: LAST QUARTER MOON SYMBOL | F578: moon, nature, place, quarter, space, time,weather
A579: =1+R[-1]C -> 578 | B579: U+1F318 | C579: 🌘 | D579: WANING CRESCENT MOON SYMBOL | F579: crescent, moon, nature, place, space,time, waning, weather
A580: =1+R[-1]C -> 579 | B580: U+1F319 | C580: 🌙 | D580: CRESCENT MOON | F580: crescent, moon, nature, place, space,time, weather
A581: =1+R[-1]C -> 580 | B581: U+1F31A | C581: 🌚 | D581: NEW MOON WITH FACE | F581: face, moon, nature, place, space, time,weather
A582: =1+R[-1]C -> 581 | B582: U+1F31B | C582: 🌛 | D582: FIRST QUARTER MOON WITH FACE | F582: face, moon, nature, place, quarter, space,weather
A583: =1+R[-1]C -> 582 | B583: U+1F31C | C583: 🌜 | D583: LAST QUARTER MOON WITH FACE | F583: face, moon, nature, place, quarter, space,weather
A584: =1+R[-1]C -> 583 | B584: U+1F321 | C584: 🌡 | D584: THERMOMETER | F584: nature, thermometer, weather
A585: =1+R[-1]C -> 584 | B585: U+2600 | C585: ☀️ | D585: BLACK SUN WITH RAYS | F585: bright, nature, rays, space, sun, sunny,weather
A586: =1+R[-1]C -> 585 | B586: U+1F31D | C586: 🌝 | D586: FULL MOON WITH FACE | F586: bright, face, full, moon, nature, place,space, weather
A587: =1+R[-1]C -> 586 | B587: U+1F31E | C587: 🌞 | D587: SUN WITH FACE | F587: bright, face, nature, place, space, sun,weather
A588: =1+R[-1]C -> 587 | B588: U+2B50 | C588: ⭐️ | D588: WHITE MEDIUM STAR | F588: nature, place, star
A589: =1+R[-1]C -> 588 | B589: U+1F31F | C589: 🌟 | D589: GLOWING STAR | F589: glittery, glow, object, place, shining,sparkle, star
A590: =1+R[-1]C -> 589 | B590: U+1F320 | C590: 🌠 | D590: SHOOTING STAR | F590: activity, falling, nature, place, shooting,space, star
A591: =1+R[-1]C -> 590 | B591: U+2601 | C591: ☁️ | D591: CLOUD | F591: cloud, nature, weather
A592: =1+R[-1]C -> 591 | B592: U+26C5 | C592: ⛅️ | D592: SUN BEHIND CLOUD | F592: cloud, nature, sun, weather
A593: =1+R[-1]C -> 592 | B593: U+26C8 | C593: ⛈ | D593: THUNDER CLOUD AND RAIN | F593: cloud, nature, rain, thunder, weather
A594: =1+R[-1]C -> 593 | B594: U+1F324 | C594: 🌤 | D594: WHITE SUN WITH SMALL CLOUD | F594: cloud, nature, sun, weather
A595: =1+R[-1]C -> 594 | B595: U+1F325 | C595: 🌥 | D595: WHITE SUN BEHIND CLOUD | F595: cloud, nature, sun, weather
A596: =1+R[-1]C -> 595 | B596: U+1F326 | C596: 🌦 | D596: WHITE SUN BEHIND CLOUD WITH RAIN | F596: cloud, nature, rain, sun, weather
A597: =1+R[-1]C -> 596 | B597: U+1F327 | C597: 🌧 | D597: CLOUD WITH RAIN | F597: cloud, nature, rain, weather
A598: =1+R[-1]C -> 597 | B598: U+1F328 | C598: 🌨 | D598: CLOUD WITH SNOW | F598: cloud, cold, nature, snow, weather
A599: =1+R[-1]C -> 598 | B599: U+1F329 | C599: 🌩 | D599: CLOUD WITH LIGHTNING | F599: cloud, lightning, nature, weather
A600: =1+R[-1]C -> 599 | B600: U+1F32A | C600: 🌪 | D600: CLOUD WITH TORNADO | F600: cloud, nature, tornado, weather,whirlwind
A601: =1+R[-1]C -> 600 | B601: U+1F32B | C601: 🌫 | D601: FOG | F601: cloud, fog, nature, weather
A602: =1+R[-1]C -> 601 | B602: U+1F32C | C602: 🌬 | D602: WIND BLOWING FACE | F602: blow, cloud, face, nature, weather, wind
A603: =1+R[-1]C -> 602 | B603: U+1F300 | C603: 🌀 | D603: CYCLONE | F603: cyclone, dizzy, nature, twister, typhoon,weather
A604: =1+R[-1]C -> 603 | B604: U+1F308 | C604: 🌈 | D604: RAINBOW | F604: nature, rain, rainbow, weather
A605: =1+R[-1]C -> 604 | B605: U+1F302 | C605: 🌂 | D605: CLOSED UMBRELLA | F605: clothing, nature, person, rain, umbrella,weather
A606: =1+R[-1]C -> 605 | B606: U+2602 | C606: ☂ | D606: UMBRELLA | F606: clothing, nature, rain, umbrella, weather
A607: =1+R[-1]C -> 606 | B607: U+2614 | C607: ☔️ | D607: UMBRELLA WITH RAIN DROPS | F607: clothing, drop, nature, rain, umbrella,weather
A608: =1+R[-1]C -> 607 | B608: U+26F1 | C608: ⛱ | D608: UMBRELLA ON GROUND | F608: nature, rain, sun, travel, umbrella,weather
A609: =1+R[-1]C -> 608 | B609: U+26A1 | C609: ⚡️ | D609: HIGH VOLTAGE SIGN | F609: danger, electric, electricity, lightning,nature, symbol, voltage, zap
A610: =1+R[-1]C -> 609 | B610: U+2744 | C610: ❄️ | D610: SNOWFLAKE | F610: cold, nature, snow, snowflake, weather
A611: =1+R[-1]C -> 610 | B611: U+2603 | C611: ☃ | D611: SNOWMAN | F611: cold, nature, snow, snowman, weather
A612: =1+R[-1]C -> 611 | B612: U+26C4 | C612: ⛄️ | D612: SNOWMAN WITHOUT SNOW | F612: cold, nature, snow, snowman, weather
A613: =1+R[-1]C -> 612 | B613: U+2604 | C613: ☄ | D613: COMET | F613: comet, object, space
A614: =1+R[-1]C -> 613 | B614: U+1F525 | C614: 🔥 | D614: FIRE | F614: fire, flame, object, tool
A615: =1+R[-1]C -> 614 | B615: U+1F4A7 | C615: 💧 | D615: DROPLET | F615: cold, comic, drop, emotion, nature,object, person, sweat, weather
A616: =1+R[-1]C -> 615 | B616: U+1F30A | C616: 🌊 | D616: WATER WAVE | F616: nature, ocean, place, water, wave,weather
A617: =1+R[-1]C -> 616 | B617: U+1F383 | C617: 🎃 | D617: JACK-O-LANTERN | F617: activity, celebration, entertainment,halloween, jack, lantern, object
A618: =1+R[-1]C -> 617 | B618: U+1F384 | C618: 🎄 | D618: CHRISTMAS TREE | F618: activity, celebration, christmas,entertainment, object, tree
A619: =1+R[-1]C -> 618 | B619: U+1F386 | C619: 🎆 | D619: FIREWORKS | F619: activity, celebration, entertainment,fireworks, object
A620: =1+R[-1]C -> 619 | B620: U+1F387 | C620: 🎇 | D620: FIREWORK SPARKLER | F620: activity, celebration, entertainment,fireworks, object, sparkle
A621: =1+R[-1]C -> 620 | B621: U+2728 | C621: ✨ | D621: SPARKLES | F621: emotion, entertainment, object, sign,sparkle, star
A622: =1+R[-1]C -> 621 | B622: U+1F388 | C622: 🎈 | D622: BALLOON | F622: activity, balloon, celebration,entertainment, object
A623: =1+R[-1]C -> 622 | B623: U+1F389 | C623: 🎉 | D623: PARTY POPPER | F623: activity, celebration, entertainment,object, party, popper, tada
A624: =1+R[-1]C -> 623 | B624: U+1F38A | C624: 🎊 | D624: CONFETTI BALL | F624: activity, ball, celebration, confetti,entertainment, object
A625: =1+R[-1]C -> 624 | B625: U+1F38B | C625: 🎋 | D625: TANABATA TREE | F625: activity, banner, celebration,entertainment, japanese, object, tree
A626: =1+R[-1]C -> 625 | B626: U+1F38C | C626: 🎌 | D626: CROSSED FLAGS | F626: activity, celebration, cross, crossed, flag,japanese, object
A627: =1+R[-1]C -> 626 | B627: U+1F38D | C627: 🎍 | D627: PINE DECORATION | F627: activity, bamboo, celebration, japanese,object, pine, plant
A628: =1+R[-1]C -> 627 | B628: U+1F38E | C628: 🎎 | D628: JAPANESE DOLLS | F628: activity, celebration, doll, entertainment,festival, japanese, object
A629: =1+R[-1]C -> 628 | B629: U+1F38F | C629: 🎏 | D629: CARP STREAMER | F629: activity, carp, celebration, entertainment,flag, object, streamer
A630: =1+R[-1]C -> 629 | B630: U+1F390 | C630: 🎐 | D630: WIND CHIME | F630: activity, bell, celebration, chime,entertainment, object, wind
A631: =1+R[-1]C -> 630 | B631: U+1F391 | C631: 🎑 | D631: MOON VIEWING CEREMONY | F631: activity, celebration, ceremony,entertainment, moon, nature, object
A632: =1+R[-1]C -> 631 | B632: U+1F380 | C632: 🎀 | D632: RIBBON | F632: celebration, emotion, object, person,ribbon
A633: =1+R[-1]C -> 632 | B633: U+1F381 | C633: 🎁 | D633: WRAPPED PRESENT | F633: box, celebration, entertainment, gift,object, present, wrapped
A634: =1+R[-1]C -> 633 | B634: U+1F396 | C634: 🎖 | D634: MILITARY MEDAL | F634: celebration, medal, military, object
A635: =1+R[-1]C -> 634 | B635: U+1F397 | C635: 🎗 | D635: REMINDER RIBBON | F635: celebration, object, reminder, ribbon
A636: =1+R[-1]C -> 635 | B636: U+1F39E | C636: 🎞 | D636: FILM FRAMES | F636: cinema, entertainment, film, frames,movie, object
A637: =1+R[-1]C -> 636 | B637: U+1F39F | C637: 🎟 | D637: ADMISSION TICKETS | F637: admission, entertainment, object, ticket
A638: =1+R[-1]C -> 637 | B638: U+1F3AB | C638: 🎫 | D638: TICKET | F638: activity, admission, entertainment,object, place, ticket
A639: =1+R[-1]C -> 638 | B639: U+1F3F7 | C639: 🏷 | D639: LABEL | F639: label, object
A640: =1+R[-1]C -> 639 | B640: U+26BD | C640: ⚽️ | D640: SOCCER BALL | F640: ball, object, place, soccer, sport
A641: =1+R[-1]C -> 640 | B641: U+26BE | C641: ⚾️ | D641: BASEBALL | F641: ball, baseball, object, place, sport
A642: =1+R[-1]C -> 641 | B642: U+26BE | C642: 🏀 | D642: BASKETBALL AND HOOP | F642: ball, basketball, hoop, object, place, sport
A643: =1+R[-1]C -> 642 | B643: U+1F3C8 | C643: 🏈 | D643: AMERICAN FOOTBALL | F643: american, ball, football, object, place,sport
A644: =1+R[-1]C -> 643 | B644: U+1F3C9 | C644: 🏉 | D644: RUGBY FOOTBALL | F644: ball, football, object, place, rugby, sport
A645: =1+R[-1]C -> 644 | B645: U+1F3BE | C645: 🎾 | D645: TENNIS RACQUET AND BALL | F645: ball, object, place, racquet, sport, tennis
A646: =1+R[-1]C -> 645 | B646: U+1F3B1 | C646: 🎱 | D646: BILLIARDS | F646: 8, 8 ball, ball, billiard, eight, game,object, place, sport
A647: =1+R[-1]C -> 646 | B647: U+1F3B3 | C647: 🎳 | D647: BOWLING | F647: ball, bowling, game, object, place, sport
A648: =1+R[-1]C -> 647 | B648: U+26F3 | C648: ⛳️ | D648: FLAG IN HOLE | F648: flag, golf, hole, object, place, sport,travel
A649: =1+R[-1]C -> 648 | B649: U+1F3CC | C649: 🏌 | D649: GOLFER | F649: ball, golf, person, sport
A650: =1+R[-1]C -> 649 | B650: U+26F8 | C650: ⛸ | D650: ICE SKATE | F650: ice, place, skate, sport, travel
A651: =1+R[-1]C -> 650 | B651: U+1F3A3 | C651: 🎣 | D651: FISHING POLE AND FISH fishing pole | F651: entertainment, fish, object, place, pole,sport
A652: =1+R[-1]C -> 651 | B652: U+1F3BD | C652: 🎽 | D652: RUNNING SHIRT WITH SASH | F652: person, place, running, sash, shirt, sport
A653: =1+R[-1]C -> 652 | B653: U+1F3BF | C653: 🎿 | D653: SKI AND SKI BOOT | F653: object, ski, snow, sport
A654: =1+R[-1]C -> 653 | B654: U+26F7 | C654: ⛷ | D654: SKIER | F654: person, ski, snow, sport, travel
A655: =1+R[-1]C -> 654 | B655: U+1F3C2 | C655: 🏂 | D655: SNOWBOARDER | F655: person, ski, snow, snowboard, sport
A656: =1+R[-1]C -> 655 | B656: U+1F3C4 | C656: 🏄 | D656: SURFER | F656: person, sport, surfer, surfing
A657: =1+R[-1]C -> 656 | B657: U+1F3C7 | C657: 🏇 | D657: HORSE RACING | F657: horse, jockey, person, racehorse, racing,sport, travel
A658: =1+R[-1]C -> 657 | B658: U+1F3CA | C658: 🏊 | D658: SWIMMER | F658: person, sport, swim, swimmer, travel
A659: =1+R[-1]C -> 658 | B659: U+26F9 | C659: ⛹ | D659: PERSON WITH BALL | F659: ball, person, sport, travel
A660: =1+R[-1]C -> 659 | B660: U+1F3CB | C660: 🏋 | D660: WEIGHT LIFTER | F660: lifter, person, sport, weight
A661: =1+R[-1]C -> 660 | B661: U+1F6B4 | C661: 🚴 | D661: BICYCLIST | F661: bicycle, bicyclist, bike, cyclist, person,place, sport, travel
A662: =1+R[-1]C -> 661 | B662: U+1F6B5 | C662: 🚵 | D662: MOUNTAIN BICYCLIST | F662: bicycle, bicyclist, bike, cyclist, mountain,person, place, sport, travel
A663: =1+R[-1]C -> 662 | B663: U+1F3CE | C663: 🏎 | D663: RACING CAR | F663: car, place, racing, sport, travel
A664: =1+R[-1]C -> 663 | B664: U+1F3CD | C664: 🏍 | D664: RACING MOTORCYCLE | F664: motorcycle, person, racing, sport, travel
A665: =1+R[-1]C -> 664 | B665: U+1F3C5 | C665: 🏅 | D665: SPORTS MEDAL | F665: medal, object, sport
A666: =1+R[-1]C -> 665 | B666: U+1F3C6 | C666: 🏆 | D666: TROPHY | F666: object, place, prize, sport, trophy
A667: =1+R[-1]C -> 666 | B667: U+1F3CF | C667: 🏏 | D667: CRICKET BAT AND BALL | F667: ball, bat, cricket, game, object, sport
A668: =1+R[-1]C -> 667 | B668: U+1F3D0 | C668: 🏐 | D668: VOLLEYBALL | F668: ball, game, object, sport, volleyball
A669: =1+R[-1]C -> 668 | B669: U+1F3D1 | C669: 🏑 | D669: FIELD HOCKEY STICK AND BALL | F669: ball, field, game, hockey, object, sport,stick
A670: =1+R[-1]C -> 669 | B670: U+1F3D2 | C670: 🏒 | D670: ICE HOCKEY STICK AND PUCK | F670: game, hockey, ice, object, puck, sport,stick
A671: =1+R[-1]C -> 670 | B671: U+1F3D3 | C671: 🏓 | D671: TABLE TENNIS PADDLE AND BALL | F671: ball, bat, game, object, paddle, sport,table tennis
A672: =1+R[-1]C -> 671 | B672: U+1F3F8 | C672: 🏸 | D672: BADMINTON RACQUET AND SHUTTLECOCK | F672: badminton, birdie, game, object, racquet,shuttlecock, sport
A673: =1+R[-1]C -> 672 | B673: U+1F3AF | C673: 🎯 | D673: DIRECT HIT | F673: activity, bull, bullseye, dart,entertainment, eye, game, hit, object,target
A674: =1+R[-1]C -> 673 | B674: U+1F3AE | C674: 🎮 | D674: VIDEO GAME | F674: controller, entertainment, game, object,video game
A675: =1+R[-1]C -> 674 | B675: U+1F579 | C675: 🕹 | D675: JOYSTICK | F675: entertainment, game, joystick, object,video game
A676: =1+R[-1]C -> 675 | B676: U+1F3B2 | C676: 🎲 | D676: GAME DIE | F676: dice, die, entertainment, game, object
A677: =1+R[-1]C -> 676 | B677: U+2660 | C677: ♠️ | D677: BLACK SPADE SUIT | F677: card, game, spade, suit, symbol
A678: =1+R[-1]C -> 677 | B678: U+2665 | C678: ♥️ | D678: BLACK HEART SUIT | F678: card, emotion, game, heart, hearts, suit,symbol
A679: =1+R[-1]C -> 678 | B679: U+2666 | C679: ♦️ | D679: BLACK DIAMOND SUIT | F679: card, diamond, diamonds, game, suit,symbol
A680: =1+R[-1]C -> 679 | B680: U+2663 | C680: ♣️ | D680: BLACK CLUB SUIT | F680: card, club, clubs, game, suit, symbol
A681: =1+R[-1]C -> 680 | B681: U+1F0CF | C681: 🃏 | D681: PLAYING CARD BLACK JOKER | F681: card, entertainment, game, joker, object,playing
A682: =1+R[-1]C -> 681 | B682: U+1F004 | C682: 🀄️ | D682: MAHJONG TILE RED DRAGON | F682: game, mahjong, object, red
A683: =1+R[-1]C -> 682 | B683: U+1F3B4 | C683: 🎴 | D683: FLOWER PLAYING CARDS | F683: activity, card, entertainment, flower,game, japanese, object, playing
A684: =1+R[-1]C -> 683 | B684: U+1F507 | C684: 🔇 | D684: SPEAKER WITH CANCELLATION STROKE or speaker off | F684: mute, object, quiet, silent, sound,speaker, volume
A685: =1+R[-1]C -> 684 | B685: U+1F508 | C685: 🔈 | D685: SPEAKER | F685: object, sound, speaker, volume
A686: =1+R[-1]C -> 685 | B686: U+1F509 | C686: 🔉 | D686: SPEAKER WITH ONE SOUND WAVE or speaker on | F686: low, object, sound, speaker, volume,wave
A687: =1+R[-1]C -> 686 | B687: U+1F50A | C687: 🔊 | D687: SPEAKER WITH THREE SOUND WAVES or speaker on and loud | F687: 3, entertainment, high, loud, object,sound, speaker, three, volume
A688: =1+R[-1]C -> 687 | B688: U+1F4E2 | C688: 📢 | D688: PUBLIC ADDRESS LOUDSPEAKER | F688: communication, loud, loudspeaker,object, public address, sound
A689: =1+R[-1]C -> 688 | B689: U+1F4E3 | C689: 📣 | D689: CHEERING MEGAPHONE | F689: cheering, communication, megaphone,object, sound
A690: =1+R[-1]C -> 689 | B690: U+1F4EF | C690: 📯 | D690: POSTAL HORN | F690: communication, entertainment, horn,object, post, postal, sound
A691: =1+R[-1]C -> 690 | B691: U+1F514 | C691: 🔔 | D691: BELL | F691: bell, object, sound
A692: =1+R[-1]C -> 691 | B692: U+1F515 | C692: 🔕 | D692: BELL WITH CANCELLATION STROKE or bell with slash | F692: bell, forbidden, mute, no, not, object,prohibited, quiet, silent, sound
A693: =1+R[-1]C -> 692 | B693: U+1F3BC | C693: 🎼 | D693: MUSICAL SCORE | F693: activity, entertainment, music, object,score, sound
A694: =1+R[-1]C -> 693 | B694: U+1F3B5 | C694: 🎵 | D694: MUSICAL NOTE | F694: activity, entertainment, music, note,object, sound
A695: =1+R[-1]C -> 694 | B695: U+1F3B6 | C695: 🎶 | D695: MULTIPLE MUSICAL NOTES | F695: activity, entertainment, music, note,notes, object, sound
A696: =1+R[-1]C -> 695 | B696: U+1F399 | C696: 🎙 | D696: STUDIO MICROPHONE | F696: mic, microphone, music, object, sound,studio
A697: =1+R[-1]C -> 696 | B697: U+1F39A | C697: 🎚 | D697: LEVEL SLIDER | F697: level, music, object, slider, sound
A698: =1+R[-1]C -> 697 | B698: U+1F39B | C698: 🎛 | D698: CONTROL KNOBS | F698: control, knobs, music, object, sound
A699: =1+R[-1]C -> 698 | B699: U+1F3A4 | C699: 🎤 | D699: MICROPHONE | F699: activity, entertainment, karaoke, mic,microphone, object, sound
A700: =1+R[-1]C -> 699 | B700: U+1F3A7 | C700: 🎧 | D700: HEADPHONE | F700: activity, earbud, entertainment,headphone, object, sound
A701: =1+R[-1]C -> 700 | B701: U+1F3B7 | C701: 🎷 | D701: SAXOPHONE | F701: activity, entertainment, instrument,music, object, sax, saxophone, sound
A702: =1+R[-1]C -> 701 | B702: U+1F3B8 | C702: 🎸 | D702: GUITAR | F702: activity, entertainment, guitar,instrument, music, object, sound
A703: =1+R[-1]C -> 702 | B703: U+1F3B9 | C703: 🎹 | D703: MUSICAL KEYBOARD | F703: activity, entertainment, instrument,keyboard, music, object, piano, sound
A704: =1+R[-1]C -> 703 | B704: U+1F3BA | C704: 🎺 | D704: TRUMPET | F704: activity, entertainment, instrument,music, object, sound, trumpet
A705: =1+R[-1]C -> 704 | B705: U+1F3BB | C705: 🎻 | D705: VIOLIN | F705: activity, entertainment, instrument,music, object, sound, violin
A706: =1+R[-1]C -> 705 | B706: U+1F4FB | C706: 📻 | D706: RADIO | F706: entertainment, object, radio, video
A707: =1+R[-1]C -> 706 | B707: U+1F4F1 | C707: 📱 | D707: MOBILE PHONE | F707: cell, communication, mobile, object,phone, telephone
A708: =1+R[-1]C -> 707 | B708: U+1F4F2 | C708: 📲 | D708: MOBILE PHONE WITH RIGHTWARDS ARROW AT LEFT | F708: arrow, call, cell, communication, mobile,object, phone, receive, telephone
A709: =1+R[-1]C -> 708 | B709: U+260E | C709: ☎️ | D709: BLACK TELEPHONE | F709: object, office, phone, sound, telephone
A710: =1+R[-1]C -> 709 | B710: U+1F4DE | C710: 📞 | D710: TELEPHONE RECEIVER | F710: communication, object, phone, receiver,sound, telephone
A711: =1+R[-1]C -> 710 | B711: U+1F4DF | C711: 📟 | D711: PAGER | F711: communication, object, office, pager
A712: =1+R[-1]C -> 711 | B712: U+1F4E0 | C712: 📠 | D712: FAX MACHINE | F712: communication, fax, object, office
A713: =1+R[-1]C -> 712 | B713: U+1F50B | C713: 🔋 | D713: BATTERY | F713: battery, object
A714: =1+R[-1]C -> 713 | B714: U+1F50C | C714: 🔌 | D714: ELECTRIC PLUG | F714: electric, electricity, object, plug
A715: =1+R[-1]C -> 714 | B715: U+1F4BB | C715: 💻 | D715: PERSONAL COMPUTER | F715: computer, object, office, pc, personal
A716: =1+R[-1]C -> 715 | B716: U+1F5A5 | C716: 🖥 | D716: DESKTOP COMPUTER | F716: computer, desktop, object, office
A717: =1+R[-1]C -> 716 | B717: U+1F5A8 | C717: 🖨 | D717: PRINTER | F717: computer, object, office, printer
A718: =1+R[-1]C -> 717 | B718: U+2328 | C718: ⌨ | D718: KEYBOARD | F718: computer, keyboard, object
A719: =1+R[-1]C -> 718 | B719: U+1F5B1 | C719: 🖱 | D719: THREE BUTTON MOUSE | F719: 3, button, computer, mouse, object,office, three
A720: =1+R[-1]C -> 719 | B720: U+1F5B2 | C720: 🖲 | D720: TRACKBALL | F720: computer, object, office, trackball
A721: =1+R[-1]C -> 720 | B721: U+1F4BD | C721: 💽 | D721: MINIDISC | F721: computer, disk, entertainment, minidisk,object, office, optical
A722: =1+R[-1]C -> 721 | B722: U+1F4BE | C722: 💾 | D722: FLOPPY DISK | F722: computer, disk, floppy, object, office
A723: =1+R[-1]C -> 722 | B723: U+1F4BF | C723: 💿 | D723: OPTICAL DISC | F723: blu-ray, cd, computer, disk, dvd, object,office, optical
A724: =1+R[-1]C -> 723 | B724: U+1F4C0 | C724: 📀 | D724: DVD | F724: blu-ray, cd, computer, disk, dvd,entertainment, object, office, optical
A725: =1+R[-1]C -> 724 | B725: U+1F3A5 | C725: 🎥 | D725: MOVIE CAMERA | F725: activity, camera, cinema, entertainment,movie, object
A726: =1+R[-1]C -> 725 | B726: U+1F3AC | C726: 🎬 | D726: CLAPPER BOARD | F726: activity, clapper, entertainment, movie,object
A727: =1+R[-1]C -> 726 | B727: U+1F4FD | C727: 📽 | D727: FILM PROJECTOR | F727: cinema, entertainment, film, movie,object, projector, video
A728: =1+R[-1]C -> 727 | B728: U+1F4FA | C728: 📺 | D728: TELEVISION | F728: entertainment, object, television, tv,video
A729: =1+R[-1]C -> 728 | B729: U+1F4F7 | C729: 📷 | D729: CAMERA | F729: camera, entertainment, object, video
A730: =1+R[-1]C -> 729 | B730: U+1F4F8 | C730: 📸 | D730: CAMERA WITH FLASH | F730: camera, flash, object, video
A731: =1+R[-1]C -> 730 | B731: U+1F4F9 | C731: 📹 | D731: VIDEO CAMERA | F731: camera, entertainment, object, video
A732: =1+R[-1]C -> 731 | B732: U+1F4FC | C732: 📼 | D732: VIDEOCASSETTE | F732: entertainment, object, tape, vhs, video,videocassette
A733: =1+R[-1]C -> 732 | B733: U+1F50D | C733: 🔍 | D733: LEFT-POINTING MAGNIFYING GLASS | F733: glass, magnifying, object, search, tool
A734: =1+R[-1]C -> 733 | B734: U+1F50E | C734: 🔎 | D734: RIGHT-POINTING MAGNIFYING GLASS | F734: glass, magnifying, object, search, tool
A735: =1+R[-1]C -> 734 | B735: U+1F52C | C735: 🔬 | D735: MICROSCOPE | F735: microscope, object, tool
A736: =1+R[-1]C -> 735 | B736: U+1F52D | C736: 🔭 | D736: TELESCOPE | F736: object, telescope, tool
A737: =1+R[-1]C -> 736 | B737: U+1F4E1 | C737: 📡 | D737: SATELLITE ANTENNA | F737: antenna, communication, dish, object,office, satellite
A738: =1+R[-1]C -> 737 | B738: U+1F56F | C738: 🕯 | D738: CANDLE | F738: candle, light, object
A739: =1+R[-1]C -> 738 | B739: U+1F4A1 | C739: 💡 | D739: ELECTRIC LIGHT BULB | F739: bulb, comic, electric, idea, light, object
A740: =1+R[-1]C -> 739 | B740: U+1F526 | C740: 🔦 | D740: ELECTRIC TORCH | F740: electric, flashlight, light, object, tool,torch
A741: =1+R[-1]C -> 740 | B741: U+1F3EE | C741: 🏮 | D741: IZAKAYA LANTERN or red paper lantern | F741: bar, japanese, lantern, light, place, red
A742: =1+R[-1]C -> 741 | B742: U+1F4D4 | C742: 📔 | D742: NOTEBOOK WITH DECORATIVE COVER | F742: book, cover, decorated, education,notebook, object, office
A743: =1+R[-1]C -> 742 | B743: U+1F4D5 | C743: 📕 | D743: CLOSED BOOK | F743: book, closed, education, object, office
A744: =1+R[-1]C -> 743 | B744: U+1F4D6 | C744: 📖 | D744: OPEN BOOK | F744: book, education, object, office, open
A745: =1+R[-1]C -> 744 | B745: U+1F4D7 | C745: 📗 | D745: GREEN BOOK | F745: book, education, green, object, office
A746: =1+R[-1]C -> 745 | B746: U+1F4D8 | C746: 📘 | D746: BLUE BOOK | F746: blue, book, education, object, office
A747: =1+R[-1]C -> 746 | B747: U+1F4D9 | C747: 📙 | D747: ORANGE BOOK | F747: book, education, object, office, orange
A748: =1+R[-1]C -> 747 | B748: U+1F4DA | C748: 📚 | D748: BOOKS | F748: book, books, education, object, office
A749: =1+R[-1]C -> 748 | B749: U+1F4D3 | C749: 📓 | D749: NOTEBOOK | F749: notebook, object, office
A750: =1+R[-1]C -> 749 | B750: U+1F4D2 | C750: 📒 | D750: LEDGER | F750: ledger, notebook, object, office
A751: =1+R[-1]C -> 750 | B751: U+1F4C3 | C751: 📃 | D751: PAGE WITH CURL | F751: curl, document, object, office, page
A752: =1+R[-1]C -> 751 | B752: U+1F4DC | C752: 📜 | D752: SCROLL | F752: object, office, paper, scroll
A753: =1+R[-1]C -> 752 | B753: U+1F4C4 | C753: 📄 | D753: PAGE FACING UP | F753: document, object, office, page
A754: =1+R[-1]C -> 753 | B754: U+1F4F0 | C754: 📰 | D754: NEWSPAPER | F754: communication, news, newspaper,object, paper
A755: =1+R[-1]C -> 754 | B755: U+1F5DE | C755: 🗞 | D755: ROLLED-UP NEWSPAPER | F755: news, newspaper, object, paper, rolled
A756: =1+R[-1]C -> 755 | B756: U+1F4D1 | C756: 📑 | D756: BOOKMARK TABS | F756: bookmark, mark, marker, object, office,tabs
A757: =1+R[-1]C -> 756 | B757: U+1F516 | C757: 🔖 | D757: BOOKMARK | F757: bookmark, mark, object
A758: =1+R[-1]C -> 757 | B758: U+1F4B0 | C758: 💰 | D758: MONEY BAG | F758: bag, dollar, money, moneybag, object,office
A759: =1+R[-1]C -> 758 | B759: U+1F4B4 | C759: 💴 | D759: BANKNOTE WITH YEN SIGN | F759: bank, banknote, bill, currency, money,note, object, office, yen
A760: =1+R[-1]C -> 759 | B760: U+1F4B5 | C760: 💵 | D760: BANKNOTE WITH DOLLAR SIGN | F760: bank, banknote, bill, currency, dollar,money, note, object, office
A761: =1+R[-1]C -> 760 | B761: U+1F4B6 | C761: 💶 | D761: BANKNOTE WITH EURO SIGN | F761: bank, banknote, bill, currency, euro,money, note, object, office
A762: =1+R[-1]C -> 761 | B762: U+1F4B7 | C762: 💷 | D762: BANKNOTE WITH POUND SIGN | F762: bank, banknote, bill, currency, money,note, object, office, pound
A763: =1+R[-1]C -> 762 | B763: U+1F4B8 | C763: 💸 | D763: MONEY WITH WINGS | F763: bank, banknote, bill, dollar, fly, money,note, object, office, wings
A764: =1+R[-1]C -> 763 | B764: U+1F4B3 | C764: 💳 | D764: CREDIT CARD | F764: bank, card, credit, money, object, office
A765: =1+R[-1]C -> 764 | B765: U+1F4B9 | C765: 💹 | D765: CHART WITH UPWARDS TREND AND YEN SIGN | F765: bank, chart, currency, graph, growth,market, money, object, office, rise,symbol, trend, upward, yen
A766: =1+R[-1]C -> 765 | B766: U+2709 | C766: ✉️ | D766: ENVELOPE | F766: e-mail, email, envelope, object, office
A767: =1+R[-1]C -> 766 | B767: U+1F4E7 | C767: 📧 | D767: E-MAIL SYMBOL | F767: communication, e-mail, email, letter,mail, object, office
A768: =1+R[-1]C -> 767 | B768: U+1F4E8 | C768: 📨 | D768: INCOMING ENVELOPE | F768: communication, e-mail, email, envelope,incoming, letter, mail, object, office,receive
A769: =1+R[-1]C -> 768 | B769: U+1F4E9 | C769: 📩 | D769: ENVELOPE WITH DOWNWARDS ARROW ABOVE | F769: arrow, communication, down, e-mail,email, envelope, letter, mail, object,office, outgoing, sent
A770: =1+R[-1]C -> 769 | B770: U+1F4E4 | C770: 📤 | D770: OUTBOX TRAY | F770: box, communication, letter, mail, object,office, outbox, sent, tray
A771: =1+R[-1]C -> 770 | B771: U+1F4E5 | C771: 📥 | D771: INBOX TRAY | F771: box, communication, inbox, letter, mail,object, office, receive, tray
A772: =1+R[-1]C -> 771 | B772: U+1F4E6 | C772: 📦 | D772: PACKAGE | F772: box, communication, object, office,package, parcel
A773: =1+R[-1]C -> 772 | B773: U+1F4EB | C773: 📫 | D773: CLOSED MAILBOX WITH RAISED FLAG | F773: closed, communication, flag, mail,mailbox, object, office, postbox
A774: =1+R[-1]C -> 773 | B774: U+1F4EA | C774: 📪 | D774: CLOSED MAILBOX WITH LOWERED FLAG | F774: closed, communication, flag, lowered,mail, mailbox, object, office, postbox
A775: =1+R[-1]C -> 774 | B775: U+1F4EC | C775: 📬 | D775: OPEN MAILBOX WITH RAISED FLAG | F775: communication, flag, mail, mailbox,object, office, open, postbox
A776: =1+R[-1]C -> 775 | B776: U+1F4ED | C776: 📭 | D776: OPEN MAILBOX WITH LOWERED FLAG | F776: communication, flag, lowered, mail,mailbox, object, office, open, postbox
A777: =1+R[-1]C -> 776 | B777: U+1F4EE | C777: 📮 | D777: POSTBOX | F777: communication, mail, mailbox, object,office, postbox
A778: =1+R[-1]C -> 777 | B778: U+1F5F3 | C778: 🗳 | D778: BALLOT BOX WITH BALLOT | F778: ballot, box, object
A779: =1+R[-1]C -> 778 | B779: U+270F | C779: ✏️ | D779: PENCIL | F779: object, office, pencil
A780: =1+R[-1]C -> 779 | B780: U+2712 | C780: ✒️ | D780: BLACK NIB | F780: nib, object, office, pen
A781: =1+R[-1]C -> 780 | B781: U+1F58B | C781: 🖋 | D781: LOWER LEFT FOUNTAIN PEN | F781: communication, fountain, object, office,pen
A782: =1+R[-1]C -> 781 | B782: U+1F58A | C782: 🖊 | D782: LOWER LEFT BALLPOINT PEN | F782: ballpoint, communication, object, office,pen
A783: =1+R[-1]C -> 782 | B783: U+1F58C | C783: 🖌 | D783: LOWER LEFT PAINTBRUSH | F783: communication, object, office,paintbrush, painting
A784: =1+R[-1]C -> 783 | B784: U+1F58D | C784: 🖍 | D784: LOWER LEFT CRAYON | F784: communication, crayon, object, office
A785: =1+R[-1]C -> 784 | B785: U+1F4DD | C785: 📝 | D785: MEMO | F785: communication, memo, object, office,pencil
A786: =1+R[-1]C -> 785 | B786: U+1F4BC | C786: 💼 | D786: BRIEFCASE | F786: briefcase, object, office, person
A787: =1+R[-1]C -> 786 | B787: U+1F4C1 | C787: 📁 | D787: FILE FOLDER | F787: file, folder, object, office
A788: =1+R[-1]C -> 787 | B788: U+1F4C2 | C788: 📂 | D788: OPEN FILE FOLDER | F788: file, folder, object, office, open
A789: =1+R[-1]C -> 788 | B789: U+1F5C2 | C789: 🗂 | D789: CARD INDEX DIVIDERS | F789: card, dividers, index, object, office
A790: =1+R[-1]C -> 789 | B790: U+1F4C5 | C790: 📅 | D790: CALENDAR | F790: calendar, date, object, office
A791: =1+R[-1]C -> 790 | B791: U+1F4C6 | C791: 📆 | D791: TEAR-OFF CALENDAR | F791: calendar, object, office
A792: =1+R[-1]C -> 791 | B792: U+1F5D2 | C792: 🗒 | D792: SPIRAL NOTE PAD | F792: note, object, office, pad, spiral
A793: =1+R[-1]C -> 792 | B793: U+1F5D3 | C793: 🗓 | D793: SPIRAL CALENDAR PAD | F793: calendar, object, office, pad, spiral
A794: =1+R[-1]C -> 793 | B794: U+1F4C7 | C794: 📇 | D794: CARD INDEX | F794: card, index, object, office, rolodex
A795: =1+R[-1]C -> 794 | B795: U+1F4C8 | C795: 📈 | D795: CHART WITH UPWARDS TREND | F795: chart, graph, growth, object, office, trend,upward
A796: =1+R[-1]C -> 795 | B796: U+1F4C9 | C796: 📉 | D796: CHART WITH DOWNWARDS TREND | F796: chart, down, graph, object, office, trend
A797: =1+R[-1]C -> 796 | B797: U+1F4CA | C797: 📊 | D797: BAR CHART | F797: bar, chart, graph, object, office
A798: =1+R[-1]C -> 797 | B798: U+1F4CB | C798: 📋 | D798: CLIPBOARD | F798: clipboard, object, office
A799: =1+R[-1]C -> 798 | B799: U+1F4CC | C799: 📌 | D799: PUSHPIN | F799: object, office, pin, pushpin
A800: =1+R[-1]C -> 799 | B800: U+1F4CD | C800: 📍 | D800: ROUND PUSHPIN | F800: object, office, pin, place, pushpin
A801: =1+R[-1]C -> 800 | B801: U+1F4CE | C801: 📎 | D801: PAPERCLIP | F801: object, office, paperclip
A802: =1+R[-1]C -> 801 | B802: U+1F587 | C802: 🖇 | D802: LINKED PAPERCLIPS | F802: communication, link, object, office,paperclip
A803: =1+R[-1]C -> 802 | B803: U+1F4CF | C803: 📏 | D803: STRAIGHT RULER | F803: object, office, ruler, straight edge
A804: =1+R[-1]C -> 803 | B804: U+1F4D0 | C804: 📐 | D804: TRIANGULAR RULER | F804: object, office, ruler, set, triangle
A805: =1+R[-1]C -> 804 | B805: U+2702 | C805: ✂️ | D805: BLACK SCISSORS | F805: object, office, scissors, tool
A806: =1+R[-1]C -> 805 | B806: U+1F5C3 | C806: 🗃 | D806: CARD FILE BOX | F806: box, card, file, object, office
A807: =1+R[-1]C -> 806 | B807: U+1F5C4 | C807: 🗄 | D807: FILE CABINET | F807: cabinet, file, object, office
A808: =1+R[-1]C -> 807 | B808: U+1F5D1 | C808: 🗑 | D808: WASTEBASKET | F808: object, office, wastebasket
A809: =1+R[-1]C -> 808 | B809: U+1F512 | C809: 🔒 | D809: LOCK | F809: closed, lock, object
A810: =1+R[-1]C -> 809 | B810: U+1F513 | C810: 🔓 | D810: OPEN LOCK | F810: lock, object, open, unlock
A811: =1+R[-1]C -> 810 | B811: U+1F50F | C811: 🔏 | D811: LOCK WITH INK PEN | F811: ink, lock, nib, object, pen, privacy
A812: =1+R[-1]C -> 811 | B812: U+1F510 | C812: 🔐 | D812: CLOSED LOCK WITH KEY | F812: closed, key, lock, object, secure
A813: =1+R[-1]C -> 812 | B813: U+1F511 | C813: 🔑 | D813: KEY | F813: key, lock, object, password
A814: =1+R[-1]C -> 813 | B814: U+1F5DD | C814: 🗝 | D814: OLD KEY | F814: clue, key, lock, object, old
A815: =1+R[-1]C -> 814 | B815: U+1F528 | C815: 🔨 | D815: HAMMER | F815: hammer, object, tool
A816: =1+R[-1]C -> 815 | B816: U+26CF | C816: ⛏ | D816: PICK | F816: mining, object, pick, tool
A817: =1+R[-1]C -> 816 | B817: U+2692 | C817: ⚒ | D817: HAMMER AND PICK | F817: hammer, object, pick, tool
A818: =1+R[-1]C -> 817 | B818: U+1F6E0 | C818: 🛠 | D818: HAMMER AND WRENCH | F818: hammer, object, tool, wrench
A819: =1+R[-1]C -> 818 | B819: U+1F527 | C819: 🔧 | D819: WRENCH | F819: object, tool, wrench
A820: =1+R[-1]C -> 819 | B820: U+1F529 | C820: 🔩 | D820: NUT AND BOLT | F820: bolt, nut, object, tool
A821: =1+R[-1]C -> 820 | B821: U+2699 | C821: ⚙ | D821: GEAR | F821: gear, object, tool
A822: =1+R[-1]C -> 821 | B822: U+1F5DC | C822: 🗜 | D822: COMPRESSION | F822: compression, object, tool, vice
A823: =1+R[-1]C -> 822 | B823: U+2697 | C823: ⚗ | D823: ALEMBIC | F823: alembic, chemistry, object, tool
A824: =1+R[-1]C -> 823 | B824: U+2696 | C824: ⚖ | D824: SCALES or balance scale | F824: balance, justice, libra, object, scales, tool,weight, zodiac
A825: =1+R[-1]C -> 824 | B825: U+1F517 | C825: 🔗 | D825: LINK SYMBOL | F825: link, object, symbol
A826: =1+R[-1]C -> 825 | B826: U+26D3 | C826: ⛓ | D826: CHAINS | F826: chain, object
A827: =1+R[-1]C -> 826 | B827: U+1F489 | C827: 💉 | D827: SYRINGE | F827: doctor, medicine, needle, object, shot,sick, syringe, tool
A828: =1+R[-1]C -> 827 | B828: U+1F48A | C828: 💊 | D828: PILL | F828: doctor, medicine, object, pill, sick
A829: =1+R[-1]C -> 828 | B829: U+1F5E1 | C829: 🗡 | D829: DAGGER KNIFE | F829: dagger, knife, object, weapon
A830: =1+R[-1]C -> 829 | B830: U+1F52A | C830: 🔪 | D830: HOCHO or kitchen knife | F830: cooking, hocho, knife, object, tool,weapon
A831: =1+R[-1]C -> 830 | B831: U+2694 | C831: ⚔ | D831: CROSSED SWORDS | F831: crossed, object, swords, weapon
A832: =1+R[-1]C -> 831 | B832: U+1F52B | C832: 🔫 | D832: PISTOL | F832: gun, handgun, object, pistol, revolver,tool, weapon
A833: =1+R[-1]C -> 832 | B833: U+1F6E1 | C833: 🛡 | D833: SHIELD | F833: object, shield, weapon
A834: =1+R[-1]C -> 833 | B834: U+1F3F9 | C834: 🏹 | D834: BOW AND ARROW | F834: archer, arrow, bow, object, sagittarius,sport, tool, weapon, zodiac
A835: =1+R[-1]C -> 834 | B835: U+1F3C1 | C835: 🏁 | D835: CHEQUERED FLAG | F835: checkered, chequered, flag, object, place,racing, sport
A836: =1+R[-1]C -> 835 | B836: U+1F3F3 | C836: 🏳 | D836: WAVING WHITE FLAG | F836: flag, object, waving
A837: =1+R[-1]C -> 836 | B837: U+1F3F4 | C837: 🏴 | D837: WAVING BLACK FLAG | F837: flag, object, waving
A838: =1+R[-1]C -> 837 | B838: U+1F6A9 | C838: 🚩 | D838: TRIANGULAR FLAG ON POST | F838: flag, object, place, post, travel
A839: =1+R[-1]C -> 838 | B839: U+1F6AC | C839: 🚬 | D839: SMOKING SYMBOL | F839: activity, object, smoking
A840: =1+R[-1]C -> 839 | B840: U+26B0 | C840: ⚰ | D840: COFFIN | F840: coffin, death, object
A841: =1+R[-1]C -> 840 | B841: U+26B1 | C841: ⚱ | D841: FUNERAL URN | F841: death, funeral, object, urn
A842: =1+R[-1]C -> 841 | B842: U+1F5FF | C842: 🗿 | D842: MOYAI or moai | F842: face, moyai, place, statue, travel
A843: =1+R[-1]C -> 842 | B843: U+1F6E2 | C843: 🛢 | D843: OIL DRUM | F843: drum, object, oil
A844: =1+R[-1]C -> 843 | B844: U+1F52E | C844: 🔮 | D844: CRYSTAL BALL | F844: ball, crystal, fairy tale, fantasy, fortune,object, tool
A845: =1+R[-1]C -> 844 | B845: U+1F3E7 | C845: 🏧 | D845: AUTOMATED TELLER MACHINE or ATM sign | F845: atm, automated, bank, place, sign,symbol, teller
A846: =1+R[-1]C -> 845 | B846: U+1F6AE | C846: 🚮 | D846: PUT LITTER IN ITS PLACE SYMBOL | F846: litter, litterbox, place, symbol, travel
A847: =1+R[-1]C -> 846 | B847: U+1F6B0 | C847: 🚰 | D847: POTABLE WATER SYMBOL | F847: drink, potable, sign, symbol, travel, water
A848: =1+R[-1]C -> 847 | B848: U+267F | C848: ♿️ | D848: WHEELCHAIR SYMBOL | F848: access, sign, symbol, travel, wheelchair
A849: =1+R[-1]C -> 848 | B849: U+1F6B9 | C849: 🚹 | D849: MENS SYMBOL or men's room | F849: lavatory, man, restroom, sign, symbol,travel, wc
A850: =1+R[-1]C -> 849 | B850: U+1F6BA | C850: 🚺 | D850: WOMENS SYMBOL or women's room | F850: lavatory, restroom, sign, symbol, travel,wc, woman
A851: =1+R[-1]C -> 850 | B851: U+1F6BB | C851: 🚻 | D851: RESTROOM | F851: lavatory, restroom, sign, symbol, travel,wc
A852: =1+R[-1]C -> 851 | B852: U+1F6BC | C852: 🚼 | D852: BABY SYMBOL | F852: baby, changing, sign, symbol, travel
A853: =1+R[-1]C -> 852 | B853: U+1F6BE | C853: 🚾 | D853: WATER CLOSET | F853: closet, lavatory, place, restroom, sign,symbol, travel, water, wc
A854: =1+R[-1]C -> 853 | B854: U+1F6C2 | C854: 🛂 | D854: PASSPORT CONTROL | F854: control, passport, place, sign, symbol,travel
A855: =1+R[-1]C -> 854 | B855: U+1F6C3 | C855: 🛃 | D855: CUSTOMS | F855: customs, place, sign, symbol, travel
A856: =1+R[-1]C -> 855 | B856: U+1F6C4 | C856: 🛄 | D856: BAGGAGE CLAIM | F856: baggage, claim, place, sign, symbol,travel
A857: =1+R[-1]C -> 856 | B857: U+1F6C5 | C857: 🛅 | D857: LEFT LUGGAGE | F857: baggage, left luggage, locker, luggage,place, sign, symbol, travel
A858: =1+R[-1]C -> 857 | B858: U+26A0 | C858: ⚠️ | D858: WARNING SIGN | F858: place, symbol, travel, warning
A859: =1+R[-1]C -> 858 | B859: U+1F6B8 | C859: 🚸 | D859: CHILDREN CROSSING | F859: child, crossing, pedestrian, place, sign,symbol, traffic, travel
A860: =1+R[-1]C -> 859 | B860: U+26D4 | C860: ⛔️ | D860: NO ENTRY | F860: entry, forbidden, no, not, prohibited,symbol, traffic, travel
A861: =1+R[-1]C -> 860 | B861: U+1F6AB | C861: 🚫 | D861: NO ENTRY SIGN | F861: entry, forbidden, no, not, prohibited,symbol, travel
A862: =1+R[-1]C -> 861 | B862: U+1F6B3 | C862: 🚳 | D862: NO BICYCLES | F862: bicycle, bike, forbidden, no, not, place,prohibited, sign, sport, symbol, travel,vehicle
A863: =1+R[-1]C -> 862 | B863: U+1F6AD | C863: 🚭 | D863: NO SMOKING SYMBOL | F863: forbidden, no, not, prohibited, sign,smoking, symbol, travel
A864: =1+R[-1]C -> 863 | B864: U+1F6AF | C864: 🚯 | D864: DO NOT LITTER SYMBOL | F864: forbidden, litter, no, not, prohibited, sign,symbol, travel
A865: =1+R[-1]C -> 864 | B865: U+1F6B1 | C865: 🚱 | D865: NON-POTABLE WATER SYMBOL | F865: drink, forbidden, no, not, potable,prohibited, sign, symbol, travel, water
A866: =1+R[-1]C -> 865 | B866: U+1F6B7 | C866: 🚷 | D866: NO PEDESTRIANS | F866: forbidden, no, not, pedestrian, place,prohibited, sign, symbol, travel
A867: =1+R[-1]C -> 866 | B867: U+2622 | C867: ☢ | D867: RADIOACTIVE SIGN | F867: radioactive, sign, symbol
A868: =1+R[-1]C -> 867 | B868: U+2623 | C868: ☣ | D868: BIOHAZARD SIGN biohazard | F868: biohazard, sign, symbol
A869: =1+R[-1]C -> 868 | B869: U+2B06 | C869: ⬆️ | D869: UPWARDS BLACK ARROW | F869: arrow, cardinal, direction, north, symbol
A870: =1+R[-1]C -> 869 | B870: U+2197 | C870: ↗️ | D870: NORTH EAST ARROW | F870: arrow, direction, intercardinal, northeast,symbol
A871: =1+R[-1]C -> 870 | B871: U+27A1 | C871: ➡️ | D871: BLACK RIGHTWARDS ARROW | F871: arrow, cardinal, direction, east, symbol
A872: =1+R[-1]C -> 871 | B872: U+2198 | C872: ↘️ | D872: SOUTH EAST ARROW | F872: arrow, direction, intercardinal, southeast,symbol
A873: =1+R[-1]C -> 872 | B873: U+2B07 | C873: ⬇️ | D873: DOWNWARDS BLACK ARROW | F873: arrow, cardinal, direction, down, south,symbol
A874: =1+R[-1]C -> 873 | B874: U+2199 | C874: ↙️ | D874: SOUTH WEST ARROW | F874: arrow, direction, intercardinal, southwest,symbol
A875: =1+R[-1]C -> 874 | B875: U+2B05 | C875: ⬅️ | D875: LEFTWARDS BLACK ARROW | F875: arrow, cardinal, direction, symbol, west
A876: =1+R[-1]C -> 875 | B876: U+2196 | C876: ↖️ | D876: NORTH WEST ARROW | F876: arrow, direction, intercardinal, northwest,symbol
A877: =1+R[-1]C -> 876 | B877: U+2195 | C877: ↕️ | D877: UP DOWN ARROW | F877: arrow, symbol
A878: =1+R[-1]C -> 877 | B878: U+2194 | C878: ↔️ | D878: LEFT RIGHT ARROW | F878: arrow, symbol
A879: =1+R[-1]C -> 878 | B879: U+21A9 | C879: ↩️ | D879: LEFTWARDS ARROW WITH HOOK | F879: arrow, symbol
A880: =1+R[-1]C -> 879 | B880: U+21AA | C880: ↪️ | D880: RIGHTWARDS ARROW WITH HOOK | F880: arrow, symbol
A881: =1+R[-1]C -> 880 | B881: U+2934 | C881: ⤴️ | D881: ARROW POINTING RIGHTWARDS THEN CURVING UPWARDS | F881: arrow, symbol
A882: =1+R[-1]C -> 881 | B882: U+2935 | C882: ⤵️ | D882: ARROW POINTING RIGHTWARDS THEN CURVING DOWNWARDS | F882: arrow, down, symbol
A883: =1+R[-1]C -> 882 | B883: U+1F503 | C883: 🔃 | D883: CLOCKWISE DOWNWARDS AND UPWARDS OPEN CIRCLE ARROWS | F883: arrow, clockwise, reload, symbol
A884: =1+R[-1]C -> 883 | B884: U+1F504 | C884: 🔄 | D884: ANTICLOCKWISE DOWNWARDS AND UPWARDS OPEN CIRCLE ARROWS | F884: anticlockwise, arrow, counterclockwise,symbol, withershins
A885: =1+R[-1]C -> 884 | B885: U+1F519 | C885: 🔙 | D885: BACK WITH LEFTWARDS ARROW ABOVE | F885: arrow, back, symbol
A886: =1+R[-1]C -> 885 | B886: U+1F51A | C886: 🔚 | D886: END WITH LEFTWARDS ARROW ABOVE | F886: arrow, end, symbol
A887: =1+R[-1]C -> 886 | B887: U+1F51B | C887: 🔛 | D887: ON WITH EXCLAMATION MARK WITH LEFT RIGHT ARROW ABOVE | F887: arrow, mark, on, symbol
A888: =1+R[-1]C -> 887 | B888: U+1F51C | C888: 🔜 | D888: SOON WITH RIGHTWARDS ARROW ABOVE | F888: arrow, soon, symbol
A889: =1+R[-1]C -> 888 | B889: U+1F51D | C889: 🔝 | D889: TOP WITH UPWARDS ARROW ABOVE | F889: arrow, symbol, top, up
A890: =1+R[-1]C -> 889 | B890: U+1F6D0 | C890: 🛐 | D890: PLACE OF WORSHIP | F890: place, religion, worship
A891: =1+R[-1]C -> 890 | B891: U+269B | C891: ⚛ | D891: ATOM SYMBOL | F891: atheist, atom, symbol
A892: =1+R[-1]C -> 891 | B892: U+1F549 | C892: 🕉 | D892: OM SYMBOL | F892: hindu, om, religion, symbol
A893: =1+R[-1]C -> 892 | B893: U+2721 | C893: ✡ | D893: STAR OF DAVID | F893: david, jew, jewish, religion, star, symbol
A894: =1+R[-1]C -> 893 | B894: U+2638 | C894: ☸ | D894: WHEEL OF DHARMA | F894: buddhist, dharma, religion, symbol,wheel
A895: =1+R[-1]C -> 894 | B895: U+262F | C895: ☯ | D895: YIN YANG | F895: religion, sign, symbol, tao, taoist, yang,yin
A896: =1+R[-1]C -> 895 | B896: U+271D | C896: ✝ | D896: LATIN CROSS | F896: christian, cross, religion, symbol
A897: =1+R[-1]C -> 896 | B897: U+2626 | C897: ☦ | D897: ORTHODOX CROSS | F897: christian, cross, religion, symbol
A898: =1+R[-1]C -> 897 | B898: U+262A | C898: ☪ | D898: STAR AND CRESCENT | F898: islam, muslim, religion, symbol
A899: =1+R[-1]C -> 898 | B899: U+262E | C899: ☮ | D899: PEACE SYMBOL | F899: peace, sign, symbol
A900: =1+R[-1]C -> 899 | B900: U+1F54E | C900: 🕎 | D900: MENORAH WITH NINE BRANCHES | F900: candelabrum, candlestick, menorah,object, place, religion
A901: =1+R[-1]C -> 900 | B901: U+1F52F | C901: 🔯 | D901: SIX POINTED STAR WITH MIDDLE DOT | F901: fortune, object, star, symbol
A902: =1+R[-1]C -> 901 | B902: U+267B | C902: ♻️ | D902: BLACK UNIVERSAL RECYCLING SYMBOL | F902: recycle, sign, symbol
A903: =1+R[-1]C -> 902 | B903: U+1F4DB | C903: 📛 | D903: NAME BADGE | F903: badge, name, object, office
A904: =1+R[-1]C -> 903 | B904: U+269C | C904: ⚜ | D904: FLEUR-DE-LIS | F904: fleur-de-lis, symbol
A905: =1+R[-1]C -> 904 | B905: U+1F530 | C905: 🔰 | D905: JAPANESE SYMBOL FOR BEGINNER | F905: beginner, chevron, green, japanese, leaf,object, tool, yellow
A906: =1+R[-1]C -> 905 | B906: U+1F531 | C906: 🔱 | D906: TRIDENT EMBLEM | F906: anchor, emblem, object, ship, symbol,tool, trident
A907: =1+R[-1]C -> 906 | B907: U+2B55 | C907: ⭕️ | D907: HEAVY LARGE CIRCLE | F907: circle, o, symbol, travel
A908: =1+R[-1]C -> 907 | B908: U+2705 | C908: ✅ | D908: WHITE HEAVY CHECK MARK | F908: check, mark, sign, symbol
A909: =1+R[-1]C -> 908 | B909: U+2611 | C909: ☑️ | D909: BALLOT BOX WITH CHECK | F909: ballot, box, check, sign, symbol
A910: =1+R[-1]C -> 909 | B910: U+2714 | C910: ✔️ | D910: HEAVY CHECK MARK | F910: check, mark, sign, symbol
A911: =1+R[-1]C -> 910 | B911: U+2716 | C911: ✖️ | D911: HEAVY MULTIPLICATION X | F911: cancel, multiplication, multiply, sign,symbol, x
A912: =1+R[-1]C -> 911 | B912: U+274C | C912: ❌ | D912: CROSS MARK | F912: cancel, mark, multiplication, multiply,sign, symbol, x
A913: =1+R[-1]C -> 912 | B913: U+274E | C913: ❎ | D913: NEGATIVE SQUARED CROSS MARK | F913: mark, sign, square, symbol
A914: =1+R[-1]C -> 913 | B914: U+2795 | C914: ➕ | D914: HEAVY PLUS SIGN | F914: math, plus, sign, symbol
A915: =1+R[-1]C -> 914 | B915: U+2796 | C915: ➖ | D915: HEAVY MINUS SIGN | F915: math, minus, sign, symbol
A916: =1+R[-1]C -> 915 | B916: U+2797 | C916: ➗ | D916: HEAVY DIVISION SIGN | F916: division, math, sign, symbol
A917: =1+R[-1]C -> 916 | B917: U+27B0 | C917: ➰ | D917: CURLY LOOP | F917: curl, loop, sign, symbol
A918: =1+R[-1]C -> 917 | B918: U+27BF | C918: ➿ | D918: DOUBLE CURLY LOOP | F918: curl, double, loop, sign, symbol
A919: =1+R[-1]C -> 918 | B919: U+303D | C919: 〽️ | D919: PART ALTERNATION MARK | F919: mark, part, sign, symbol
A920: =1+R[-1]C -> 919 | B920: U+2733 | C920: ✳️ | D920: EIGHT SPOKED ASTERISK | F920: asterisk, sign, symbol
A921: =1+R[-1]C -> 920 | B921: U+2734 | C921: ✴️ | D921: EIGHT POINTED BLACK STAR | F921: sign, star, symbol
A922: =1+R[-1]C -> 921 | B922: U+2747 | C922: ❇️ | D922: SPARKLE | F922: sign, sparkle, symbol
A923: =1+R[-1]C -> 922 | B923: U+1F4B1 | C923: 💱 | D923: CURRENCY EXCHANGE | F923: bank, currency, exchange, money, object,office, symbol
A924: =1+R[-1]C -> 923 | B924: U+1F4B2 | C924: 💲 | D924: HEAVY DOLLAR SIGN | F924: currency, dollar, money, object, office,symbol
A925: =1+R[-1]C -> 924 | B925: U+203C | C925: ‼️ | D925: DOUBLE EXCLAMATION MARK | F925: bangbang, exclamation, mark,punctuation, symbol, word
A926: =1+R[-1]C -> 925 | B926: U+2049 | C926: ⁉️ | D926: EXCLAMATION QUESTION MARK | F926: exclamation, interrobang, mark,punctuation, question, symbol, word
A927: =1+R[-1]C -> 926 | B927: U+2753 | C927: ❓ | D927: BLACK QUESTION MARK ORNAMENT | F927: mark, punctuation, question, symbol,word
A928: =1+R[-1]C -> 927 | B928: U+2754 | C928: ❔ | D928: WHITE QUESTION MARK ORNAMENT | F928: mark, outlined, punctuation, question,symbol, word
A929: =1+R[-1]C -> 928 | B929: U+2755 | C929: ❕ | D929: WHITE EXCLAMATION MARK ORNAMENT | F929: exclamation, mark, outlined,punctuation, symbol, word
A930: =1+R[-1]C -> 929 | B930: U+2757 | C930: ❗️ | D930: HEAVY EXCLAMATION MARK SYMBOL | F930: exclamation, mark, punctuation, symbol,word
A931: =1+R[-1]C -> 930 | B931: U+3030 | C931: 〰️ | D931: WAVY DASH | F931: dash, punctuation, sound, symbol, wavy
A932: =1+R[-1]C -> 931 | B932: U+00A9 | C932: ©️ | D932: COPYRIGHT SIGN | F932: copyright, symbol, word
A933: =1+R[-1]C -> 932 | B933: U+00AE | C933: ®️ | D933: REGISTERED SIGN | F933: registered, symbol, word
A934: =1+R[-1]C -> 933 | B934: U+2122 | C934: ™️ | D934: TRADE MARK SIGN | F934: mark, symbol, tm, trademark, word
A935: =1+R[-1]C -> 934 | B935: U+2648 | C935: ♈️ | D935: ARIES | F935: aries, ram, symbol, time, zodiac
A936: =1+R[-1]C -> 935 | B936: U+2649 | C936: ♉️ | D936: TAURUS | F936: bull, ox, symbol, taurus, time, zodiac
A937: =1+R[-1]C -> 936 | B937: U+264A | C937: ♊️ | D937: GEMINI | F937: gemini, symbol, time, twins, zodiac
A938: =1+R[-1]C -> 937 | B938: U+264B | C938: ♋️ | D938: CANCER | F938: cancer, crab, symbol, time, zodiac
A939: =1+R[-1]C -> 938 | B939: U+264C | C939: ♌️ | D939: LEO | F939: leo, lion, symbol, time, zodiac
A940: =1+R[-1]C -> 939 | B940: U+264D | C940: ♍️ | D940: VIRGO | F940: maiden, symbol, time, virgin, virgo,zodiac
A941: =1+R[-1]C -> 940 | B941: U+264E | C941: ♎️ | D941: LIBRA | F941: balance, justice, libra, scales, symbol,time, zodiac
A942: =1+R[-1]C -> 941 | B942: U+264F | C942: ♏️ | D942: SCORPIUS | F942: scorpio, scorpion, scorpius, symbol,time, zodiac
A943: =1+R[-1]C -> 942 | B943: U+2650 | C943: ♐️ | D943: SAGITTARIUS | F943: archer, sagittarius, symbol, time, zodiac
A944: =1+R[-1]C -> 943 | B944: U+2651 | C944: ♑️ | D944: CAPRICORN | F944: capricorn, goat, symbol, time, zodiac
A945: =1+R[-1]C -> 944 | B945: U+2652 | C945: ♒️ | D945: AQUARIUS | F945: aquarius, bearer, symbol, time, water,zodiac
A946: =1+R[-1]C -> 945 | B946: U+2653 | C946: ♓️ | D946: PISCES | F946: fish, pisces, symbol, time, zodiac
A947: =1+R[-1]C -> 946 | B947: U+26CE | C947: ⛎ | D947: OPHIUCHUS | F947: bearer, ophiuchus, serpent, snake,symbol, zodiac
A948: =1+R[-1]C -> 947 | B948: U+1F500 | C948: 🔀 | D948: TWISTED RIGHTWARDS ARROWS | F948: arrow, crossed, symbol
A949: =1+R[-1]C -> 948 | B949: U+1F501 | C949: 🔁 | D949: CLOCKWISE RIGHTWARDS AND LEFTWARDS OPEN CIRCLE ARROWS | F949: arrow, clockwise, repeat, symbol
A950: =1+R[-1]C -> 949 | B950: U+1F502 | C950: 🔂 | D950: CLOCKWISE RIGHTWARDS AND LEFTWARDS OPEN CIRCLE ARROWS WITH CIRCLED ONE OVERLAY | F950: arrow, clockwise, once, symbol
A951: =1+R[-1]C -> 950 | B951: U+25B6 | C951: ▶️ | D951: BLACK RIGHT-POINTING TRIANGLE or play button | F951: arrow, play, right, sound, symbol,triangle
A952: =1+R[-1]C -> 951 | B952: U+23E9 | C952: ⏩ | D952: BLACK RIGHT-POINTING DOUBLE TRIANGLE or fast-forward button | F952: arrow, double, fast, forward, sound,symbol
A953: =1+R[-1]C -> 952 | B953: U+23ED | C953: ⏭ | D953: BLACK RIGHT-POINTING DOUBLE TRIANGLE WITH VERTICAL BAR or next track button | F953: arrow, next scene, next track, sound,symbol, triangle
A954: =1+R[-1]C -> 953 | B954: U+23EF | C954: ⏯ | D954: BLACK RIGHT-POINTING TRIANGLE WITH DOUBLE VERTICAL BAR or play or pause button | F954: arrow, pause, play, right, sound, symbol,triangle
A955: =1+R[-1]C -> 954 | B955: U+25C0 | C955: ◀️ | D955: BLACK LEFT-POINTING TRIANGLE or reverse button | F955: arrow, left, reverse, sound, symbol,triangle
A956: =1+R[-1]C -> 955 | B956: U+23EA | C956: ⏪ | D956: BLACK LEFT-POINTING DOUBLE TRIANGLE or fast reverse button | F956: arrow, double, rewind, sound, symbol
A957: =1+R[-1]C -> 956 | B957: U+23EE | C957: ⏮ | D957: BLACK LEFT-POINTING DOUBLE TRIANGLE WITH VERTICAL BAR or last track button | F957: arrow, previous scene, previous track,sound, symbol, triangle
A958: =1+R[-1]C -> 957 | B958: U+1F53C | C958: 🔼 | D958: UP-POINTING SMALL RED TRIANGLE or up button | F958: arrow, button, red, symbol
A959: =1+R[-1]C -> 958 | B959: U+23EB | C959: ⏫ | D959: BLACK UP-POINTING DOUBLE TRIANGLE or fast up button | F959: arrow, double, sound, symbol
A960: =1+R[-1]C -> 959 | B960: U+1F53D | C960: 🔽 | D960: DOWN-POINTING SMALL RED TRIANGLE or down button | F960: arrow, button, down, red, symbol
A961: =1+R[-1]C -> 960 | B961: U+23EC | C961: ⏬ | D961: BLACK DOWN-POINTING DOUBLE TRIANGLE or fast down button | F961: arrow, double, down, sound, symbol
A962: =1+R[-1]C -> 961 | B962: U+23F8 | C962: ⏸ | D962: DOUBLE VERTICAL BAR or pause button | F962: bar, double, pause, sound, symbol,vertical
A963: =1+R[-1]C -> 962 | B963: U+23F9 | C963: ⏹ | D963: BLACK SQUARE FOR STOP or stop button | F963: sound, square, stop, symbol
A964: =1+R[-1]C -> 963 | B964: U+23FA | C964: ⏺ | D964: BLACK CIRCLE FOR RECORD or record button | F964: circle, record, sound, symbol
A965: =1+R[-1]C -> 964 | B965: U+23CF | C965: ⏏ | D965: EJECT SYMBOL | F965: eject, sound, symbol
A966: =1+R[-1]C -> 965 | B966: U+1F3A6 | C966: 🎦 | D966: CINEMA | F966: activity, camera, cinema, entertainment,film, movie, object, symbol
A967: =1+R[-1]C -> 966 | B967: U+1F505 | C967: 🔅 | D967: LOW BRIGHTNESS SYMBOL | F967: brightness, dim, low, sign, symbol
A968: =1+R[-1]C -> 967 | B968: U+1F506 | C968: 🔆 | D968: HIGH BRIGHTNESS SYMBOL | F968: bright, brightness, sign, symbol
A969: =1+R[-1]C -> 968 | B969: U+1F4F6 | C969: 📶 | D969: ANTENNA WITH BARS | F969: antenna, bar, cell, communication,mobile, object, phone, signal, symbol,telephone
A970: =1+R[-1]C -> 969 | B970: U+1F4F5 | C970: 📵 | D970: NO MOBILE PHONES | F970: cell, communication, forbidden, mobile,no, not, object, phone, prohibited,symbol, telephone
A971: =1+R[-1]C -> 970 | B971: U+1F4F3 | C971: 📳 | D971: VIBRATION MODE | F971: cell, communication, mobile, mode,object, phone, symbol, telephone,vibration
A972: =1+R[-1]C -> 971 | B972: U+1F4F4 | C972: 📴 | D972: MOBILE PHONE OFF | F972: cell, communication, mobile, object, off,phone, symbol, telephone
A973: =1+R[-1]C -> 972 | B973: U+0023 U+20E3 | C973: #️⃣ | D973: Keycap NUMBER SIGN | F973: hash, keycap, pound, symbol, word
A974: =1+R[-1]C -> 973 | B974: U+002A U+20E3 | C974: *⃣ | D974: Keycap ASTERISK | F974: asterisk, keycap, star, symbol
A975: =1+R[-1]C -> 974 | B975: U+0030 U+20E3 | C975: 0️⃣ | D975: Keycap DIGIT ZERO | F975: 0, keycap, symbol, word, zero
A976: =1+R[-1]C -> 975 | B976: U+0031 U+20E3 | C976: 1️⃣ | D976: Keycap DIGIT ONE | F976: 1, keycap, one, symbol, word
A977: =1+R[-1]C -> 976 | B977: U+0032 U+20E3 | C977: 2️⃣ | D977: Keycap DIGIT TWO | F977: 2, keycap, symbol, two, word
A978: =1+R[-1]C -> 977 | B978: U+0033 U+20E3 | C978: 3️⃣ | D978: Keycap DIGIT THREE | F978: 3, keycap, symbol, three, word
A979: =1+R[-1]C -> 978 | B979: U+0034 U+20E3 | C979: 4️⃣ | D979: Keycap DIGIT FOUR | F979: 4, four, keycap, symbol, word
A980: =1+R[-1]C -> 979 | B980: U+0035 U+20E3 | C980: 5️⃣ | D980: Keycap DIGIT FIVE | F980: 5, five, keycap, symbol, word
A981: =1+R[-1]C -> 980 | B981: U+0036 U+20E3 | C981: 6️⃣ | D981: Keycap DIGIT SIX | F981: 6, keycap, six, symbol, word
A982: =1+R[-1]C -> 981 | B982: U+0037 U+20E3 | C982: 7️⃣ | D982: Keycap DIGIT SEVEN | F982: 7, keycap, seven, symbol, word
A983: =1+R[-1]C -> 982 | B983: U+0038 U+20E3 | C983: 8️⃣ | D983: Keycap DIGIT EIGHT | F983: 8, eight, keycap, symbol, word
A984: =1+R[-1]C -> 983 | B984: U+0039 U+20E3 | C984: 9️⃣ | D984: Keycap DIGIT NINE | F984: 9, keycap, nine, symbol, word
A985: =1+R[-1]C -> 984 | B985: U+1F51F | C985: 🔟 | D985: KEYCAP TEN | F985: 10, keycap, symbol, ten, word
A986: =1+R[-1]C -> 985 | B986: U+1F4AF | C986: 💯 | D986: HUNDRED POINTS SYMBOL | F986: 100, full, hundred, office, score, symbol
A987: =1+R[-1]C -> 986 | B987: U+1F51E | C987: 🔞 | D987: NO ONE UNDER EIGHTEEN SYMBOL | F987: 18, age restriction, eighteen, forbidden,no, not, prohibited, symbol, underage,word
A988: =1+R[-1]C -> 987 | B988: U+1F520 | C988: 🔠 | D988: INPUT SYMBOL FOR LATIN CAPITAL LETTERS | F988: input, latin, letters, symbol, uppercase,word
A989: =1+R[-1]C -> 988 | B989: U+1F521 | C989: 🔡 | D989: INPUT SYMBOL FOR LATIN SMALL LETTERS | F989: abcd, input, latin, letters, lowercase,symbol, word
A990: =1+R[-1]C -> 989 | B990: U+1F522 | C990: 🔢 | D990: INPUT SYMBOL FOR NUMBERS | F990: 1234, input, numbers, symbol, word
A991: =1+R[-1]C -> 990 | B991: U+1F523 | C991: 🔣 | D991: INPUT SYMBOL FOR SYMBOLS | F991: input, symbol, word
A992: =1+R[-1]C -> 991 | B992: U+1F524 | C992: 🔤 | D992: INPUT SYMBOL FOR LATIN LETTERS | F992: abc, alphabet, input, latin, letters,symbol, word
A993: =1+R[-1]C -> 992 | B993: U+1F170 | C993: 🅰️ | D993: NEGATIVE SQUARED LATIN CAPITAL LETTER A a button | F993: a, blood, symbol, word
A994: =1+R[-1]C -> 993 | B994: U+1F18E | C994: 🆎 | D994: NEGATIVE SQUARED AB | F994: ab, blood, symbol, word
A995: =1+R[-1]C -> 994 | B995: U+1F171 | C995: 🅱️ | D995: NEGATIVE SQUARED LATIN CAPITAL LETTER B | F995: b, blood, symbol, word
A996: =1+R[-1]C -> 995 | B996: U+1F191 | C996: 🆑 | D996: SQUARED CL | F996: cl, symbol, word
A997: =1+R[-1]C -> 996 | B997: U+1F192 | C997: 🆒 | D997: SQUARED COOL | F997: cool, symbol, word
A998: =1+R[-1]C -> 997 | B998: U+1F193 | C998: 🆓 | D998: SQUARED FREE | F998: free, symbol, word
A999: =1+R[-1]C -> 998 | B999: U+2139 | C999: ℹ️ | D999: INFORMATION SOURCE | F999: i, information, symbol, word
A1000: =1+R[-1]C -> 999 | B1000: U+1F194 | C1000: 🆔 | D1000: SQUARED ID | F1000: id, identity, symbol, word
A1001: =1+R[-1]C -> 1000 | B1001: U+24C2 | C1001: Ⓜ️ | D1001: CIRCLED LATIN CAPITAL LETTER M circled letter m | F1001: circle, m, place, symbol, word
A1002: =1+R[-1]C -> 1001 | B1002: U+1F195 | C1002: 🆕 | D1002: SQUARED NEW | F1002: new, symbol, word
A1003: =1+R[-1]C -> 1002 | B1003: U+1F196 | C1003: 🆖 | D1003: SQUARED NG | F1003: ng, symbol, word
A1004: =1+R[-1]C -> 1003 | B1004: U+1F17E | C1004: 🅾️ | D1004: NEGATIVE SQUARED LATIN CAPITAL LETTER O | F1004: blood, o, symbol, word
A1005: =1+R[-1]C -> 1004 | B1005: U+1F197 | C1005: 🆗 | D1005: SQUARED OK | F1005: ok, symbol, word
A1006: =1+R[-1]C -> 1005 | B1006: U+1F17F | C1006: 🅿️ | D1006: NEGATIVE SQUARED LATIN CAPITAL LETTER P | F1006: parking, place, sign, symbol, word
A1007: =1+R[-1]C -> 1006 | B1007: U+1F198 | C1007: 🆘 | D1007: SQUARED SOS | F1007: help, sos, symbol, word
A1008: =1+R[-1]C -> 1007 | B1008: U+1F199 | C1008: 🆙 | D1008: SQUARED UP WITH EXCLAMATION MARK | F1008: mark, symbol, up, word
A1009: =1+R[-1]C -> 1008 | B1009: U+1F19A | C1009: 🆚 | D1009: SQUARED VS | F1009: symbol, versus, vs, word
A1010: =1+R[-1]C -> 1009 | B1010: U+1F201 | C1010: 🈁 | D1010: SQUARED KATAKANA KOKO | F1010: japanese, symbol, word
A1011: =1+R[-1]C -> 1010 | B1011: U+1F202 | C1011: 🈂️ | D1011: SQUARED KATAKANA SA or squared moon ideograph | F1011: japanese, symbol, word
A1012: =1+R[-1]C -> 1011 | B1012: U+1F236 | C1012: 🈶 | D1012: SQUARED CJK UNIFIED IDEOGRAPH-6709 or squared exist ideograph | F1012: japanese, symbol, word
A1013: =1+R[-1]C -> 1012 | B1013: U+1F22F | C1013: 🈯️ | D1013: SQUARED CJK UNIFIED IDEOGRAPH-6307 or squared fnger ideograph | F1013: japanese, symbol, word
A1014: =1+R[-1]C -> 1013 | B1014: U+1F250 | C1014: 🉐 | D1014: CIRCLED IDEOGRAPH ADVANTAGE | F1014: japanese, symbol, word
A1015: =1+R[-1]C -> 1014 | B1015: U+1F239 | C1015: 🈹 | D1015: SQUARED CJK UNIFIED IDEOGRAPH-5272 or squared devide ideograph | F1015: japanese, symbol, word
A1016: =1+R[-1]C -> 1015 | B1016: U+1F21A | C1016: 🈚️ | D1016: SQUARED CJK UNIFIED IDEOGRAPH-7121 or squared negation ideograph | F1016: japanese, symbol, word
A1017: =1+R[-1]C -> 1016 | B1017: U+1F232 | C1017: 🈲 | D1017: SQUARED CJK UNIFIED IDEOGRAPH-7981 or squared prohibit ideograph | F1017: japanese, symbol, word
A1018: =1+R[-1]C -> 1017 | B1018: U+1F251 | C1018: 🉑 | D1018: CIRCLED IDEOGRAPH ACCEPT | F1018: chinese, symbol, word
A1019: =1+R[-1]C -> 1018 | B1019: U+1F238 | C1019: 🈸 | D1019: SQUARED CJK UNIFIED IDEOGRAPH-7533 or squared apply ideograph | F1019: chinese, symbol, word
A1020: =1+R[-1]C -> 1019 | B1020: U+1F233 | C1020: 🈳 | D1020: SQUARED CJK UNIFIED IDEOGRAPH-7A7A or squared empty ideograph | F1020: chinese, symbol, word
A1021: =1+R[-1]C -> 1020 | B1021: U+3297 | C1021: ㊗️ | D1021: CIRCLED IDEOGRAPH CONGRATULATION | F1021: chinese, congratulation, congratulations,ideograph, symbol, word
A1022: =1+R[-1]C -> 1021 | B1022: U+3299 | C1022: ㊙️ | D1022: CIRCLED IDEOGRAPH SECRET | F1022: chinese, ideograph, secret, symbol, word
A1023: =1+R[-1]C -> 1022 | B1023: U+1F23A | C1023: 🈺 | D1023: SQUARED CJK UNIFIED IDEOGRAPH-55B6 or squared operating ideograph | F1023: chinese, symbol, word
A1024: =1+R[-1]C -> 1023 | B1024: U+1F235 | C1024: 🈵 | D1024: SQUARED CJK UNIFIED IDEOGRAPH-6E80 or squared fullness ideograph | F1024: chinese, symbol, word
A1025: =1+R[-1]C -> 1024 | B1025: U+25AA | C1025: ▪️ | D1025: BLACK SMALL SQUARE | F1025: geometric, sign, square, symbol
A1026: =1+R[-1]C -> 1025 | B1026: U+25AB | C1026: ▫️ | D1026: WHITE SMALL SQUARE | F1026: geometric, sign, square, symbol
A1027: =1+R[-1]C -> 1026 | B1027: U+25FB | C1027: ◻️ | D1027: WHITE MEDIUM SQUARE | F1027: geometric, sign, square, symbol
A1028: =1+R[-1]C -> 1027 | B1028: U+25FC | C1028: ◼️ | D1028: BLACK MEDIUM SQUARE | F1028: geometric, sign, square, symbol
A1029: =1+R[-1]C -> 1028 | B1029: U+25FD | C1029: ◽️ | D1029: WHITE MEDIUM SMALL SQUARE | F1029: geometric, sign, square, symbol
A1030: =1+R[-1]C -> 1029 | B1030: U+25FE | C1030: ◾️ | D1030: BLACK MEDIUM SMALL SQUARE | F1030: geometric, sign, square, symbol
A1031: =1+R[-1]C -> 1030 | B1031: U+2B1B | C1031: ⬛️ | D1031: BLACK LARGE SQUARE | F1031: geometric, sign, square, symbol
A1032: =1+R[-1]C -> 1031 | B1032: U+2B1C | C1032: ⬜️ | D1032: WHITE LARGE SQUARE | F1032: geometric, sign, square, symbol
A1033: =1+R[-1]C -> 1032 | B1033: U+1F536 | C1033: 🔶 | D1033: LARGE ORANGE DIAMOND | F1033: diamond, geometric, orange, sign,symbol
A1034: =1+R[-1]C -> 1033 | B1034: U+1F537 | C1034: 🔷 | D1034: LARGE BLUE DIAMOND | F1034: blue, diamond, geometric, sign, symbol
A1035: =1+R[-1]C -> 1034 | B1035: U+1F538 | C1035: 🔸 | D1035: SMALL ORANGE DIAMOND | F1035: diamond, geometric, orange, sign,symbol
A1036: =1+R[-1]C -> 1035 | B1036: U+1F539 | C1036: 🔹 | D1036: SMALL BLUE DIAMOND | F1036: blue, diamond, geometric, sign, symbol
A1037: =1+R[-1]C -> 1036 | B1037: U+1F53A | C1037: 🔺 | D1037: UP-POINTING RED TRIANGLE | F1037: geometric, red, sign, symbol
A1038: =1+R[-1]C -> 1037 | B1038: U+1F53B | C1038: 🔻 | D1038: DOWN-POINTING RED TRIANGLE | F1038: down, geometric, red, sign, symbol
A1039: =1+R[-1]C -> 1038 | B1039: U+1F4A0 | C1039: 💠 | D1039: DIAMOND SHAPE WITH A DOT INSIDE | F1039: comic, diamond, geometric, inside, sign,symbol
A1040: =1+R[-1]C -> 1039 | B1040: U+1F518 | C1040: 🔘 | D1040: RADIO BUTTON | F1040: button, geometric, radio, sign, symbol
A1041: =1+R[-1]C -> 1040 | B1041: U+1F532 | C1041: 🔲 | D1041: BLACK SQUARE BUTTON | F1041: button, geometric, sign, square, symbol
A1042: =1+R[-1]C -> 1041 | B1042: U+1F533 | C1042: 🔳 | D1042: WHITE SQUARE BUTTON | F1042: button, geometric, outlined, sign, square,symbol
A1043: =1+R[-1]C -> 1042 | B1043: U+26AA | C1043: ⚪️ | D1043: MEDIUM WHITE CIRCLE | F1043: circle, geometric, sign, symbol
A1044: =1+R[-1]C -> 1043 | B1044: U+26AB | C1044: ⚫️ | D1044: MEDIUM BLACK CIRCLE | F1044: circle, geometric, sign, symbol
A1045: =1+R[-1]C -> 1044 | B1045: U+1F534 | C1045: 🔴 | D1045: LARGE RED CIRCLE | F1045: circle, geometric, red, sign, symbol
A1046: =1+R[-1]C -> 1045 | B1046: U+1F535 | C1046: 🔵 | D1046: LARGE BLUE CIRCLE | F1046: blue, circle, geometric, sign, symbol
A1047: =1+R[-1]C -> 1046 | B1047: U+1F1E6 U+1F1E8 | C1047: 🇦🇨 | D1047: Flag for Ascension Island | F1047: ascension, flag, island, other
A1048: =1+R[-1]C -> 1047 | B1048: U+1F1E6 U+1F1E9 | C1048: 🇦🇩 | D1048: Flag for Andorra | F1048: andorra, flag, other
A1049: =1+R[-1]C -> 1048 | B1049: U+1F1E6 U+1F1EA | C1049: 🇦🇪 | D1049: Flag for United Arab Emirates | F1049: emirates, flag, other, uae, united
A1050: =1+R[-1]C -> 1049 | B1050: U+1F1E6 U+1F1EB | C1050: 🇦🇫 | D1050: Flag for Afghanistan | F1050: afghanistan, flag, other
A1051: =1+R[-1]C -> 1050 | B1051: U+1F1E6 U+1F1EC | C1051: 🇦🇬 | D1051: Flag for Antigua & Barbuda | F1051: antigua, barbuda, flag, other
A1052: =1+R[-1]C -> 1051 | B1052: U+1F1E6 U+1F1EE | C1052: 🇦🇮 | D1052: Flag for Anguilla | F1052: anguilla, flag, other
A1053: =1+R[-1]C -> 1052 | B1053: U+1F1E6 U+1F1F1 | C1053: 🇦🇱 | D1053: Flag for Albania | F1053: albania, flag, other
A1054: =1+R[-1]C -> 1053 | B1054: U+1F1E6 U+1F1F2 | C1054: 🇦🇲 | D1054: Flag for Armenia | F1054: armenia, flag, other
A1055: =1+R[-1]C -> 1054 | B1055: U+1F1E6 U+1F1F4 | C1055: 🇦🇴 | D1055: Flag for Angola | F1055: angola, flag, other
A1056: =1+R[-1]C -> 1055 | B1056: U+1F1E6 U+1F1F6 | C1056: 🇦🇶 | D1056: Flag for Antarctica | F1056: antarctica, flag, other
A1057: =1+R[-1]C -> 1056 | B1057: U+1F1E6 U+1F1F7 | C1057: 🇦🇷 | D1057: Flag for Argentina | F1057: argentina, flag, other
A1058: =1+R[-1]C -> 1057 | B1058: U+1F1E6 U+1F1F8 | C1058: 🇦🇸 | D1058: Flag for American Samoa | F1058: american, flag, other, samoa
A1059: =1+R[-1]C -> 1058 | B1059: U+1F1E6 U+1F1F9 | C1059: 🇦🇹 | D1059: Flag for Austria | F1059: austria, flag, other
A1060: =1+R[-1]C -> 1059 | B1060: U+1F1E6 U+1F1FA | C1060: 🇦🇺 | D1060: Flag for Australia | F1060: australia, flag, other
A1061: =1+R[-1]C -> 1060 | B1061: U+1F1E6 U+1F1FC | C1061: 🇦🇼 | D1061: Flag for Aruba | F1061: aruba, flag, other
A1062: =1+R[-1]C -> 1061 | B1062: U+1F1E6 U+1F1FD | C1062: 🇦🇽 | D1062: Flag for Åland Islands | F1062: åland, flag, other
A1063: =1+R[-1]C -> 1062 | B1063: U+1F1E6 U+1F1FF | C1063: 🇦🇿 | D1063: Flag for Azerbaijan | F1063: azerbaijan, flag, other
A1064: =1+R[-1]C -> 1063 | B1064: U+1F1E7 U+1F1E6 | C1064: 🇧🇦 | D1064: Flag for Bosnia & Herzegovina | F1064: bosnia, flag, herzegovina, other
A1065: =1+R[-1]C -> 1064 | B1065: U+1F1E7 U+1F1E7 | C1065: 🇧🇧 | D1065: Flag for Barbados | F1065: barbados, flag, other
A1066: =1+R[-1]C -> 1065 | B1066: U+1F1E7 U+1F1E9 | C1066: 🇧🇩 | D1066: Flag for Bangladesh | F1066: bangladesh, flag, other
A1067: =1+R[-1]C -> 1066 | B1067: U+1F1E7 U+1F1EA | C1067: 🇧🇪 | D1067: Flag for Belgium | F1067: belgium, flag, other
A1068: =1+R[-1]C -> 1067 | B1068: U+1F1E7 U+1F1EB | C1068: 🇧🇫 | D1068: Flag for Burkina Faso | F1068: burkina faso, flag, other
A1069: =1+R[-1]C -> 1068 | B1069: U+1F1E7 U+1F1EC | C1069: 🇧🇬 | D1069: Flag for Bulgaria | F1069: bulgaria, flag, other
A1070: =1+R[-1]C -> 1069 | B1070: U+1F1E7 U+1F1ED | C1070: 🇧🇭 | D1070: Flag for Bahrain | F1070: bahrain, flag, other
A1071: =1+R[-1]C -> 1070 | B1071: U+1F1E7 U+1F1EE | C1071: 🇧🇮 | D1071: Flag for Burundi | F1071: burundi, flag, other
A1072: =1+R[-1]C -> 1071 | B1072: U+1F1E7 U+1F1EF | C1072: 🇧🇯 | D1072: Flag for Benin | F1072: benin, flag, other
A1073: =1+R[-1]C -> 1072 | B1073: U+1F1E7 U+1F1F1 | C1073: 🇧🇱 | D1073: Flag for St. Barthélemy | F1073: barthelemy, barthélemy, flag, other, saint
A1074: =1+R[-1]C -> 1073 | B1074: U+1F1E7 U+1F1F2 | C1074: 🇧🇲 | D1074: Flag for Bermuda | F1074: bermuda, flag, other
A1075: =1+R[-1]C -> 1074 | B1075: U+1F1E7 U+1F1F3 | C1075: 🇧🇳 | D1075: Flag for Brunei | F1075: brunei, darussalam, flag, other
A1076: =1+R[-1]C -> 1075 | B1076: U+1F1E7 U+1F1F4 | C1076: 🇧🇴 | D1076: Flag for Bolivia | F1076: bolivia, flag, other
A1077: =1+R[-1]C -> 1076 | B1077: U+1F1E7 U+1F1F6 | C1077: 🇧🇶 | D1077: Flag for Caribbean Netherlands | F1077: bonaire, caribbean, eustatius, flag,netherlands, other, saba, sint
A1078: =1+R[-1]C -> 1077 | B1078: U+1F1E7 U+1F1F7 | C1078: 🇧🇷 | D1078: Flag for Brazil | F1078: brazil, flag, other
A1079: =1+R[-1]C -> 1078 | B1079: U+1F1E7 U+1F1F8 | C1079: 🇧🇸 | D1079: Flag for Bahamas | F1079: bahamas, flag, other
A1080: =1+R[-1]C -> 1079 | B1080: U+1F1E7 U+1F1F9 | C1080: 🇧🇹 | D1080: Flag for Bhutan | F1080: bhutan, flag, other
A1081: =1+R[-1]C -> 1080 | B1081: U+1F1E7 U+1F1FB | C1081: 🇧🇻 | D1081: Flag for Bouvet Island | F1081: bouvet, flag, island, other
A1082: =1+R[-1]C -> 1081 | B1082: U+1F1E7 U+1F1FC | C1082: 🇧🇼 | D1082: Flag for Botswana | F1082: botswana, flag, other
A1083: =1+R[-1]C -> 1082 | B1083: U+1F1E7 U+1F1FE | C1083: 🇧🇾 | D1083: Flag for Belarus | F1083: belarus, flag, other
A1084: =1+R[-1]C -> 1083 | B1084: U+1F1E7 U+1F1FF | C1084: 🇧🇿 | D1084: Flag for Belize | F1084: belize, flag, other
A1085: =1+R[-1]C -> 1084 | B1085: U+1F1E8 U+1F1E6 | C1085: 🇨🇦 | D1085: Flag for Canada | F1085: canada, flag, other
A1086: =1+R[-1]C -> 1085 | B1086: U+1F1E8 U+1F1E8 | C1086: 🇨🇨 | D1086: Flag for Cocos Islands | F1086: cocos, flag, island, keeling, other
A1087: =1+R[-1]C -> 1086 | B1087: U+1F1E8 U+1F1E9 | C1087: 🇨🇩 | D1087: Flag for Congo - Kinshasa | F1087: congo, congo-kinshasa, democratic republic of congo, drc, flag, kinshasa,other, republic
A1088: =1+R[-1]C -> 1087 | B1088: U+1F1E8 U+1F1EB | C1088: 🇨🇫 | D1088: Flag for Central African Republic | F1088: central african republic, flag, other,republic
A1089: =1+R[-1]C -> 1088 | B1089: U+1F1E8 U+1F1EC | C1089: 🇨🇬 | D1089: Flag for Congo - Brazzaville | F1089: brazzaville, congo, congo republic,congo-brazzaville, flag, other, republic,republic of the congo
A1090: =1+R[-1]C -> 1089 | B1090: U+1F1E8 U+1F1ED | C1090: 🇨🇭 | D1090: Flag for Switzerland | F1090: flag, other, switzerland
A1091: =1+R[-1]C -> 1090 | B1091: U+1F1E8 U+1F1EE | C1091: 🇨🇮 | D1091: Flag for Côte d’Ivoire | F1091: cote ivoire, côte ivoire, flag, ivory coast,other
A1092: =1+R[-1]C -> 1091 | B1092: U+1F1E8 U+1F1F0 | C1092: 🇨🇰 | D1092: Flag for Cook Islands | F1092: cook, flag, island, other
A1093: =1+R[-1]C -> 1092 | B1093: U+1F1E8 U+1F1F1 | C1093: 🇨🇱 | D1093: Flag for Chile | F1093: chile, flag, other
A1094: =1+R[-1]C -> 1093 | B1094: U+1F1E8 U+1F1F2 | C1094: 🇨🇲 | D1094: Flag for Cameroon | F1094: cameroon, flag, other
A1095: =1+R[-1]C -> 1094 | B1095: U+1F1E8 U+1F1F3 | C1095: 🇨🇳 | D1095: Flag for China | F1095: china, flag, other
A1096: =1+R[-1]C -> 1095 | B1096: U+1F1E8 U+1F1F4 | C1096: 🇨🇴 | D1096: Flag for Colombia | F1096: colombia, flag, other
A1097: =1+R[-1]C -> 1096 | B1097: U+1F1E8 U+1F1F5 | C1097: 🇨🇵 | D1097: Flag for Clipperton Island | F1097: clipperton, flag, island, other
A1098: =1+R[-1]C -> 1097 | B1098: U+1F1E8 U+1F1F7 | C1098: 🇨🇷 | D1098: Flag for Costa Rica | F1098: costa rica, flag, other
A1099: =1+R[-1]C -> 1098 | B1099: U+1F1E8 U+1F1FA | C1099: 🇨🇺 | D1099: Flag for Cuba | F1099: cuba, flag, other
A1100: =1+R[-1]C -> 1099 | B1100: U+1F1E8 U+1F1FB | C1100: 🇨🇻 | D1100: Flag for Cape Verde | F1100: cabo, cape, flag, other, verde
A1101: =1+R[-1]C -> 1100 | B1101: U+1F1E8 U+1F1FC | C1101: 🇨🇼 | D1101: Flag for Curaçao | F1101: antilles, curacao, curaçao, flag, other
A1102: =1+R[-1]C -> 1101 | B1102: U+1F1E8 U+1F1FD | C1102: 🇨🇽 | D1102: Flag for Christmas Island | F1102: christmas, flag, island, other
A1103: =1+R[-1]C -> 1102 | B1103: U+1F1E8 U+1F1FE | C1103: 🇨🇾 | D1103: Flag for Cyprus | F1103: cyprus, flag, other
A1104: =1+R[-1]C -> 1103 | B1104: U+1F1E8 U+1F1FF | C1104: 🇨🇿 | D1104: Flag for Czech Republic | F1104: czech republic, flag, other
A1105: =1+R[-1]C -> 1104 | B1105: U+1F1E9 U+1F1EA | C1105: 🇩🇪 | D1105: Flag for Germany | F1105: flag, germany, other
A1106: =1+R[-1]C -> 1105 | B1106: U+1F1E9 U+1F1EC | C1106: 🇩🇬 | D1106: Flag for Diego Garcia | F1106: diego garcia, flag, other
A1107: =1+R[-1]C -> 1106 | B1107: U+1F1E9 U+1F1EF | C1107: 🇩🇯 | D1107: Flag for Djibouti | F1107: djibouti, flag, other
A1108: =1+R[-1]C -> 1107 | B1108: U+1F1E9 U+1F1F0 | C1108: 🇩🇰 | D1108: Flag for Denmark | F1108: denmark, flag, other
A1109: =1+R[-1]C -> 1108 | B1109: U+1F1E9 U+1F1F2 | C1109: 🇩🇲 | D1109: Flag for Dominica | F1109: dominica, flag, other
A1110: =1+R[-1]C -> 1109 | B1110: U+1F1E9 U+1F1F4 | C1110: 🇩🇴 | D1110: Flag for Dominican Republic | F1110: dominican republic, flag, other
A1111: =1+R[-1]C -> 1110 | B1111: U+1F1E9 U+1F1FF | C1111: 🇩🇿 | D1111: Flag for Algeria | F1111: algeria, flag, other
A1112: =1+R[-1]C -> 1111 | B1112: U+1F1EA U+1F1E6 | C1112: 🇪🇦 | D1112: Flag for Ceuta & Melilla | F1112: ceuta, flag, melilla, other
A1113: =1+R[-1]C -> 1112 | B1113: U+1F1EA U+1F1E8 | C1113: 🇪🇨 | D1113: Flag for Ecuador | F1113: ecuador, flag, other
A1114: =1+R[-1]C -> 1113 | B1114: U+1F1EA U+1F1EA | C1114: 🇪🇪 | D1114: Flag for Estonia | F1114: estonia, flag, other
A1115: =1+R[-1]C -> 1114 | B1115: U+1F1EA U+1F1EC | C1115: 🇪🇬 | D1115: Flag for Egypt | F1115: egypt, flag, other
A1116: =1+R[-1]C -> 1115 | B1116: U+1F1EA U+1F1ED | C1116: 🇪🇭 | D1116: Flag for Western Sahara | F1116: flag, other, sahara, west, western sahara
A1117: =1+R[-1]C -> 1116 | B1117: U+1F1EA U+1F1F7 | C1117: 🇪🇷 | D1117: Flag for Eritrea | F1117: eritrea, flag, other
A1118: =1+R[-1]C -> 1117 | B1118: U+1F1EA U+1F1F8 | C1118: 🇪🇸 | D1118: Flag for Spain | F1118: flag, other, spain
A1119: =1+R[-1]C -> 1118 | B1119: U+1F1EA U+1F1F9 | C1119: 🇪🇹 | D1119: Flag for Ethiopia | F1119: ethiopia, flag, other
A1120: =1+R[-1]C -> 1119 | B1120: U+1F1EA U+1F1FA | C1120: 🇪🇺 | D1120: Flag for European Union | F1120: european union, flag, other
A1121: =1+R[-1]C -> 1120 | B1121: U+1F1EB U+1F1EE | C1121: 🇫🇮 | D1121: Flag for Finland | F1121: finland, flag, other
A1122: =1+R[-1]C -> 1121 | B1122: U+1F1EB U+1F1EF | C1122: 🇫🇯 | D1122: Flag for Fiji | F1122: fiji, flag, other
A1123: =1+R[-1]C -> 1122 | B1123: U+1F1EB U+1F1F0 | C1123: 🇫🇰 | D1123: Flag for Falkland Islands | F1123: falkland, falklands, flag, island, islas,malvinas, other
A1124: =1+R[-1]C -> 1123 | B1124: U+1F1EB U+1F1F2 | C1124: 🇫🇲 | D1124: Flag for Micronesia | F1124: flag, micronesia, other
A1125: =1+R[-1]C -> 1124 | B1125: U+1F1EB U+1F1F4 | C1125: 🇫🇴 | D1125: Flag for Faroe Islands | F1125: faroe, flag, island, other
A1126: =1+R[-1]C -> 1125 | B1126: U+1F1EB U+1F1F7 | C1126: 🇫🇷 | D1126: Flag for France | F1126: flag, france, other
A1127: =1+R[-1]C -> 1126 | B1127: U+1F1EC U+1F1E6 | C1127: 🇬🇦 | D1127: Flag for Gabon | F1127: flag, gabon, other
A1128: =1+R[-1]C -> 1127 | B1128: U+1F1EC U+1F1E7 | C1128: 🇬🇧 | D1128: Flag for United Kingdom | F1128: britain, british, cornwall, england, flag,great britain, ireland, northern ireland,other, scotland, uk, union jack, united,united kingdom, wales
A1129: =1+R[-1]C -> 1128 | B1129: U+1F1EC U+1F1E9 | C1129: 🇬🇩 | D1129: Flag for Grenada | F1129: flag, grenada, other
A1130: =1+R[-1]C -> 1129 | B1130: U+1F1EC U+1F1EA | C1130: 🇬🇪 | D1130: Flag for Georgia | F1130: flag, georgia, other
A1131: =1+R[-1]C -> 1130 | B1131: U+1F1EC U+1F1EB | C1131: 🇬🇫 | D1131: Flag for French Guiana | F1131: flag, french, guiana, other
A1132: =1+R[-1]C -> 1131 | B1132: U+1F1EC U+1F1EC | C1132: 🇬🇬 | D1132: Flag for Guernsey | F1132: flag, guernsey, other
A1133: =1+R[-1]C -> 1132 | B1133: U+1F1EC U+1F1ED | C1133: 🇬🇭 | D1133: Flag for Ghana | F1133: flag, ghana, other
A1134: =1+R[-1]C -> 1133 | B1134: U+1F1EC U+1F1EE | C1134: 🇬🇮 | D1134: Flag for Gibraltar | F1134: flag, gibraltar, other
A1135: =1+R[-1]C -> 1134 | B1135: U+1F1EC U+1F1F1 | C1135: 🇬🇱 | D1135: Flag for Greenland | F1135: flag, greenland, other
A1136: =1+R[-1]C -> 1135 | B1136: U+1F1EC U+1F1F2 | C1136: 🇬🇲 | D1136: Flag for Gambia | F1136: flag, gambia, other
A1137: =1+R[-1]C -> 1136 | B1137: U+1F1EC U+1F1F3 | C1137: 🇬🇳 | D1137: Flag for Guinea | F1137: flag, guinea, other
A1138: =1+R[-1]C -> 1137 | B1138: U+1F1EC U+1F1F5 | C1138: 🇬🇵 | D1138: Flag for Guadeloupe | F1138: flag, guadeloupe, other
A1139: =1+R[-1]C -> 1138 | B1139: U+1F1EC U+1F1F6 | C1139: 🇬🇶 | D1139: Flag for Equatorial Guinea | F1139: equatorial guinea, flag, guinea, other
A1140: =1+R[-1]C -> 1139 | B1140: U+1F1EC U+1F1F7 | C1140: 🇬🇷 | D1140: Flag for Greece | F1140: flag, greece, other
A1141: =1+R[-1]C -> 1140 | B1141: U+1F1EC U+1F1F8 | C1141: 🇬🇸 | D1141: Flag for South Georgia & South Sandwich Islands | F1141: flag, georgia, island, other, south, south georgia, south sandwich
A1142: =1+R[-1]C -> 1141 | B1142: U+1F1EC U+1F1F9 | C1142: 🇬🇹 | D1142: Flag for Guatemala | F1142: flag, guatemala, other
A1143: =1+R[-1]C -> 1142 | B1143: U+1F1EC U+1F1FA | C1143: 🇬🇺 | D1143: Flag for Guam | F1143: flag, guam, other
A1144: =1+R[-1]C -> 1143 | B1144: U+1F1EC U+1F1FC | C1144: 🇬🇼 | D1144: Flag for Guinea-Bissau | F1144: bissau, flag, guinea, other
A1145: =1+R[-1]C -> 1144 | B1145: U+1F1EC U+1F1FE | C1145: 🇬🇾 | D1145: Flag for Guyana | F1145: flag, guyana, other
A1146: =1+R[-1]C -> 1145 | B1146: U+1F1ED U+1F1F0 | C1146: 🇭🇰 | D1146: Flag for Hong Kong | F1146: china, flag, hong kong, other
A1147: =1+R[-1]C -> 1146 | B1147: U+1F1ED U+1F1F2 | C1147: 🇭🇲 | D1147: Flag for Heard & McDonald Islands | F1147: flag, heard, island, mcdonald, other
A1148: =1+R[-1]C -> 1147 | B1148: U+1F1ED U+1F1F3 | C1148: 🇭🇳 | D1148: Flag for Honduras | F1148: flag, honduras, other
A1149: =1+R[-1]C -> 1148 | B1149: U+1F1ED U+1F1F7 | C1149: 🇭🇷 | D1149: Flag for Croatia | F1149: croatia, flag, other
A1150: =1+R[-1]C -> 1149 | B1150: U+1F1ED U+1F1F9 | C1150: 🇭🇹 | D1150: Flag for Haiti | F1150: flag, haiti, other
A1151: =1+R[-1]C -> 1150 | B1151: U+1F1ED U+1F1FA | C1151: 🇭🇺 | D1151: Flag for Hungary | F1151: flag, hungary, other
A1152: =1+R[-1]C -> 1151 | B1152: U+1F1EE U+1F1E8 | C1152: 🇮🇨 | D1152: Flag for Canary Islands | F1152: canary, flag, island, other
A1153: =1+R[-1]C -> 1152 | B1153: U+1F1EE U+1F1E9 | C1153: 🇮🇩 | D1153: Flag for Indonesia | F1153: flag, indonesia, other
A1154: =1+R[-1]C -> 1153 | B1154: U+1F1EE U+1F1EA | C1154: 🇮🇪 | D1154: Flag for Ireland | F1154: flag, ireland, other
A1155: =1+R[-1]C -> 1154 | B1155: U+1F1EE U+1F1F1 | C1155: 🇮🇱 | D1155: Flag for Israel | F1155: flag, israel, other
A1156: =1+R[-1]C -> 1155 | B1156: U+1F1EE U+1F1F2 | C1156: 🇮🇲 | D1156: Flag for Isle of Man | F1156: flag, isle of man, other
A1157: =1+R[-1]C -> 1156 | B1157: U+1F1EE U+1F1F3 | C1157: 🇮🇳 | D1157: Flag for India | F1157: flag, india, other
A1158: =1+R[-1]C -> 1157 | B1158: U+1F1EE U+1F1F4 | C1158: 🇮🇴 | D1158: Flag for British Indian Ocean Territory | F1158: british, chagos, flag, indian ocean, island,other
A1159: =1+R[-1]C -> 1158 | B1159: U+1F1EE U+1F1F6 | C1159: 🇮🇶 | D1159: Flag for Iraq | F1159: flag, iraq, other
A1160: =1+R[-1]C -> 1159 | B1160: U+1F1EE U+1F1F7 | C1160: 🇮🇷 | D1160: Flag for Iran | F1160: flag, iran, other
A1161: =1+R[-1]C -> 1160 | B1161: U+1F1EE U+1F1F8 | C1161: 🇮🇸 | D1161: Flag for Iceland | F1161: flag, iceland, other
A1162: =1+R[-1]C -> 1161 | B1162: U+1F1EE U+1F1F9 | C1162: 🇮🇹 | D1162: Flag for Italy | F1162: flag, italy, other
A1163: =1+R[-1]C -> 1162 | B1163: U+1F1EF U+1F1EA | C1163: 🇯🇪 | D1163: Flag for Jersey | F1163: flag, jersey, other
A1164: =1+R[-1]C -> 1163 | B1164: U+1F1EF U+1F1F2 | C1164: 🇯🇲 | D1164: Flag for Jamaica | F1164: flag, jamaica, other
A1165: =1+R[-1]C -> 1164 | B1165: U+1F1EF U+1F1F4 | C1165: 🇯🇴 | D1165: Flag for Jordan | F1165: flag, jordan, other
A1166: =1+R[-1]C -> 1165 | B1166: U+1F1EF U+1F1F5 | C1166: 🇯🇵 | D1166: Flag for Japan | F1166: flag, japan, other
A1167: =1+R[-1]C -> 1166 | B1167: U+1F1F0 U+1F1EA | C1167: 🇰🇪 | D1167: Flag for Kenya | F1167: flag, kenya, other
A1168: =1+R[-1]C -> 1167 | B1168: U+1F1F0 U+1F1EC | C1168: 🇰🇬 | D1168: Flag for Kyrgyzstan | F1168: flag, kyrgyzstan, other
A1169: =1+R[-1]C -> 1168 | B1169: U+1F1F0 U+1F1ED | C1169: 🇰🇭 | D1169: Flag for Cambodia | F1169: cambodia, flag, other
A1170: =1+R[-1]C -> 1169 | B1170: U+1F1F0 U+1F1EE | C1170: 🇰🇮 | D1170: Flag for Kiribati | F1170: flag, kiribati, other
A1171: =1+R[-1]C -> 1170 | B1171: U+1F1F0 U+1F1F2 | C1171: 🇰🇲 | D1171: Flag for Comoros | F1171: comoros, flag, other
A1172: =1+R[-1]C -> 1171 | B1172: U+1F1F0 U+1F1F3 | C1172: 🇰🇳 | D1172: Flag for St. Kitts & Nevis | F1172: flag, kitts, nevis, other, saint
A1173: =1+R[-1]C -> 1172 | B1173: U+1F1F0 U+1F1F5 | C1173: 🇰🇵 | D1173: Flag for North Korea | F1173: flag, korea, north, north korea, other
A1174: =1+R[-1]C -> 1173 | B1174: U+1F1F0 U+1F1F7 | C1174: 🇰🇷 | D1174: Flag for South Korea | F1174: flag, korea, other, south, south korea
A1175: =1+R[-1]C -> 1174 | B1175: U+1F1F0 U+1F1FC | C1175: 🇰🇼 | D1175: Flag for Kuwait | F1175: flag, kuwait, other
A1176: =1+R[-1]C -> 1175 | B1176: U+1F1F0 U+1F1FE | C1176: 🇰🇾 | D1176: Flag for Cayman Islands | F1176: cayman, flag, island, other
A1177: =1+R[-1]C -> 1176 | B1177: U+1F1F0 U+1F1FF | C1177: 🇰🇿 | D1177: Flag for Kazakhstan | F1177: flag, kazakhstan, other
A1178: =1+R[-1]C -> 1177 | B1178: U+1F1F1 U+1F1E6 | C1178: 🇱🇦 | D1178: Flag for Laos | F1178: flag, laos, other
A1179: =1+R[-1]C -> 1178 | B1179: U+1F1F1 U+1F1E7 | C1179: 🇱🇧 | D1179: Flag for Lebanon | F1179: flag, lebanon, other
A1180: =1+R[-1]C -> 1179 | B1180: U+1F1F1 U+1F1E8 | C1180: 🇱🇨 | D1180: Flag for St. Lucia | F1180: flag, lucia, other, saint
A1181: =1+R[-1]C -> 1180 | B1181: U+1F1F1 U+1F1EE | C1181: 🇱🇮 | D1181: Flag for Liechtenstein | F1181: flag, liechtenstein, other
A1182: =1+R[-1]C -> 1181 | B1182: U+1F1F1 U+1F1F0 | C1182: 🇱🇰 | D1182: Flag for Sri Lanka | F1182: flag, other, sri lanka
A1183: =1+R[-1]C -> 1182 | B1183: U+1F1F1 U+1F1F7 | C1183: 🇱🇷 | D1183: Flag for Liberia | F1183: flag, liberia, other
A1184: =1+R[-1]C -> 1183 | B1184: U+1F1F1 U+1F1F8 | C1184: 🇱🇸 | D1184: Flag for Lesotho | F1184: flag, lesotho, other
A1185: =1+R[-1]C -> 1184 | B1185: U+1F1F1 U+1F1F9 | C1185: 🇱🇹 | D1185: Flag for Lithuania | F1185: flag, lithuania, other
A1186: =1+R[-1]C -> 1185 | B1186: U+1F1F1 U+1F1FA | C1186: 🇱🇺 | D1186: Flag for Luxembourg | F1186: flag, luxembourg, other
A1187: =1+R[-1]C -> 1186 | B1187: U+1F1F1 U+1F1FB | C1187: 🇱🇻 | D1187: Flag for Latvia | F1187: flag, latvia, other
A1188: =1+R[-1]C -> 1187 | B1188: U+1F1F1 U+1F1FE | C1188: 🇱🇾 | D1188: Flag for Libya | F1188: flag, libya, other
A1189: =1+R[-1]C -> 1188 | B1189: U+1F1F2 U+1F1E6 | C1189: 🇲🇦 | D1189: Flag for Morocco | F1189: flag, morocco, other
A1190: =1+R[-1]C -> 1189 | B1190: U+1F1F2 U+1F1E8 | C1190: 🇲🇨 | D1190: Flag for Monaco | F1190: flag, monaco, other
A1191: =1+R[-1]C -> 1190 | B1191: U+1F1F2 U+1F1E9 | C1191: 🇲🇩 | D1191: Flag for Moldova | F1191: flag, moldova, other
A1192: =1+R[-1]C -> 1191 | B1192: U+1F1F2 U+1F1EA | C1192: 🇲🇪 | D1192: Flag for Montenegro | F1192: flag, montenegro, other
A1193: =1+R[-1]C -> 1192 | B1193: U+1F1F2 U+1F1EB | C1193: 🇲🇫 | D1193: Flag for St. Martin | F1193: flag, french, martin, other, saint
A1194: =1+R[-1]C -> 1193 | B1194: U+1F1F2 U+1F1EC | C1194: 🇲🇬 | D1194: Flag for Madagascar | F1194: flag, madagascar, other
A1195: =1+R[-1]C -> 1194 | B1195: U+1F1F2 U+1F1ED | C1195: 🇲🇭 | D1195: Flag for Marshall Islands | F1195: flag, island, marshall, other
A1196: =1+R[-1]C -> 1195 | B1196: U+1F1F2 U+1F1F0 | C1196: 🇲🇰 | D1196: Flag for Macedonia | F1196: flag, macedonia, other
A1197: =1+R[-1]C -> 1196 | B1197: U+1F1F2 U+1F1F1 | C1197: 🇲🇱 | D1197: Flag for Mali | F1197: flag, mali, other
A1198: =1+R[-1]C -> 1197 | B1198: U+1F1F2 U+1F1F2 | C1198: 🇲🇲 | D1198: Flag for Myanmar | F1198: burma, flag, myanmar, other
A1199: =1+R[-1]C -> 1198 | B1199: U+1F1F2 U+1F1F3 | C1199: 🇲🇳 | D1199: Flag for Mongolia | F1199: flag, mongolia, other
A1200: =1+R[-1]C -> 1199 | B1200: U+1F1F2 U+1F1F4 | C1200: 🇲🇴 | D1200: Flag for Macau | F1200: china, flag, macao, macau, other
A1201: =1+R[-1]C -> 1200 | B1201: U+1F1F2 U+1F1F5 | C1201: 🇲🇵 | D1201: Flag for Northern Mariana Islands | F1201: flag, island, mariana, north, northern mariana, other
A1202: =1+R[-1]C -> 1201 | B1202: U+1F1F2 U+1F1F6 | C1202: 🇲🇶 | D1202: Flag for Martinique | F1202: flag, martinique, other
A1203: =1+R[-1]C -> 1202 | B1203: U+1F1F2 U+1F1F7 | C1203: 🇲🇷 | D1203: Flag for Mauritania | F1203: flag, mauritania, other
A1204: =1+R[-1]C -> 1203 | B1204: U+1F1F2 U+1F1F8 | C1204: 🇲🇸 | D1204: Flag for Montserrat | F1204: flag, montserrat, other
A1205: =1+R[-1]C -> 1204 | B1205: U+1F1F2 U+1F1F9 | C1205: 🇲🇹 | D1205: Flag for Malta | F1205: flag, malta, other
A1206: =1+R[-1]C -> 1205 | B1206: U+1F1F2 U+1F1FA | C1206: 🇲🇺 | D1206: Flag for Mauritius | F1206: flag, mauritius, other
A1207: =1+R[-1]C -> 1206 | B1207: U+1F1F2 U+1F1FB | C1207: 🇲🇻 | D1207: Flag for Maldives | F1207: flag, maldives, other
A1208: =1+R[-1]C -> 1207 | B1208: U+1F1F2 U+1F1FC | C1208: 🇲🇼 | D1208: Flag for Malawi | F1208: flag, malawi, other
A1209: =1+R[-1]C -> 1208 | B1209: U+1F1F2 U+1F1FD | C1209: 🇲🇽 | D1209: Flag for Mexico | F1209: flag, mexico, other
A1210: =1+R[-1]C -> 1209 | B1210: U+1F1F2 U+1F1FE | C1210: 🇲🇾 | D1210: Flag for Malaysia | F1210: flag, malaysia, other
A1211: =1+R[-1]C -> 1210 | B1211: U+1F1F2 U+1F1FF | C1211: 🇲🇿 | D1211: Flag for Mozambique | F1211: flag, mozambique, other
A1212: =1+R[-1]C -> 1211 | B1212: U+1F1F3 U+1F1E6 | C1212: 🇳🇦 | D1212: Flag for Namibia | F1212: flag, namibia, other
A1213: =1+R[-1]C -> 1212 | B1213: U+1F1F3 U+1F1E8 | C1213: 🇳🇨 | D1213: Flag for New Caledonia | F1213: flag, new, new caledonia, other
A1214: =1+R[-1]C -> 1213 | B1214: U+1F1F3 U+1F1EA | C1214: 🇳🇪 | D1214: Flag for Niger | F1214: flag, niger, other
A1215: =1+R[-1]C -> 1214 | B1215: U+1F1F3 U+1F1EB | C1215: 🇳🇫 | D1215: Flag for Norfolk Island | F1215: flag, island, norfolk, other
A1216: =1+R[-1]C -> 1215 | B1216: U+1F1F3 U+1F1EC | C1216: 🇳🇬 | D1216: Flag for Nigeria | F1216: flag, nigeria, other
A1217: =1+R[-1]C -> 1216 | B1217: U+1F1F3 U+1F1EE | C1217: 🇳🇮 | D1217: Flag for Nicaragua | F1217: flag, nicaragua, other
A1218: =1+R[-1]C -> 1217 | B1218: U+1F1F3 U+1F1F1 | C1218: 🇳🇱 | D1218: Flag for Netherlands | F1218: flag, netherlands, other
A1219: =1+R[-1]C -> 1218 | B1219: U+1F1F3 U+1F1F4 | C1219: 🇳🇴 | D1219: Flag for Norway | F1219: flag, norway, other
A1220: =1+R[-1]C -> 1219 | B1220: U+1F1F3 U+1F1F5 | C1220: 🇳🇵 | D1220: Flag for Nepal | F1220: flag, nepal, other
A1221: =1+R[-1]C -> 1220 | B1221: U+1F1F3 U+1F1F7 | C1221: 🇳🇷 | D1221: Flag for Nauru | F1221: flag, nauru, other
A1222: =1+R[-1]C -> 1221 | B1222: U+1F1F3 U+1F1FA | C1222: 🇳🇺 | D1222: Flag for Niue | F1222: flag, niue, other
A1223: =1+R[-1]C -> 1222 | B1223: U+1F1F3 U+1F1FF | C1223: 🇳🇿 | D1223: Flag for New Zealand | F1223: flag, new, new zealand, other
A1224: =1+R[-1]C -> 1223 | B1224: U+1F1F4 U+1F1F2 | C1224: 🇴🇲 | D1224: Flag for Oman | F1224: flag, oman, other
A1225: =1+R[-1]C -> 1224 | B1225: U+1F1F5 U+1F1E6 | C1225: 🇵🇦 | D1225: Flag for Panama | F1225: flag, other, panama
A1226: =1+R[-1]C -> 1225 | B1226: U+1F1F5 U+1F1EA | C1226: 🇵🇪 | D1226: Flag for Peru | F1226: flag, other, peru
A1227: =1+R[-1]C -> 1226 | B1227: U+1F1F5 U+1F1EB | C1227: 🇵🇫 | D1227: Flag for French Polynesia | F1227: flag, french, other, polynesia
A1228: =1+R[-1]C -> 1227 | B1228: U+1F1F5 U+1F1EC | C1228: 🇵🇬 | D1228: Flag for Papua New Guinea | F1228: flag, guinea, new, other, papua new guinea
A1229: =1+R[-1]C -> 1228 | B1229: U+1F1F5 U+1F1ED | C1229: 🇵🇭 | D1229: Flag for Philippines | F1229: flag, other, philippines
A1230: =1+R[-1]C -> 1229 | B1230: U+1F1F5 U+1F1F0 | C1230: 🇵🇰 | D1230: Flag for Pakistan | F1230: flag, other, pakistan
A1231: =1+R[-1]C -> 1230 | B1231: U+1F1F5 U+1F1F1 | C1231: 🇵🇱 | D1231: Flag for Poland | F1231: flag, other, poland
A1232: =1+R[-1]C -> 1231 | B1232: U+1F1F5 U+1F1F2 | C1232: 🇵🇲 | D1232: Flag for St. Pierre & Miquelon | F1232: flag, miquelon, other, pierre, saint
A1233: =1+R[-1]C -> 1232 | B1233: U+1F1F5 U+1F1F3 | C1233: 🇵🇳 | D1233: Flag for Pitcairn Islands | F1233: flag, island, other, pitcairn
A1234: =1+R[-1]C -> 1233 | B1234: U+1F1F5 U+1F1F7 | C1234: 🇵🇷 | D1234: Flag for Puerto Rico | F1234: flag, other, puerto rico
A1235: =1+R[-1]C -> 1234 | B1235: U+1F1F5 U+1F1F8 | C1235: 🇵🇸 | D1235: Flag for Palestinian Territories | F1235: flag, other, palestine
A1236: =1+R[-1]C -> 1235 | B1236: U+1F1F5 U+1F1F9 | C1236: 🇵🇹 | D1236: Flag for Portugal | F1236: flag, other, portugal
A1237: =1+R[-1]C -> 1236 | B1237: U+1F1F5 U+1F1FC | C1237: 🇵🇼 | D1237: Flag for Palau | F1237: flag, other, palau
A1238: =1+R[-1]C -> 1237 | B1238: U+1F1F5 U+1F1FE | C1238: 🇵🇾 | D1238: Flag for Paraguay | F1238: flag, other, paraguay
A1239: =1+R[-1]C -> 1238 | B1239: U+1F1F6 U+1F1E6 | C1239: 🇶🇦 | D1239: Flag for Qatar | F1239: flag, other, qatar
A1240: =1+R[-1]C -> 1239 | B1240: U+1F1F7 U+1F1EA | C1240: 🇷🇪 | D1240: Flag for Réunion | F1240: flag, other, reunion, réunion
A1241: =1+R[-1]C -> 1240 | B1241: U+1F1F7 U+1F1F4 | C1241: 🇷🇴 | D1241: Flag for Romania | F1241: flag, other, romania
A1242: =1+R[-1]C -> 1241 | B1242: U+1F1F7 U+1F1F8 | C1242: 🇷🇸 | D1242: Flag for Serbia | F1242: flag, other, serbia
A1243: =1+R[-1]C -> 1242 | B1243: U+1F1F7 U+1F1FA | C1243: 🇷🇺 | D1243: Flag for Russia | F1243: flag, other, russia
A1244: =1+R[-1]C -> 1243 | B1244: U+1F1F7 U+1F1FC | C1244: 🇷🇼 | D1244: Flag for Rwanda | F1244: flag, other, rwanda
A1245: =1+R[-1]C -> 1244 | B1245: U+1F1F8 U+1F1E6 | C1245: 🇸🇦 | D1245: Flag for Saudi Arabia | F1245: flag, other, saudi arabia
A1246: =1+R[-1]C -> 1245 | B1246: U+1F1F8 U+1F1E7 | C1246: 🇸🇧 | D1246: Flag for Solomon Islands | F1246: flag, island, other, solomon
A1247: =1+R[-1]C -> 1246 | B1247: U+1F1F8 U+1F1E8 | C1247: 🇸🇨 | D1247: Flag for Seychelles | F1247: flag, other, seychelles
A1248: =1+R[-1]C -> 1247 | B1248: U+1F1F8 U+1F1E9 | C1248: 🇸🇩 | D1248: Flag for Sudan | F1248: flag, other, sudan
A1249: =1+R[-1]C -> 1248 | B1249: U+1F1F8 U+1F1EA | C1249: 🇸🇪 | D1249: Flag for Sweden | F1249: flag, other, sweden
A1250: =1+R[-1]C -> 1249 | B1250: U+1F1F8 U+1F1EC | C1250: 🇸🇬 | D1250: Flag for Singapore | F1250: flag, other, singapore
A1251: =1+R[-1]C -> 1250 | B1251: U+1F1F8 U+1F1ED | C1251: 🇸🇭 | D1251: Flag for St. Helena | F1251: flag, helena, other, saint
A1252: =1+R[-1]C -> 1251 | B1252: U+1F1F8 U+1F1EE | C1252: 🇸🇮 | D1252: Flag for Slovenia | F1252: flag, other, slovenia
A1253: =1+R[-1]C -> 1252 | B1253: U+1F1F8 U+1F1EF | C1253: 🇸🇯 | D1253: Flag for Svalbard & Jan Mayen | F1253: flag, jan mayen, other, svalbard
A1254: =1+R[-1]C -> 1253 | B1254: U+1F1F8 U+1F1F0 | C1254: 🇸🇰 | D1254: Flag for Slovakia | F1254: flag, other, slovakia
A1255: =1+R[-1]C -> 1254 | B1255: U+1F1F8 U+1F1F1 | C1255: 🇸🇱 | D1255: Flag for Sierra Leone | F1255: flag, other, sierra leone
A1256: =1+R[-1]C -> 1255 | B1256: U+1F1F8 U+1F1F2 | C1256: 🇸🇲 | D1256: Flag for San Marino | F1256: flag, other, san marino
A1257: =1+R[-1]C -> 1256 | B1257: U+1F1F8 U+1F1F3 | C1257: 🇸🇳 | D1257: Flag for Senegal | F1257: flag, other, senegal
A1258: =1+R[-1]C -> 1257 | B1258: U+1F1F8 U+1F1F4 | C1258: 🇸🇴 | D1258: Flag for Somalia | F1258: flag, other, somalia
A1259: =1+R[-1]C -> 1258 | B1259: U+1F1F8 U+1F1F7 | C1259: 🇸🇷 | D1259: Flag for Suriname | F1259: flag, other, suriname
A1260: =1+R[-1]C -> 1259 | B1260: U+1F1F8 U+1F1F8 | C1260: 🇸🇸 | D1260: Flag for South Sudan | F1260: flag, other, south, south sudan, sudan
A1261: =1+R[-1]C -> 1260 | B1261: U+1F1F8 U+1F1F9 | C1261: 🇸🇹 | D1261: Flag for São Tomé & Príncipe | F1261: flag, other, principe, príncipe, sao tome,são tomé
A1262: =1+R[-1]C -> 1261 | B1262: U+1F1F8 U+1F1FB | C1262: 🇸🇻 | D1262: Flag for El Salvador | F1262: el salvador, flag, other
A1263: =1+R[-1]C -> 1262 | B1263: U+1F1F8 U+1F1FD | C1263: 🇸🇽 | D1263: Flag for Sint Maarten | F1263: flag, maarten, other, sint
A1264: =1+R[-1]C -> 1263 | B1264: U+1F1F8 U+1F1FE | C1264: 🇸🇾 | D1264: Flag for Syria | F1264: flag, other, syria
A1265: =1+R[-1]C -> 1264 | B1265: U+1F1F8 U+1F1FF | C1265: 🇸🇿 | D1265: Flag for Swaziland | F1265: flag, other, swaziland
A1266: =1+R[-1]C -> 1265 | B1266: U+1F1F9 U+1F1E6 | C1266: 🇹🇦 | D1266: Flag for Tristan da Cunha | F1266: flag, other, tristan da cunha
A1267: =1+R[-1]C -> 1266 | B1267: U+1F1F9 U+1F1E8 | C1267: 🇹🇨 | D1267: Flag for Turks & Caicos Islands | F1267: caicos, flag, island, other, turks
A1268: =1+R[-1]C -> 1267 | B1268: U+1F1F9 U+1F1E9 | C1268: 🇹🇩 | D1268: Flag for Chad | F1268: chad, flag, other
A1269: =1+R[-1]C -> 1268 | B1269: U+1F1F9 U+1F1EB | C1269: 🇹🇫 | D1269: Flag for French Southern Territories | F1269: antarctic, flag, french, other
A1270: =1+R[-1]C -> 1269 | B1270: U+1F1F9 U+1F1EC | C1270: 🇹🇬 | D1270: Flag for Togo | F1270: flag, other, togo
A1271: =1+R[-1]C -> 1270 | B1271: U+1F1F9 U+1F1ED | C1271: 🇹🇭 | D1271: Flag for Thailand | F1271: flag, other, thailand
A1272: =1+R[-1]C -> 1271 | B1272: U+1F1F9 U+1F1EF | C1272: 🇹🇯 | D1272: Flag for Tajikistan | F1272: flag, other, tajikistan
A1273: =1+R[-1]C -> 1272 | B1273: U+1F1F9 U+1F1F0 | C1273: 🇹🇰 | D1273: Flag for Tokelau | F1273: flag, other, tokelau
A1274: =1+R[-1]C -> 1273 | B1274: U+1F1F9 U+1F1F1 | C1274: 🇹🇱 | D1274: Flag for Timor-Leste | F1274: east, east timor, flag, other, timor-leste
A1275: =1+R[-1]C -> 1274 | B1275: U+1F1F9 U+1F1F2 | C1275: 🇹🇲 | D1275: Flag for Turkmenistan | F1275: flag, other, turkmenistan
A1276: =1+R[-1]C -> 1275 | B1276: U+1F1F9 U+1F1F3 | C1276: 🇹🇳 | D1276: Flag for Tunisia | F1276: flag, other, tunisia
A1277: =1+R[-1]C -> 1276 | B1277: U+1F1F9 U+1F1F4 | C1277: 🇹🇴 | D1277: Flag for Tonga | F1277: flag, other, tonga
A1278: =1+R[-1]C -> 1277 | B1278: U+1F1F9 U+1F1F7 | C1278: 🇹🇷 | D1278: Flag for Turkey | F1278: flag, other, turkey
A1279: =1+R[-1]C -> 1278 | B1279: U+1F1F9 U+1F1F9 | C1279: 🇹🇹 | D1279: Flag for Trinidad & Tobago | F1279: flag, other, tobago, trinidad
A1280: =1+R[-1]C -> 1279 | B1280: U+1F1F9 U+1F1FB | C1280: 🇹🇻 | D1280: Flag for Tuvalu | F1280: flag, other, tuvalu
A1281: =1+R[-1]C -> 1280 | B1281: U+1F1F9 U+1F1FC | C1281: 🇹🇼 | D1281: Flag for Taiwan | F1281: china, flag, other, taiwan
A1282: =1+R[-1]C -> 1281 | B1282: U+1F1F9 U+1F1FF | C1282: 🇹🇿 | D1282: Flag for Tanzania | F1282: flag, other, tanzania
A1283: =1+R[-1]C -> 1282 | B1283: U+1F1FA U+1F1E6 | C1283: 🇺🇦 | D1283: Flag for Ukraine | F1283: flag, other, ukraine
A1284: =1+R[-1]C -> 1283 | B1284: U+1F1FA U+1F1EC | C1284: 🇺🇬 | D1284: Flag for Uganda | F1284: flag, other, uganda
A1285: =1+R[-1]C -> 1284 | B1285: U+1F1FA U+1F1F2 | C1285: 🇺🇲 | D1285: Flag for U.S. Outlying Islands | F1285: america, flag, island, minor outlying,other, united, united states, us, usa
A1286: =1+R[-1]C -> 1285 | B1286: U+1F1FA U+1F1F8 | C1286: 🇺🇸 | D1286: Flag for United States | F1286: america, flag, other, stars and stripes,united, united states
A1287: =1+R[-1]C -> 1286 | B1287: U+1F1FA U+1F1FE | C1287: 🇺🇾 | D1287: Flag for Uruguay | F1287: flag, other, uruguay
A1288: =1+R[-1]C -> 1287 | B1288: U+1F1FA U+1F1FF | C1288: 🇺🇿 | D1288: Flag for Uzbekistan | F1288: flag, other, uzbekistan
A1289: =1+R[-1]C -> 1288 | B1289: U+1F1FB U+1F1E6 | C1289: 🇻🇦 | D1289: Flag for Vatican City | F1289: flag, other, vatican
A1290: =1+R[-1]C -> 1289 | B1290: U+1F1FB U+1F1E8 | C1290: 🇻🇨 | D1290: Flag for St. Vincent & Grenadines | F1290: flag, grenadines, other, saint, vincent
A1291: =1+R[-1]C -> 1290 | B1291: U+1F1FB U+1F1EA | C1291: 🇻🇪 | D1291: Flag for Venezuela | F1291: flag, other, venezuela
A1292: =1+R[-1]C -> 1291 | B1292: U+1F1FB U+1F1EC | C1292: 🇻🇬 | D1292: Flag for British Virgin Islands | F1292: british, flag, island, other, virgin
A1293: =1+R[-1]C -> 1292 | B1293: U+1F1FB U+1F1EE | C1293: 🇻🇮 | D1293: Flag for U.S. Virgin Islands | F1293: america, american, flag, island, other,united, united states, us, usa, virgin
A1294: =1+R[-1]C -> 1293 | B1294: U+1F1FB U+1F1F3 | C1294: 🇻🇳 | D1294: Flag for Vietnam | F1294: flag, other, viet nam, vietnam
A1295: =1+R[-1]C -> 1294 | B1295: U+1F1FB U+1F1FA | C1295: 🇻🇺 | D1295: Flag for Vanuatu | F1295: flag, other, vanuatu
A1296: =1+R[-1]C -> 1295 | B1296: U+1F1FC U+1F1EB | C1296: 🇼🇫 | D1296: Flag for Wallis & Futuna | F1296: flag, futuna, other, wallis
A1297: =1+R[-1]C -> 1296 | B1297: U+1F1FC U+1F1F8 | C1297: 🇼🇸 | D1297: Flag for Samoa | F1297: flag, other, samoa
A1298: =1+R[-1]C -> 1297 | B1298: U+1F1FD U+1F1F0 | C1298: 🇽🇰 | D1298: Flag for Kosovo | F1298: flag, kosovo, other
A1299: =1+R[-1]C -> 1298 | B1299: U+1F1FE U+1F1EA | C1299: 🇾🇪 | D1299: Flag for Yemen | F1299: flag, other, yemen
A1300: =1+R[-1]C -> 1299 | B1300: U+1F1FE U+1F1F9 | C1300: 🇾🇹 | D1300: Flag for Mayotte | F1300: flag, mayotte, other
A1301: =1+R[-1]C -> 1300 | B1301: U+1F1FF U+1F1E6 | C1301: 🇿🇦 | D1301: Flag for South Africa | F1301: flag, other, south, south africa
A1302: =1+R[-1]C -> 1301 | B1302: U+1F1FF U+1F1F2 | C1302: 🇿🇲 | D1302: Flag for Zambia | F1302: flag, other, zambia
A1303: =1+R[-1]C -> 1302 | B1303: U+1F1FF U+1F1FC | C1303: 🇿🇼 | D1303: Flag for Zimbabwe | F1303: flag, other, zimbabwe